"cpc_code","title","title_cpc_codes","informative_references","informative_references_cpc_codes","special_rules","special_rules_cpc_codes","glossary_of_terms","definition_statement"
"B28B7/164","{for plates, panels, or similar sheet- or disc-shaped articles}","","","","","","","This place covers: Illustrative example of subject matter classified in this group:"
"B28B7/166","{for oblong articles, e.g. hollow masts}","","","","","","","This place covers: Illustrative example of subject matter classified in this group:"
"B28B7/168","{for holders or similar hollow articles, e.g. vaults, sewer pits}","","","","","","","This place covers: Illustrative example of subject matter classified in this group:"
"B28B7/18","the holes passing completely through the article","","","","","","","This place covers: Illustrative example of subject matter classified in this group:"
"B28B7/183","{for building blocks or similar block-shaped objects}","","","","","","","This place covers: Illustrative example of subject matter classified in this group:"
"B28B7/186","{for plates, panels or similar sheet- or disc-shaped objects, also flat oblong moulded articles with lateral openings, e.g. panels with openings for doors or windows, grated girders}","","","","","","","This place covers: Illustrative example of subject matter classified in this group:"
"B28B7/20","Moulds for making shaped articles with undercut recesses, e.g. dovetails","","","","","","","This place covers: Illustrative example of subject matter classified in this group:"
"B28B7/22","Moulds for making units for prefabricated buildings {, i.e. units each comprising an important section of at least two limiting planes of a room or space, e.g. cells  (for making rooms or entire buildings in situ E04G11/02)}; Moulds for making prefabricated stair units","E04G11/02","","","","","","This place covers: Illustrative example of subject matter classified in this group:"
"B28B7/225","{for making stairs or stair units comprising more than one step  (in situ E04G13/06)}","E04G13/06","","","","","","This place covers: Illustrative example of subject matter classified in this group:"
"B28B7/24","Unitary mould structures with a plurality of moulding spaces {, e.g. moulds divided into multiple moulding spaces by integratable partitions, mould part structures providing a number of moulding spaces in mutual co-operation  (assemblies of individually complete moulds B28B7/26)}","B28B7/26","","","","","","This place covers: Illustrative example of subject matter classified in this group:"
"B28B7/241","{Detachable assemblies of mould parts providing only in mutual co-operation a number of complete moulding spaces}","","","","","","","This place covers: Illustrative example of subject matter classified in this group:"
"B28B7/243","{for making plates, panels or similar sheet- or disc-shaped objects}","","","","","","","This place covers: Illustrative example of subject matter classified in this group:"
"B28B7/245","{using transportable mould batteries}","","","","","","","This place covers: Illustrative example of subject matter classified in this group:"
"B28B7/246","{for making oblong objects, e.g. girders}","","","","","","","This place covers: Illustrative example of subject matter classified in this group:"
"B28B7/248","{using angle-shaped mould parts, e.g. L-parts}","","","","","","","This place covers: Illustrative example of subject matter classified in this group:"
"B28B7/26","Assemblies of separate moulds {, i.e. of moulds or moulding space units, each forming a complete mould or moulding space unit independently from each other}","","","","","","","This place covers: Illustrative example of subject matter classified in this group:"
"B28B7/28","Cores; Mandrels {(B28B1/44 takes precedence; of special materials in general B28B7/34; cores for making blind holes in situ E04G15/04; for making recesses E04G15/06)}","B28B1/44|B28B7/34|E04G15/04|E04G15/06","Of special materials in general","B28B7/34","","","","This place covers: Illustrative example of subject matter classified in this group:"
"B28B7/30","adjustable, collapsible, or expanding {(for making tubular objects B28B21/88)}","B28B21/88","","","","","","This place covers: Illustrative example of subject matter classified in this group:"
"B28B7/303","{specially for making undercut recesses or continuous cavities the inner section of which is superior to the section of either of the mouths}","","","","","","","This place covers: Illustrative example of subject matter classified in this group:"
"B28B7/306","{pliable or extensible}","","","","","","","This place covers: Illustrative example of subject matter classified in this group:"
"B28B7/32","inflatable {(connection of valves to inflatable elastic bodies B60C29/00)}","B60C29/00","","","","","","This place covers: Illustrative example of subject matter classified in this group:"
"B28B7/362","{specially for making moulded articles from concrete with exposed aggregate}","","","","","","","This place covers: For example wax paper or a retarder directly applied to the surface moulding cavity."
"B28B7/366","{Replaceable lining plates for press mould}","","","","","","","This place covers: Illustrative example of subject matter classified in this group:"
"B28B7/388","{with liquid material, e.g. lubricating}","","","","","","",""
"B28B7/40","characterised by means for modifying the properties of the moulding material","","","","","","","This place covers: The properties of the moulding material are modified while the article is still in contact with the mould, core, mandrel."
"B28B7/42","for heating or cooling, e.g. steam jackets {, by means of treating agents acting directly on the moulding material}","","","","","","","This place covers: Illustrative example of subject matter classified in this group:"
"B28B7/44","for treating with gases or degassing, e.g. for de-aerating {(treating with hot gases or vapour B28B7/42)}","B28B7/42","For chemical aspects of treating with gasses, for example treatment of concrete with CO2-gas.","C04B","","","",""
"B28B7/46","for humidifying or dehumidifying","","","","","","","This place covers: Illustrative example of subject matter classified in this group:"
"B28B7/465","{Applying setting liquid to dry mixtures}","","Rapid manufacturing and prototyping of 3D objects by using a combination of solid and liquid materials","B29C64/165","","","","This place covers: Illustrative example of subject matter classified in this group:"
"B28B11/00","Apparatus or processes for treating or working the shaped {or preshaped} articles  (specially adapted for tubular articles B28B21/92; decoration or surface treatment in general B05, B44; compacting concrete in situ in connection with building E04G21/06; drying F26)","B28B21/92|B05|B44|E04G21/06|F26","Grinding; PolishingDecoration or surface treatment in general, DryingFurnaces; Kilns; Ovens; Retorts","B24|B44|B05|F26|F27","","","","This place covers: The shaped articles being treated or worked are still in a green state."
"B28B11/003","{the shaping of preshaped articles, e.g. by bending  (B28B11/08 takes precedence)}","B28B11/08","","","","","","This place covers: Illustrative example of subject matter classified in this group:"
"B28B11/006","{Making hollow articles or partly closed articles}","","Honeycombs characterised by the plugs","B01D46/2422","","","","This place covers: Plugging ceramic honeycomb filters. and other techniques"
"B28B11/02","for attaching appendages, e.g. handles, spouts","","","","","","","This place covers: Illustrative example of subject matter classified in this group:"
"B28B11/04","for coating {or applying engobing layers} (glazing, engobing C04B)","C04B","","","","","",""
"B28B11/042","{with insulating material}","","","","","","","This place covers: Illustrative example of subject matter classified in this group:"
"B28B11/06","with powdered or granular material {, e.g. sanding of shaped articles}","","","","","","","This place covers: Illustrative example of subject matter classified in this group:"
"B28B11/08","for reshaping the surface, e.g. smoothing, roughening, corrugating, making screw-threads","","General field for grinding and polishing","B24","","","","This place covers: Working the surface of a formed green article or intermediate product which can still be (partly) in the mould or which has been demoulded,"
"B28B11/0863","{for profiling, e.g. making grooves}","","","","","","",""
"B28B11/12","for removing parts of the articles by cutting","","Cutting; details common to machines for severing","B26D","","","","This place covers: Illustrative example of subject matter classified in this group:"
"B28B11/125","{Cutting-off protruding ridges, also profiled cutting}","","","","","","","This place covers: Illustrative example of subject matter classified in this group:"
"B28B11/14","for dividing shaped articles by cutting","","Separating article from each other per se","B28B17/0018","","","","This place covers: Dividing a pre-form by a cutting action in two or more products."
"B28B11/145","{for dividing block-shaped bodies of expanded materials, e.g. cellular concrete}","","","","","","","This place covers: Illustrative example of subject matter classified in this group:"
"B28B11/16","for extrusion {or for materials supplied in long webs}","","","","","","","This place covers: Illustrative example of subject matter classified in this group:"
"B28B11/18","for removing burr {(combined with the mould B28B7/0058)}","B28B7/0058","","","","","",""
"B28B11/22","for cleaning","","Cleaning in general","B08B","","","",""
"B28B11/24","for curing, setting or hardening  (processes for influencing or modifying the setting or hardening ability of mortars, concrete or artificial stone compositions, in general C04B40/00)","C04B40/00","Pressure vessels, e.g. autoclavesProcesses for influencing or modifying the setting or hardening ability of mortars, concrete or artificial stone compositions, in generalDrying objects by removing liquid therefromFurnaces; Kilns; Ovens, Retorts ","B01J3/04|C04B40/00|F26B|F27","","","",""
"B28B11/243","{Setting, e.g. drying, dehydrating or firing ceramic articles  (B28B11/242 takes precedence)}","B28B11/242","Processing powders of inorganic compounds preparatory to the manufacturing of ceramic products","C04B35/00","","","",""
"B28B13/00","Feeding the unshaped material to moulds or apparatus for producing shaped articles; Discharging shaped articles from such moulds or apparatus  (feeding or discharging devices incorporated in, or operatively associated with, a particular type of shaping apparatus, or specially designed to supply materials to a particular type of shaping apparatus, see the relevant groups for the apparatus)","","Filling moulds with powderFeeding material to presses","B22F3/004|B30B15/30","","","",""
"B28B13/02","Feeding the unshaped material to moulds or apparatus for producing shaped articles","","","","","","","This place covers: Illustrative example of subject matter classified in this group:"
"B28B13/0205","{supplied to the moulding device in form of a coherent mass of material, e.g. a lump or an already partially preshaped tablet, pastil or the like}","","","","","","","This place covers: The coherent mass of material has been pre-shaped, -formed, -compacted in a seperate apparatus "
"B28B13/021","{by fluid pressure acting directly on the material, e.g. using vacuum, air pressure}","","","","","","",""
"B28B13/022","{Feeding several successive layers, optionally of different materials}","","","","","","","This place covers: Illustrative example of subject matter classified in this group:"
"B28B13/023","{by using a feed box transferring the moulding material from a hopper to the moulding cavities}","","By using feed frames or shoes with relative movement","B30B15/304","","","","This place covers: Illustrative example of subject matter classified in this group:"
"B28B13/04","Discharging the shaped articles  ({discharging tubular articles after shaping B28B21/90; } conveying systems for ceramic mouldings B65G49/08)","B28B21/90|B65G49/08","","","","","","This place covers: Illustrative example of subject matter classified in this group:"
"B28B13/06","Removing the shaped articles from moulds  (by means incorporated in, or carried by, the moulds B28B7/10)","B28B7/10","","","","","","This place covers: Illustrative example of subject matter classified in this group:"
"B28B15/00","General arrangement or layout of plant {Industrial outlines, plant installations}","","","","","","","This place covers: Illustrative example of subject matter classified in this group:"
"B28B15/002","{Mobile plants, e.g. on vehicles or on boats}","","","","","","","This place covers: e.g. mobile plants that can be broken-down for transport."
"B28B15/005","{Machines using pallets co-operating with a bottomless mould; Feeding or discharging means for pallets  (feeding pallets for making a continuous moulding surface B28B5/025, B28B5/028)}","B28B5/025|B28B5/028","","","","","","This place covers: Illustrative example of subject matter classified in this group:"
"B28B15/007","{Plant with two or more identical shaping or moulding devices}","","","","","","","This place covers: Illustrative example of subject matter classified in this group:"
"B28B17/0018","{Separating articles from each other}","","","","","","","This place covers: Illustrative example of subject matter classified in this group:"
"B28B17/0027","{Accessories for obtaining rubblestones}","","Cutting by pressing stone or stone-like materials","B28D1/222","","","","This place covers: E.g. block splitting assembly "
"B28B17/0036","{Cutting means, e.g. water jets}","","Cutting in general","B26D","","","","This place covers: This subgroup is complementary to  ,   and subgroups."
"B28B17/0045","{Tensioning devices for cutting means}","","","","","","",""
"B28B17/0054","{Cleaning devices for cutting means}","","","","","","","This place covers: Illustrative example of subject matter classified in this group:"
"B28B17/0063","{Control arrangements}","","Measuring; TestingControlling; Regulating","G01|G05","","","","This place covers: Control arrangements for both product inspection and operating conditions."
"B28B17/009","{Changing the forming elements, e.g. exchanging moulds, dies}","","Mounting of dies, platens or press rams","B30B15/026","","","","This place covers: Illustrative example of subject matter classified in this group:"
"B28B17/02","Conditioning the material prior to shaping {(for mixtures containing clay or cement B28C)}","B28C","","","","","",""
"B28B19/00","Machines or methods for applying the material to surfaces to form a permanent layer thereon  (making shaped articles on mandrels B28B1/30; applying liquids or other fluent materials to surfaces in general B05C; glazing or engobing C04B; applying the material to walls or other fixed structures, see the relevant classes of section E)","B28B1/30|B05C|C04B|E","Layered products essentially comprising a water-setting substance","B32B13/00","","","The material (a) clay or other ceramic compositions; (b) slag;(c) mixtures with water-setting properties given by clay, cementitious material, or slag.Surfacesany kind of surface not restricted to any type of material",""
"B28B19/0007","{for producing articles with exposed aggregate}","","","","","","","This place covers: Illustrative example of subject matter classified in this group:"
"B28B19/0023","{Lining the inner wall of hollow objects, e.g. pipes}","","Devices or appurtenances for use in, or in connection with, pipes or pipe systemsProtection of pipes or pipe fittings against corrosion or incrustation","F16L55/00|F16L58/00","","","","This place covers: Illustrative example of subject matter classified in this group:"
"B28B19/0038","{lining the outer wall of hollow objects, e.g. pipes}","","Devices or appurtenances for use in, or in connection with, pipes or pipe systemsProtection of pipes or pipe fittings against corrosion or incrustation","F16L55/00|F16L58/00","","","","This place covers: Illustrative example of subject matter classified in this group:"
"B28B19/0053","{to tiles, bricks or the like}","","Bricklaying machines in general","E04G21/22","","","","This place covers: Application to cladding elements. Illustrative example of subject matter classified in this group:"
"B28B19/0092","{to webs, sheets or the like, e.g. of paper, cardboard}","","Methods or apparatus for laminating","B32B37/00","","","","This place covers: Illustrative example of subject matter classified in this group:"
"B28B21/00","Methods or machines specially adapted for the production of tubular articles","","Pipes Joints or fittings for pipes","F16L","","","",""
"B28B21/06","into moulds having sliding parts  (B28B21/26 takes precedence; forms, shutterings, or falsework for making rooms as a whole, whole stories, or whole buildings in situ E04G11/02)","B28B21/26|E04G11/02","","","","","","This place covers: Illustrative example of subject matter classified in this group:"
"B28B21/08","by slip-casting; Moulds therefor","","","","","","","This place covers: Illustrative example of subject matter classified in this group:"
"B28B21/10","using compacting means","","","","","","","This place covers: Illustrative example of subject matter classified in this group:"
"B28B21/16","one or more mould elements","","","","","","","This place covers: Illustrative example of subject matter classified in this group:"
"B28B21/20","using inflatable cores, e.g. having a frame inside the inflatable part of the core  (connection of valves to inflatable elastic bodies B60C29/00)","B60C29/00","","","","","","This place covers: Illustrative example of subject matter classified in this group:"
"B28B21/22","using rotatable mould or core parts","","","","","","","This place covers: Illustrative example of subject matter classified in this group:"
"B28B21/24","using compacting heads, rollers, or the like","","","","Compacting heads, rollers, or the like driven from beneath or followed by a sliding mould with particular inventive emphasis classify in: With a packer head serving as a sliding mould or provided with guiding means for feeding the material.","B28B21/26","","This place covers: Compacting heads, rollers, or the like when driven and suspended from above "
"B28B21/245","{using a horizontal compacting roller in a horizontally rotatable mould}","","","","","","","This place covers: Illustrative example of subject matter classified in this group:"
"B28B21/26","with a packer head serving as a sliding mould or provided with guiding means for feeding the material","","","","","","","This place covers: Illustrative example of subject matter classified in this group:"
"B28B21/30","Centrifugal moulding","","","","","","","This place covers: Illustrative example of subject matter classified in this group:"
"B28B21/305","{Moulding machines with vertical rotation axis}","","","","","","","This place covers: Illustrative example of subject matter classified in this group:"
"B28B21/44","by projecting, e.g. spraying","","","","","","","This place covers: Illustrative example of subject matter classified in this group:"
"B28B21/48","by wrapping, e.g. winding","","","","","","","This place covers: Illustrative example of subject matter classified in this group:"
"B28B21/52","by extruding","","","","","","","This place covers: Illustrative example of subject matter classified in this group:"
"B28B21/56","incorporating reinforcements {or inserts}","","","","","","","This place covers: Incorporating inserts and/or reinforcing members."
"B28B21/563","{Gaskets}","","With elastic sealing rings between pipe and socket, placed on the socket before connection.","F16L21/03","","","","This place covers: Illustrative example of subject matter classified in this group:"
"B28B21/566","{Climbing elements}","","Climbing irons or the like","E06C9/04","","","","This place covers: Illustrative example of subject matter classified in this group:"
"B28B21/64","Winding arrangements","","Methods, apparatus, or devices for covering or wrapping cores by winding webs, tapes, or filamentary material","B65H81/00","","","",""
"B28B21/70","by building-up from preformed elements","","","","","","","This place covers: Illustrative example of subject matter classified in this group:"
"B28B21/72","Producing multilayer tubes","","","","","","","This place covers: The preformed elements for producing multilayer tubes can be manufactured of any material."
"B28B21/78","with heating or cooling means, e.g. steam jackets","","","","","","","This place covers: Illustrative example of subject matter classified in this group:"
"B28B21/80","adapted to centrifugal or rotational moulding","","","","","","","This place covers: Illustrative example of subject matter classified in this group:"
"B28B21/86","Cores  (in general B28B7/00)","B28B7/00","Cores in general","B28B7/00","","","","This place covers: Illustrative example of subject matter classified in this group:"
"B28B21/925","{for wrapping}","","","","","","","This place covers: Illustrative example of subject matter classified in this group:"
"B28B21/94","for impregnating or coating by applying liquids or semi-liquids","","","","","","","This place covers: Illustrative example of subject matter classified in this group:"
"B28B21/965","{for grooving or corrugating}","","","","","","","This place covers: Illustrative example of subject matter classified in this group:"
"B28B23/00","Arrangements specially adapted for the production of shaped articles with elements wholly or partly embedded in the moulding material; {Production of reinforced objects} (B28B21/00 takes precedence; in units for prefabricated buildings B28B7/22)","B28B21/00|B28B7/22","Reinforcing elements in general","E04C5/00","Machines or methods for applying the material to surfaces to form a permanent layer thereon should be classified in .","B28B19/00","","This place covers: Wherein the element which is wholly or partly embedded in the moulding material can be a reinforcing member, insert, moulding material component, gaskets, or the like; not being restricted by the choice of material."
"B28B23/0012","{Producing brick netting}","","Pavings made of prefabricated single units","E01C5/00","","","","This place covers: Illustrative example of subject matter classified in this group:"
"B28B23/0043","{with gaskets or sealing elements, e.g. for tunnelings or man holes  (B28B21/563 takes precedence)}","B28B21/563","","","","","","This place covers: Illustrative example of subject matter classified in this group:"
"B28B23/005","{with anchoring or fastening elements for the shaped articles}","","Connecting devices specially adapted for embedding in concreteMeans in or on the elements for connecting same to handling apparatus","E04B1/41|E04G21/142","","","","This place covers: Illustrative example of subject matter classified in this group:"
"B28B23/0056","{Means for inserting the elements into the mould or supporting them in the mould  (B28B23/022 takes precedence)}","B28B23/022","Cores for anchor holes or the like","E05G15/04","","","","This place covers: Illustrative example of subject matter classified in this group:"
"B28B23/0068","{Embedding lost cores}","","Non-reusable forms","E04G15/061","","","","This place covers: Illustrative example of subject matter classified in this group:"
"B28B23/0075","{for decorative purposes}","","","","","","","This place covers: Illustrative example of subject matter classified in this group:"
"B28B23/0081","{Embedding aggregates to obtain particular properties}","","","","","","","This place covers: Wherein the aggregates themselves contain particular properties."
"B28B23/02","wherein the elements are reinforcing members {(B28B23/0006 takes precedence)}","B28B23/0006","","","","","",""
"B28B23/022","{Means for inserting reinforcing members into the mould or for supporting them in the mould  (inserting during extrusion B28B3/2645)}","B28B3/2645","Mounting of reinforcing inserts","E04G21/12","","","",""
"B28B23/026","{Mould partitionning elements acting as supporting means in moulds, e.g. for elongated articles}","","","","","","","This place covers: Illustrative example of subject matter classified in this group:"
"B28B23/028","{for double - wall articles}","","Moulds provided with means for tilting or inverting for making double wall panels","B28B7/085","","","","This place covers: Illustrative example of subject matter classified in this group:"
"B28B23/04","the elements being stressed","","Mounting of reinforcing inserts; Prestressing","E04G21/12","","","",""
"B28B23/043","{Wire anchoring or tensioning means for the reinforcements}","","","","","","","This place covers: Illustrative example of subject matter classified in this group:"
"B28B23/046","{Post treatment to obtain pre-stressed articles}","","","","","","","This place covers: e.g. reinforcing members are stressed after the hardening of the element; Reinforcing members are introduced through (a) continuous opening(s) of the hardened element, are stressed and connected to the hardened element."
"B28B23/18","for the production of elongated articles  (B28B23/06 takes precedence)","B28B23/06","","","","","",""
