"cpc_code","title","title_cpc_codes","informative_references","informative_references_cpc_codes","special_rules","special_rules_cpc_codes","glossary_of_terms","definition_statement"
"B28B","SHAPING CLAY OR OTHER CERAMIC COMPOSITIONS; SHAPING SLAG; SHAPING MIXTURES CONTAINING CEMENTITIOUS MATERIAL, e.g. PLASTER  (foundry moulding B22C; working stone or stone-like material B28D; shaping of substances in a plastic state, in general B29C; making layered products not composed wholly of these substances B32B; shaping in situ, see the relevant classes of section E)","B22C|B28D|B29C|B32B|E","","","","","The material(a) clay or other ceramic compositions (b) slag (c) mixtures with water-setting properties given by clay, cementitious material, or slag.","This place covers: The methods and apparatuses covered manufacture of the shaped article at a location remote from its intended use, i.e. a pre-fabricated article."
"B28B1/002","{assembled from preformed elements}","","","","""The material"" used to hold the assembled preformed elements together is as defined in the subclass.","","","This place covers: Illustrative example of subject matter classified in this group:"
"B28B1/004","{Devices for shaping artificial aggregates from ceramic mixtures or from mixtures containing hydraulic binder  (from slag C04B5/00; composition of artificial aggregates C04B18/02)}","C04B5/00|C04B18/02","","","","","","This place covers: Illustrative example of subject matter classified in this group:"
"B28B1/005","{Devices or processes for obtaining articles having a marble appearance  (producing decorative effects B44C; design of stone surfaces, e.g. marble, B44F9/04)}","B44C|B44F9/04","","","Characteristic features concerning the feeding of the material should be classified in .","B28B13/02","","This place covers: Illustrative example of subject matter classified in this group:"
"B28B1/007","{by freezing the material}","","","","","","","This place covers: Illustrative example of subject matter classified in this group:"
"B28B1/008","{made from two or more materials having different characteristics or properties  (casting for producing layered articles B28B1/16; feeding several succesive layers, optionally of different materials B28B13/022; coating B28B11/04; applying material to surfaces to form a permanent layer thereon B28B19/00)}","B28B1/16|B28B13/022|B28B11/04|B28B19/00","","","","","","This place covers: Making a base body (11) in a conventional manner with at least one external dimension (12), smaller than a corresponding desired dimension (13), applying a compensating coating (14) to the base body or its top. "
"B28B1/02","by turning or jiggering {in moulds or moulding surfaces on rotatable supports}","","","","","","","This place covers: Potter's wheel and handtools associated with such a device. "
"B28B1/04","by tamping or ramming  (followed by pressing B28B3/02)","B28B3/02","","","","","","This place covers: Illustrative example of subject matter classified in this group:"
"B28B1/045","{combined with vibrating or jolting}","","","","","","","This place covers: Illustrative example of subject matter classified in this group:"
"B28B1/08","by vibrating or jolting {(of moulding sand B22C15/10; of concrete in general E04G21/063)}","B22C15/10|E04G21/063","Of concrete in general","E04G21/063","","","","This place covers: Illustrative example of subject matter classified in this group:"
"B28B1/081","{Vibration-absorbing means}","","","","","","","This place covers: Illustrative example of subject matter classified in this group:"
"B28B1/082","{combined with a vacuum, e.g. for moisture extraction  (in general E04G21/061)}","E04G21/061","For humidifying or dehumidifyingBy vibrating the composition before or during mouldingFor moisture extraction in general","B28B7/46|B29C67/244|E04G21/061","","","","This place covers: Illustrative example of subject matter matter classified in this group:"
"B28B1/084","{the vibrating moulds or cores being moved horizontally for making strands of moulded articles}","","","","Slipform casting process having an extruder screw also to be classified in  ""self-propelled screw extruders"" TBC.","B28B3/224","","This place covers: Slipform casting process having an extruder screw. Slipformer technique: "
"B28B1/087","by means acting on the mould {; Fixation thereof to the mould}","","","","","","","This place covers: Illustrative example of subject matter classified in this group:"
"B28B1/0873","{the mould being placed on vibrating or jolting supports, e.g. moulding tables}","","","","","","","This place covers: Illustrative example of subject matter classified in this group:"
"B28B1/093","by means directly acting on the material, e.g. by cores wholly or partly immersed in the material {or elements acting on the upper surface of the material} ({B28B1/084 takes precedence; } internal vibrators for compacting concrete in situ E04G21/08)","B28B1/084|E04G21/08","","","By cores wholly or partly immersed in the material is to be classified in .","B28B1/0935","","This place covers: Illustrative example of subject matter classified in this group:"
"B28B1/0935","{using only elements wholly or partly immersed in the material, e.g. cores}","","","","","","","This place covers: Illustrative example of subject matter classified in this group:"
"B28B1/10","and applying pressure otherwise than by the use of presses","","","","","","","This place covers: Illustrative example of subject matter classified in this group:"
"B28B1/105","{this load also being actively vibrated or jolted}","","","","","","","This place covers: Illustrative example of subject matter classified in this group:"
"B28B1/14","by simple casting, the material being neither forcibly fed nor positively compacted  (for molten material B28B1/54)","B28B1/54","","","","","","This place covers: Illustrative example fo subject matter classified in this group:"
"B28B1/16","for producing layered articles  (coating B28B11/04)","B28B11/04","","","Layered products essentially comprising a water-setting substance, e.g. concrete, plaster, asbestos cement, or like builders' material","B32B13/00","","This place covers: Illustrative example of subject matter classified in this group:"
"B28B1/20","by centrifugal or rotational casting  (slip-casting involving rotation of the mould B28B1/28; for molten material B28B1/54)","B28B1/28|B28B1/54","",""," centrifugal or rotational casting with methods or machines specially adapted for the production of tubular articles centrifugal or rotational casting wherein the elements are reinforcing members","B28B21/00|B28B23/20","","This place covers: Illustrative example of subject matter classified in this group:"
"B28B1/24","by injection moulding {(injection moulding of ceramic slips B28B1/265; of tubular articles B28B21/38)}","B28B1/265|B28B21/38","Manufacture of workpieces or articles from metallic powder by injection moulding","B22F3/22","","","","This place covers: Illustrative example of subject matter classified in this group:"
"B28B1/26","by slip-casting, i.e. by casting a suspension or dispersion of the material in a liquid-absorbent or porous mould, the liquid being allowed to soak into or pass through the walls of the mould; Moulds therefor  (B28B1/52 takes precedence){; specially for manufacturing articles starting from a ceramic slip; Moulds therefor  (of tubular articles B28B21/08)}","B28B1/52|B28B21/08","","","For chemical aspects see:  slipcasting of clay-wares.For manufacturing of workpieces or articles from metallic powder see:  for producing castings from a slip.","C04B33/28|B22F3/22","",""
"B28B1/261","{Moulds therefor  (absorbent moulds in general B28B7/344)}","B28B7/344","Absorbent moulds in general","B28B7/344","","","","This place covers:"
"B28B1/266","{Means for counteracting the pressure being applied on the slip or on the moulded article in the mould, e.g. means for clamping the moulds parts together in a frame-like structure}","","Fastening means, clamping means for mould parts in general","B28B2007/005","","","","This place covers: Illustrative example of subject matter classified in this group:"
"B28B1/268","{by dipping moulding surfaces in the slip  (in general B28B1/38)}","B28B1/38","Dipping moulding surfaces in the slip in general","B28B1/38","","","","This place covers: Illustrative example of subject matter classified in this group:"
"B28B1/29","by profiling or strickling the material in open moulds or on moulding surfaces {(in rotary moulds B28B1/02; by means of profiled rollers B28B3/12, B28B3/123)}","B28B1/02|B28B3/12|B28B3/123","","","Profiling or strickling in situ:  machines, tools or auxiliary devices for preparing or distributing paving materials.","E01C19/00","","This place covers: Illustrative example of subject matter classified in this group:"
"B28B1/32","by projecting, e.g. spraying  (spraying in general B05B, B05D)","B05B|B05D","Spraying in general ","B05B","","","",""
"B28B1/34","by centrifugal force {(centrifugally acting implements for applying plaster or the like to walls E04F21/10)}","E04F21/10","","","","","",""
"B28B1/38","by dipping  (in general B05C, B05D  {; shaping from synthetic resin B29C41/14})","B05C|B05D|B29C41/14","By dipping in general","B05C","","","",""
"B28B1/40","by wrapping, e.g. winding","","","","","","",""
"B28B1/44","by forcing cores into filled moulds for forming hollow articles","","","","The cores being forced into the filled moulds displace the material inside the filled moulds.","","","This place covers: Illustrative example of subject matter classified in this group:"
"B28B1/48","by removing material from solid section preforms for forming hollow articles, e.g. by punching or boring","","","","","","","This place covers: Illustrative example of subject matter classified in this group:"
"B28B1/50","specially adapted for producing articles of expanded material, e.g. cellular concrete  (chemical aspects {or making expanded aggregate} C04B)","C04B","","","Mixers for producing cellular concrete:","B28C5/1269|B28C5/381|B01F","","This place covers: Illustrative example of subject matter classified in this group:"
"B28B1/526","{by delivering the materials on a conveyor of the endless-belt type}","","","","","","","This place covers: Illustrative example of subject matter classified in this group:"
"B28B1/527","{by delivering the materials on a rotating drum, e.g. a sieve drum, from which the materials are picked up by a felt}","","","","","","","This place covers: Illustrative example of subject matter classified in this group:"
"B28B1/54","specially adapted for producing articles from molten material, e.g. slag {refractory ceramic materials} (chemical aspects C04B  {; from molten bituminous material B29C})","C04B|B29C","","","","","","This place covers: E.g. sulfur/sulphur concrete"
"B28B3/00","Producing shaped articles from the material by using presses  (shaping on moving conveyors B28B5/00); Presses specially adapted therefor  (presses in general B30B)","B28B5/00|B30B","Manufacture of workpieces or articles from metallic powder characterised by the manner of compacting or sinteringExtrusion moulding of plasticsAspects related to presses in general","B22F3/00|B29C48/00|B30B","","","",""
"B28B3/003","{Pressing by means acting upon the material via flexible mould wall parts, e.g. by means of inflatable cores, isostatic presses  (isostatic presses in general B30B5/02)}","B30B5/02","Isostatic presses in general ","B30B5/02","The flexible mould wall parts change shape due to an externally generated pressure (air, oil etc.) other than the reaction force caused by the pressing of a ram head.","","","This place covers: Illustrative example of subject matter classified in this group:"
"B28B3/02","wherein a ram exerts pressure on the material in a moulding space; Ram heads of special form","","Using a ram exerting pressure on the material in a moulding space","B30B11/02","","","","This place covers: Illustrative example of subject matter classified in this group:"
"B28B3/021","{Ram heads of special form}","","","","","","","This place covers: Illustrative example of subject matter classified in this group:"
"B28B3/022","{combined with vibrating or jolting}","","Using a ram exerting pressure on the material in a moulding space, whereby the material is subjected to vibrations","B30B11/022","","","","This place covers: Illustrative example of subject matter classified in this group:"
"B28B3/024","{the pressure on the material being transmitted through flexible or resilient wall parts, e.g. flexible cushions on the ramming surface, resilient wall parts pressing as a result of deformation caused by ram pressure}","","","","","","","This place covers: Illustrative example of subject matter classified in this group:"
"B28B3/025","{Hot pressing, e.g. of ceramic materials}","","","","","","","This place covers: Illustrative example of subject matter classified in this group:"
"B28B3/027","{using a bottom press ram actuated upwardly towards mould covers}","","","","","","","This place covers: Illustrative example of subject matter classified in this group:"
"B28B3/06","with two or more ram and mould sets","","","","","","","This place covers: Illustrative example of subject matter classified in this group:"
"B28B3/08","with two or more rams per mould","","","","","","","This place covers: Wherein the ram heads work in opposite directions: "
"B28B3/083","{The juxtaposed rams working in the same direction}","","","","","","","This place covers: Illustrative example of subject matter classified in this group:"
"B28B3/086","{The rams working in different directions}","","","","","","","This place covers:"
"B28B3/10","each charge of material being compressed against previously formed body","","","","","","","This place covers: Illustrative example of subject matter classified in this group:"
"B28B3/12","wherein one or more rollers exert pressure on the material","","","","","","","This place covers:"
"B28B3/123","{on material in moulds or on moulding surfaces moving continuously underneath or between the rollers, e.g. on an endless belt}","","","","","","","This place covers: Illustrative example of subject matter classified in this group:"
"B28B3/126","{on material passing directly between the co-operating rollers}","","","","","","","This place covers: Illustrative example of subject matter classified in this group:"
"B28B3/14","with co-operating pocketed rollers","","","","","","","This place covers: Illustrative example of subject matter classified in this group:"
"B28B3/16","with co-operating profiled rollers","","","","","","","This place covers: Illustrative example of subject matter classified in this group:"
"B28B3/18","Roller-and-ring machines, i.e. with roller disposed within a ring and co-operating with the inner surface of the ring","","","","","","","This place covers: Illustrative example of subject matter classified in this group:"
"B28B3/20","wherein the material is extruded {(extrusion moulding of plastics B29C48/00)}","B29C48/00","","","","","",""
"B28B2003/203","{for multi-channelled structures, e.g. honeycomb structures}","","","","","","","This place covers:"
"B28B3/22","by screw or worm","","","","","","","This place covers: Illustrative example of subject matter classified in this group:"
"B28B3/222","{Screw or worm constructions}","","","","","","","This place covers: Illustrative example of subject matter classified in this group:"
"B28B3/24","by reciprocating plunger","","","","","","","This place covers: Illustrative example of subject matter classified in this group:"
"B28B3/26","Extrusion dies","","","","","","",""
"B28B3/2618","{using lubricating means}","","","","","","","This place covers: Illustrative example of subject matter classified in this group:"
"B28B3/2627","{using means for making hollow objects with transverse walls, e.g. hollow objects closed on all sides}","","","","","","","This place covers: Illustrative example of subject matter classified in this group:"
"B28B3/2636","{using means for co-extruding different materials}","","","","","","","This place covers:"
"B28B3/2645","{using means for inserting reinforcing members}","","","","","","","This place covers: Illustrative example of subject matter classified in this group:"
"B28B5/00","Producing shaped articles from the material in moulds or on moulding surfaces, carried or formed by, in, or on conveyors irrespective of the manner of shaping  (shaping aspects see the relevant groups)","","","","","","","This place covers: The moulds or moulding surfaces are transported along several station of activity, for example, first a mould is transported to a cleaning station followed by a casting station and finally by a demoulding station."
"B28B5/02","on conveyors of the endless-belt or chain type  (in combination with pressing rollers B28B3/12)","B28B3/12","","","","","","This place covers: Illustrative example of subject matter classified in this group:"
"B28B5/021","{the shaped articles being of definite length}","","","","","","",""
"B28B5/022","{the moulds or the moulding surfaces being individual independant units and being discontinuously fed  (feeding B28B13/0215 and sub-groups)}","B28B13/0215","","","","","","This place covers: Illustrative example of subject matter classified in this group:"
"B28B5/025","{the moulds or the moulding surfaces being divided by separating walls and being continuously fed  (feeding B28B13/02)}","B28B13/02","","","","","","This place covers: Illustrative example of subject matter classified in this group:"
"B28B5/026","{the shaped articles being of indefinite length}","","","","","","",""
"B28B5/027","{the moulding surfaces being of the indefinite length type, e.g. belts, and being continuously fed  (feeding B28B13/02)}","B28B13/02","","","","","","This place covers: Illustrative example of subject matter classified in this group:"
"B28B5/028","{the moulding surfaces being of definite length, e.g. succession of moving pallets, and being continuously fed  (feeding B28B13/02)}","B28B13/02","","","","","","This place covers: Illustrative example of subject matter classified in this group:"
"B28B5/04","in moulds moved in succession past one or more shaping stations  (on turn-tables B28B5/06)","B28B5/06","","","","","",""
"B28B5/06","in moulds on a turntable","","","","","","",""
"B28B5/08","intermittently rotated","","","","","","",""
"B28B5/10","in moulds carried on the circumference of a rotating drum","","","","","","",""
"B28B5/12","intermittently rotated","","","","","","",""
"B28B7/00","Moulds; Cores; Mandrels  (specially adapted for the production of the tubular articles B28B21/00; {for casting metals B22C9/00; moulds for plastic materials in general B29C33/00; falsework, forms or shutterings for forming buildings or parts thereof in situ E04G9/00 - E04G15/00})","B28B21/00|B22C9/00|B29C33/00|E04G9/00|E04G15/00","Moulds for plastic materials in generalFalsework, forms or shuttering for forming buildings or parts thereof in situ - ","B29C33/00|E04G9/00|E04G15/00","","","",""
"B28B7/0032","{Moulding tables or similar mainly horizontal moulding surfaces}","","","","","","","This place covers: Illustrative example of subject matter classified in this group:"
"B28B7/0038","{the sidewalls of mould and moulded article moving only past each other, e.g. box-shaped moulds which are lifted off from the moulding}","","","","","","","This place covers: E.g. sliding movement of the mould walls past the cast article."
"B28B7/0041","{the sidewalls of the mould being moved only parallelly away from the sidewalls of the moulded article}","","","","","","","This place covers: Illustrative example of subject matter classified in this group:"
"B28B7/0044","{the sidewalls of the mould being only tilted away from the sidewalls of the moulded article, e.g. moulds with hingedly mounted sidewalls}","","","","","","","This place covers: Illustrative example of subject matter classified in this group:"
"B28B2007/005","{Fastening means for mould parts, e.g. for attaching mould walls on mould tables; Mould clamps}","","","","","","","This place covers: Illustrative example of subject matter classified in this group:"
"B28B2007/0052","{for attaching mould walls on mould tables}","","","","","","","This place covers: Illustrative example of subject matter classified in this group:"
"B28B7/0055","{Mould pallets; Mould panels}","","","","","","","This place covers: Illustrative example of subject matter classified in this group:"
"B28B7/0058","{Moulds, cores or mandrels with provisions concerning the elimination of superfluous material; Moulds with burr-removing means provided therein or carried thereby}","","","","","","","This place covers: Illustrative example of subject matter classified in this group:"
"B28B7/0061","{Moulds, cores or mandrels specially adapted for mechanically working moulding surfaces during moulding or demoulding, e.g. smoothing by means of mould walls driven during moulding or of parts acting during demoulding}","","","","","","","This place covers: Illustrative example of subject matter classified in this group:"
"B28B7/007","{with moulding surfaces simulating natural effets, e.g. wood or stone}","","","","","","","This place covers: Illustrative example of subject matter classified in this group:"
"B28B7/0073","{with moulding surfaces simulating assembled bricks or blocks with mortar joints  (B28B7/007 takes precedence)}","B28B7/007","","","","","","This place covers: Illustrative example of subject matter classified in this group:"
"B28B7/0076","{with surfaces for moulding letters or marks}","","","","","","","This place covers: Illustrative example of subject matter classified in this group:"
"B28B7/0079","{with surfaces for moulding interlocking means, e.g. grooves and ribs}","","","","","","","This place covers: Illustrative example of subject matter classified in this group:"
"B28B7/0082","{with surfaces for moulding parallel grooves or ribs  (B28B7/0073, B28B7/0079 takes precedence)}","B28B7/0073|B28B7/0079","","","","","",""
"B28B7/0085","{with surfaces for moulding chamfers}","","","","","","","This place covers: Illustrative example of subject matter classified in this group:"
"B28B7/0088","{Moulds in which at least one surface of the moulded article serves as mould surface, e.g. moulding articles on or against a previously shaped article, between previously shaped articles}","","","","","","","This place covers: Wherein the surface of the moulded article which serves as a mould surface either becomes part of the final product or the two or more cast articles are seperated from each other e.g. flat concrete panel which serves as a moulding surface for the next flat concrete panel to be cast."
"B28B7/0091","{Transformable moulds allowing the change of shape of an initial moulded preform by preform deformation or the change of its size by moulding on the preform}","","","","","","","This place covers: Illustrative example of subject matter classified in this group:"
"B28B7/0097","{Press moulds; Press-mould and press-ram assemblies}","","","","","","","This place covers: Illustrative example of subject matter classified in this group:"
"B28B7/02","Moulds with adjustable parts {specially for modifying at will the dimensions or form of the moulded article}","","","","","","","This place covers: Illustrative example of subject matter classified in this group:"
"B28B7/04","one or more of the parts being pivotally mounted","","","","","","","This place covers: Illustrative example of subject matter classified in this group:"
"B28B7/06","Moulds with flexible parts","","","","","","","This place covers: Illustrative example of subject matter classified in this group:"
"B28B7/08","Moulds provided with means for tilting or inverting","","","","","","","This place covers: Illustrative example of subject matter classified in this group:"
"B28B7/082","{Tiltable moulding tables or similar moulding surfaces  (specially for casting and erecting walls or parts thereof during construction work E04G11/32)}","E04G11/32","","","","","","This place covers: Illustrative example of subject matter classified in this group:"
"B28B7/085","{for making double wall panels}","","","","","","","This place covers: Illustrative example of subject matter classified in this group:"
"B28B7/087","{using rocker or rolling means}","","","","","","","This place covers: Illustrative example of subject matter classified in this group:"
"B28B7/10","Moulds with means incorporated therein, or carried thereby, for ejecting {or detaching} the moulded article  ({flexible moulds bent open for ejecting B28B7/06; ejecting by tilting or inverting the mould B28B7/08; } devices, not forming part of the mould, for ejecting the moulded article B28B13/06)","B28B7/06|B28B7/08|B28B13/06","","","","","","This place covers: Illustrative example of subject matter classified in this group:"
"B28B7/12","by fluid pressure {, e.g. acting through flexible wall parts or linings of the moulds}","","","","","","","This place covers: Illustrative example of subject matter classified in this group:"
"B28B7/14","Moulds with means incorporated therein, or carried thereby, for cutting the moulded article into parts  ({for expanded material B28B1/506; } cutting means independent of the mould B28B11/14)","B28B1/506|B28B11/14","","","","","","This place covers: Illustrative example of subject matter classified in this group:"
"B28B7/16","Moulds for making shaped articles with cavities or holes open to the surface {, e.g. with blind holes}","","","","","","","This place covers: Illustrative example of subject matter classified in this group:"
"B28B7/162","{for building blocks or similar block-shaped articles}","","","","","","","This place covers: Illustrative example of subject matter classified in this group:"
