"cpc_code","title","title_cpc_codes","informative_references","informative_references_cpc_codes","special_rules","special_rules_cpc_codes","glossary_of_terms","definition_statement"
"B32B27/00","Layered products comprising {a layer of} synthetic resin {(fibrous or filamentary layer made of a synthetic resin B32B5/02; particulate layer made of a synthetic resin B32B5/16; foamed layer made of a synthetic resin B32B5/18)}","B32B5/02|B32B5/16|B32B5/18","Manufacture of polymeric films or sheetsCompositions of macromolecular compounds","C08J5/00|C08L","A layer of thermoplastic elastomer is classified in  and also at the appropriate place in  if the nature of the polymer is also known or specified.Layered products wherein all layers are polymeric are classified in .Coating on a layer of synthetic resin is classified with an appropriate Indexing symbol in .","B32B2274/00|B32B27/00|B32B2250/24|B32B2255/00","","This place covers: Layered products characterised by a layer of a synthetic resin other than a cellulosic plastic resin or a thermosetting synthetic rubber."
"B32B27/205","{the fillers creating voids or cavities, e.g. by stretching}","","","","","","","This place covers: Illustrative example of subject matter classified in this group:"
"B32B27/30","comprising vinyl {(co)polymers; comprising acrylic (co)polymers}","","","","Layered products wherein all layers are made of polymers belonging to  and  are classified in .","B32B27/30|B32B27/32|B32B2250/246","",""
"B32B27/32","comprising polyolefins {(comprising vinyl (co)polymers or acrylic (co)polymers B32B27/30)}","B32B27/30","","","Layered products wherein all layers are made of polymers belonging to  are classified in .Layered products wherein all layers are made of polymers belonging to  and  are classified in .","B32B27/32|B32B2250/242|B32B27/30|B32B27/32|B32B2250/246","",""
"B32B27/36","comprising polyesters","","","","Layered products wherein all layers are made of polymers belonging to  are classified in .","B32B27/36|B32B2250/244","",""
"B32B29/00","Layered products comprising {a layer of} paper or cardboard","","Impregnation or coating of paper; special paper ","D21H","Layered products wherein all layers are made of paper or paperboard are classified in .Coating on a paper or paperboard layer is classified with an appropriate Indexing symbol in .Impregnation of a paper or paperboard layer is classified with an appropriate Indexing symbol in .","B32B2250/26|B32B2255/00|B32B2260/00","",""
"B32B33/00","Layered products characterised by particular properties or particular surface features, e.g. particular surface coatings; Layered products designed for particular purposes not covered by another single class","","Surface unevennesses or non-uniformities","B32B3/00","Properties should as far as possible be classified in ","B32B2307/00","",""
"B32B37/00","Methods or apparatus for laminating, e.g. by curing or by ultrasonic bonding","","Making layered products containing glass and synthetic resin layersApplying liquids or other fluent materials to surface, e.g. coating Extrusion moulding, e.g. coextrusion Lining or sheathing with preformed layers of plastic an object which cannot be seen as a layerJoining or sealing of preformed plastic partsJoining a relatively small portion of the surface of plastic articlesMaking compositesCorrugating paper combined with laminating Associating two or more webs ","B32B17/10807|B05|B29C48/00|B29C63/00|B29C65/00|B29C66/43|B29C70/00|B31F1/20|B65H39/16","Coextrusion steps are classified in  or  as long as the coextruded layers are joined with at least one additional layer.Coating steps are classified in  as long as the coated layers are joined with at least one additional layer.","B32B37/153|B32B37/156|B32B2037/243","",""
"B32B37/0038","{involving application of liquid to the layers prior to lamination, e.g. wet laminating  (B32B37/12 takes precedence)}","B32B37/12","Applying liquids in general","B05","","","",""
"B32B37/025","{Transfer laminating}","","Labelling","B65C9/00","Particular aspects directed to removing the carrier layers are classified in .","B32B38/10","",""
"B32B37/1027","{Pressing using at least one press band}","","Pressing means with cooperating endless bands in general","B30B5/06","","","",""
"B32B37/18","involving the assembly of discrete sheets or panels only","","","","","","Discrete sheets or panels Dimension of sheets or panels is determined at the instant when sheets or panels come into contact.",""
"B32B37/20","involving the assembly of continuous webs only","","","","","","Continuous websDimension of webs or layers is determined at the instant when webs or layers come into contact.",""
"B32B37/22","involving the assembly of both discrete and continuous layers","","","","","","Discrete and continuous layers Dimension of layers is determined at the instant when layers come into contact.",""
"B32B38/00","Ancillary operations in connection with laminating processes","","","","","","",""
"B32B38/0008","{Electrical discharge treatment, e.g. corona, plasma treatment; wave energy or particle radiation  (heat treatment B32B38/0036)}","B32B38/0036","Surface shaping ","B29C59/00","Laminate treatment is additionally classified in groups  - .","B32B2310/00|B32B2310/14","",""
"B32B38/0032","{increasing porosity  (B32B38/04 takes precedence)}","B32B38/04","Permeability to gasesPermeability to liquids","B32B2307/724|B32B2307/726","","","",""
"B32B38/10","Removing layers, or parts of layers, mechanically or chemically","","Punching, slitting or perforating without removing materialDelamination of layered products not in connection with the lamination processRemoving scrap from containers, e.g. removing labelsRemoving applied preformed layers or sheets used as a coating","B32B38/04|B32B43/006|B08B9/083|B29C63/0013","","","",""
"B32B38/14","Printing or colouring","","Printing ","B41M","","","",""
"B32B39/00","Layout of apparatus or plants, e.g. modular laminating systems","","Constructional aspects of laminating apparatus","B32B37/0046","","","","This place covers: The layout of stations in a manufacturing line."
"B32B41/00","Arrangements for controlling or monitoring lamination processes; Safety arrangements","","","","","","","This place covers: Arrangements for controlling or monitoring lamination parameters; Arrangements for detecting defaults and taking corrective measures; Arrangements for controlling quality."
"B32B43/00","Operations specially adapted for layered products and not otherwise provided for, e.g. repairing; Apparatus therefor","","Operations carried out during or in connection with lamination process , ","B32B37/00|B32B38/00","","","Specially adapted for layered productsThe layered structure of the product governs the operations or the apparatus structure.",""
"B32B43/006","{Delaminating}","","Removing layers or parts of layers carried out during or in connection with the lamination processRemoving scrap from containers, e.g. removing labelsRemoving applied preformed layers or sheets used as a coating","B32B38/10|B08B9/083|B29C63/0013","","","",""
"B32B2264/10","Inorganic particles","","Layered products comprising a layer of natural mineral particles ","B32B19/00","","","","This place covers: Inorganic particles in compositions which form a particulate layer or being present as additives."
