"cpc_code","title","title_cpc_codes","informative_references","informative_references_cpc_codes","special_rules","special_rules_cpc_codes","glossary_of_terms","definition_statement"
"B32B7/00","Layered products characterised by the relation between layers; Layered products characterised by the relative orientation of features between layers, or by the relative values of a measurable parameter between layers, i.e. products comprising layers having different physical, chemical or physicochemical properties; Layered products characterised by the interconnection of layers","","In respect of orientation of features, see the relevant groups for the features concerned, e.g. for direction of fibresIn respect of substances - ","B32B5/02|B32B9/00|B32B29/00","","","","This place covers: This group covers layered products in which the relationship between the layers is important. The relationship could be, for example, the differences between physical or chemical properties, patterns of connection, and the orientations of features."
"B32B7/02","Physical, chemical or physicochemical properties","","","","","","","This place covers: This group covers layered products characterised by having two or more layers, one of which differs from another with respect to a physical property, e.g. density, melting point, refractive index. Examples of this type of product are those comprising layers of: Hard and soft wood, High and low density PE, Harder and softer nylon, Oriented and non-oriented PP, Plasticized and non-plasticized PVC."
"B32B7/03","with respect to the orientation of features  (direction of fibres or filaments B32B5/12)","B32B5/12","Layered products characterised by a layer comprising a deformed thin sheet, e.g. corrugated, crumpledCorrugated paper or cardboard","B32B3/28|B32B29/08","","","","This place covers: This group covers layered products characterised by having two or more layers, one of which differs from another with respect to the orientation of features, e.g. the direction of one layer's corrugation or joints differs from that of another layer. The layers may be next to each other or separated by other layers."
"B32B7/06","permitting easy separation","","Adhesives in the form of films or foils having a release liner","C09J7/40","","","",""
"B32B7/09","by stitching, needling or sewing  (by {mechanically connecting} fibrous layers {to another layer} B32B5/06)","B32B5/06","","","","","",""
"B32B7/10","at least one layer having inter-reactive properties","","","","","","","This place covers: This group covers layered products in which a pair of interconnected layers is bonded by one or both layers having inter-reactive properties, wherein neither layer of the interconnected pair comprises an adhesive – whether a coated adhesive, a tie layer, or a layer described as acting as an adhesive."
"B32B7/12","using interposed adhesives or interposed materials with bonding properties","","Adhesive processes in general or use of a material as adhesive","C09J","","","","This place covers: This group covers layered products comprising an adhesive – whether a coated adhesive, a tie layer or a layer described as acting as an adhesive – inserted between two layers to bond them."
"B32B9/00","Layered products comprising a {layer of a} particular substance not covered by groups B32B11/00 - B32B29/00","B32B11/00|B32B29/00","Layered products characterised by having a fibrous or filamentary layer made of a substance not covered by groups  -  or  - ,  - Layered products characterized by having a particulate layer made of a substance not covered by groups  -  or  - ,  - Layered products characterised by having a foamed layer made of a substance not covered by groups  -  or  – ,  - Products comprising at least two ceramic layersJoining ceramic layers with other ceramic layers or layers of other materials by heating","B32B11/00|B32B17/00|B32B19/00|B32B29/00|B32B5/02|B32B2262/00|B32B2262/14|B32B11/00|B32B17/00|B32B19/00|B32B29/00|B32B5/16|B32B2264/00|B32B2264/12|B32B11/00|B32B17/00|B32B19/00|B32B29/00|B32B5/18|B32B2266/00|B32B2266/14|B32B18/00|C04B37/00","","","",""
"B32B9/002","{comprising natural stone or artificial stone}","","","","","","Artificial stone Material made by crushing and grinding natural stone and then re-constituting it, e.g. with cement mortar or with a resin binder ",""
"B32B11/02","with fibres or particles {being present as additives in the layer}","","Product characterised by a fibrous or filamentary layer embedded or impregnated in a bituminous substance, Product characterised by a particulate layer embedded or impregnated in a bituminous substance, ","B32B5/02|B32B2260/042|B32B5/16|B32B2260/042","The nature of the fibres or filaments is classified in .The nature of the particles is classified in .","B32B2262/00|B32B2264/00","",""
"B32B13/00","Layered products comprising a {a layer of} water-setting substance, e.g. concrete, plaster, asbestos cement, or like builders' material","","Cements; Compositions thereof, e.g. mortars, concrete or like building materials ","C04B","","","",""
"B32B13/02","with fibres or particles {being present as additives in the layer}","","Product characterised by a fibrous or filamentary layer embedded or impregnated in a water-setting substance, Product characterised by a particulate layer embedded or impregnated in a water-setting substance, ","B32B5/02|B32B2260/044|B32B5/16|B32B2260/044","The nature of the fibres or filaments is classified in .The nature of the particles is classified in .","B32B2262/00|B32B2264/00","",""
"B32B15/00","Layered products comprising {a layer of} metal","","Layered products characterised by having a metallic fibrous or filamentary layer, Layered products characterised by having a metallic particulate layer, Layered products characterised by having a metallic foamed layer, Coatings on or with metalsElectrolytic deposition of metals","B32B5/02|B32B2262/103|B32B5/16|B32B2264/105|B32B5/18|B32B2266/045|C23C|C25D","Coating on a metallic layer is classified with an appropriate Indexing symbol in ","B32B2255/00","","This place covers: Layered products characterised by having a continuous or discontinuous metal layer."
"B32B15/01","all layers being exclusively metallic {(making layered metal workpieces by pressure cladding B23K20/22; making coatings with a metallic material characterised by its composition C23C30/00)}","B23K20/22|C23C30/00","Biomedical applications, stents, Rolling of metalsPowder metallurgyChanging the physical structure of ferrous metals/alloysChanging the physical structure of non ferrous metals/alloysHeat exchangersArmour constructions/platesElectrical wiresMagnetsBatteries/fuel cellsElectrical connectorsElectronic components","A61F|A61L|B21B|B22F|C21D|C22F|F28F|F41H|H01B|H01F|H01M|H01R|H05K","In metallic layered products having layer(s) of a specific composition, in addition to classification in , the composition of each layer is classified in  ( - ).When the layered product is produced by a specifically described method (examples, claims) then the method is classified as well (, , , , , etc.).When the layered product is intended for a particular use then the use is classified as well (see informative references for illustrative uses).Galvanized steels having a specific composition of a substrate and/or of the Zn layer are classified in .Brazing sheets/composite materials (e.g. for heat exchangers) with all layers formed of aluminium or aluminium alloys are classified in .A layered product consisting of a layer of steel, a layer of aluminium alloy and a layer of Ni alloy will be classified in both other  and .","B32B15/01|C22C|C22C5/00|C22C45/00|B22F|C23C|B23K|C25D|B21B|B32B15/013|B32B15/016|B32B15/012|B32B15/015","","This place covers: Layered products with all layers being metallic in the form of sheets/plates, distinct layers. They can be made by any possible method such as roll bonding, cladding, brazing, coating etc."
"B32B17/00","Layered products essentially comprising sheet glass, or glass, slag, or like fibres","","Layered products comprising a fibrous layerFurniture panels or shelvesShow cases or cabinetsFibre-reinforced materialProducing optical elements from plasticsDesigns with unusual light effectsGlass compositionsCoatings on glassSurface treatment of glass fibresJoining pieces of glass to pieces of other inorganic materialManufacture of prepregsCompositions of polymersCoverings or linings of glass, e.g. for walls or ceilingsLayout of fixed or moving closures, e.g. windowsInsulating glass windowsConstructional features of refrigeratorsOptical devices made from glassAlarm windowsBillboardsWindow antennasPrinted circuit boards comprising glass substratesTransparent shielding materials against electric or magnetic fields","B32B5/02|A47B96/00|A47F3/00|B29C66/721|B29D11/00|B44F1/00|C03C3/00|C03C17/00|C03C25/00|C03C27/00|C08J5/24|C08L|E04F13/14|E06B3/54|E06B3/67|F25D23/00|G02B1/00|G08B13/04|G09F13/00|H01Q1/1271|H05K1/0306|H05K9/0094","In this group a layer of organic glass is not considered as a glass layer but as a synthetic resin layer which is classified using orthogonal Indexing symbols selected from the groups  -  allocated as single symbols or in C-Sets as explained in .The layer adjacent to the glass layer is specified by classifying in one of the appropriate groups selected in the range  - .Layered products comprising a layer of glass next to a layer of synthetic resin are classified in .Layered products comprising a layer of glass next to a layer of synthetic resin that are considered to be laminated safety glass or glazings satisfying safety requirements are classified in  and subgroups.Certain synthetic resin materials are further specified in  when they are used as an interlayer to create a laminated safety glass or glazing. requires that the layered product comprises at least one glass layer and at least one layer of another material; a layered product comprising both a glass layer and a glass fibre layer is classified in both  (or ) and .","B32B2319/00|B32B2386/00|B32B17/10005|B32B17/06|B32B17/10005|B32B17/10|B32B17/10005|B32B17/1055|B32B17/00|B32B17/02|B32B17/04|B32B17/06","Laminated safety glass or glazing, safety glazing, laminated glazing Inorganic glass pane bonded to another inorganic glass pane or to a durable polymeric pane via a resin interlayer and satisfying safety requirements wherein the interlayer keeps the panes bonded even when struck or broken, preventing the glass from shattering into large, jagged pieces.InterlayerAn internal layer of thermoplastic polymer bonding the components of a laminated safety glass or glazing to one another.Intermediate layer, intermediate filmAn internal layer or film used as a barrier or as a carrier for functional layers and not having adhesive properties.PlasticiserOrganic compound which reduces the glass transition temperature of the interlayer, usually an interlayer of PVB.GlazingA transparent closure of an opening such as the glass of a window.","This place covers: Layered products comprising inorganic glass in sheet or film form, or fibres of glass or slag united with another layer of inorganic glass, glass in the form of a sheet or film bonded with a transparent synthetic resin to another transparent layer, and laminated glazings."
"B32B17/02","in the form of fibres or filaments","","",""," requires that the layered product comprises at least one glass layer and at least one layer of another material; a layered product comprising both a glass layer and a glass fibre layer is classified in both  (or ) and .","B32B17/00|B32B17/02|B32B17/04|B32B17/06","",""
"B32B17/06","comprising glass as the main or only constituent of a layer, next to another layer of a specific {material}","","",""," is given in the case that an inorganic glass layer is present next to another glass layer with no further information.","B32B17/06","","This place covers: Layered products comprising an inorganic glass layer in sheet or film form next to another layer of generic material. The layers need not be permanently secured, such as a releasable protective layer."
"B32B17/08","of cellulosic plastic substance {or gelatin}","","","","","","","This place covers: Layered products comprising inorganic glass in sheet or film form next to a layer of a cellulose derivative or gelatin as polymeric substance."
"B32B17/10","of synthetic resin","","","","In this group, a layer of organic glass is not considered as a glass layer but as a synthetic resin layer. The nature of the synthetic resin material is classified using the appropriate orthogonal symbols from groups  -  as a single symbol(s).","B32B2319/00|B32B2386/00","","This place covers: Layered products comprising at least one inorganic glass layer in sheet or film form next to a layer of synthetic resin; the synthetic resin layer can be used as a glue layer to bond the glass layer with another glass layer or another material layer or can be used as a removable protective film."
"B32B17/10005","{laminated safety glass or glazing}","","Glass compositionsCoatings on glassJoining pieces of glass to pieces of other inorganic materialSky-lightsCoverings or linings of glass, e.g. for walls or ceilingsLayout of fixed or moving closures, e.g. windowsInsulating glass windowsOptical devices made from glassAlarm windowsTransparent shielding materials against electric or magnetic fields","C03C3/00|C03C17/00|C03C27/00|E04D13/03|E04F13/14|E06B3/54|E06B3/67|G02B1/00|G08B13/04|H05K9/0094","Laminated safety glass comprising at least one layer of inorganic glass, a resin interlayer and an external layer of a synthetic polymeric sheet or film is classified using the appropriate group selected from  -  together with the  -  orthogonal Indexing symbol that designates the polymeric material of said external polymer layer as a single symbol.The presence of resin interlayers, their properties and/or their compositions are further specified in groups  - .When  is used as a base symbol in C-Sets, it is not allocated as a separate single symbol.Combination sets (C-Sets):C-Sets statement: #B32BaIn subgroup , the polymeric material of an intermediate layer sandwiched between interlayers of a laminated safety glass or glazing is classified in the form of C-Sets.In #B32Ba, the base symbol, representing the laminated safety glass structure comprising an interlayer adjacent the glass, is taken from subgroup , whereas the subsequent symbol representing the nature of the polymeric material of the intermediate layer sandwiched between interlayers is taken from the groups  - .When the polymeric intermediate layer comprises a mixture of polymeric materials taken from  - , separate C-Sets are given based on each polymeric material as the subsequent symbol. is not allocated as a separate single symbol when it is allocated as a base symbol in a C-Set.C-Sets syntax rules:Each C-Set shall contain exactly two symbols.Duplicate symbols are not allowed in these C-Sets.The order of symbols in these C-Sets is relevant as it reflects the laminated safety glass structure as the base symbol, followed by the polymeric material forming the intermediate layer as the subsequent symbol.C-Sets examples:#B32Ba: In a safety glass laminate () comprising outer glass panes and a composite interlayer comprising a polycarbonate sheet, the polycarbonate () sandwiched between two polyvinyl butyral (PVB) interlayers is classified as (, ) and the PVB interlayers are classified as .#B32Ba: In a safety glass () comprising a first outer layer of glass, a second outer layer of rigid polymer and an intermediate film adhering the first outer layer to the second outer layer, wherein the intermediate film has the layer structure: polyurethane/polyacrylate/polyurethane, the polyacrylate () is classified as (, ) and the polyurethane interlayers are classified as .#B32Ba: In a glass laminate (see figure below) comprising a thermoplastic top layer 12 of polycarbonate (), a bottom layer 16 formed of tempered glass, and an intermediate layer 14 of polyethylene terephthalate (PET) () positioned between the top 12 and bottom 16 layers, wherein the three layers 12, 14, and 16 are bonded together using a polyurethane adhesive 18 and the glass laminate meets safety glass requirements (), the PET intermediate layer 14 is classified as (, ), the polyurethane adhesive layers (interlayers) 18 are classified as , and the polycarbonate top (outer) layer 12 is classified as  as a single symbol.","B32B17/10009|B32B17/1099|B32B2319/00|B32B2386/00|B32B17/1055|B32B17/10798|B32B17/10005|B32B17/10005|B32B17/10005|B32B2319/00|B32B2386/00|B32B2319/00|B32B2386/00|B32B17/10005|B32B17/10005|B32B2369/00|B32B17/10005|B32B2369/00|B32B17/10761|B32B17/10005|B32B2333/08|B32B17/10005|B32B2333/08|B32B17/1077|B32B2369/00|B32B2367/00|B32B17/10005|B32B17/10005|B32B2367/00|B32B17/1077|B32B2369/00","Laminated safety glass or glazing, safety glazing, laminated glazingInorganic glass pane bonded to another inorganic glass pane or to a durable polymeric pane via a resin interlayer and satisfying safety requirements wherein the interlayer keeps the panes bonded even when struck or broken, preventing the glass from shattering into large, jagged pieces.InterlayerAn internal layer of thermoplastic polymer bonding the components of a laminated safety glass or glazing to one another.Intermediate layer, intermediate filmAn internal layer or film used as a barrier or as a carrier for functional layers and not having adhesive properties.PlasticiserOrganic compound which reduces the glass transition temperature of the interlayer, usually an interlayer of PVB.","This place covers: Layered products comprising at least one inorganic glass layer in sheet form next to a layer of synthetic resin; wherein the glass sheet is permanently bonded to at least one further glass sheet or a durable polymer sheet or film, by means of the synthetic resin layer as an interlayer which provides for a predetermined force of adhesion between the layers by subjecting them to a lamination process with emphasis on the absence of optical defects, and provides the laminated product with properties satisfying the requirements of safety glass, e.g. the synthetic resin layer keeps the layers bonded even when broken, preventing the glass from shattering."
"B32B17/10431","{Specific parts for the modulation of light incorporated into the laminated safety glass or glazing}","","Optical filtersPolarising elementsDevices for the control of the intensity of light based on liquid crystalsDevices for the control of the intensity of light based on electrochromic elementsDevices for the control of the intensity of light based on electrophoresisDevices for the control of the intensity of light based on suspension of oriented dipolar particles","G02B5/20|G02B5/30|G02F1/13|G02F1/15|G02F1/167|G02F1/172","","","",""
"B32B17/10669","{Luminescent agents}","","Optical brightening agentsLuminescent agents","C08K5/0041|C09K11/00","","","",""
"B32B17/10917","{between two pre-positioned glass layers}","","Making multi-layered products between preformed layers in generalSpacing elements for window units comprising two or more parallel panes","B29C39/126|E06B3/663","","","",""
"B32B18/00","Layered products essentially comprising ceramics, e.g. refractory products","","Laminates containing only one ceramic layer layered structures comprising at least one glass sheetPrinting on laminatessemi-permeable membranes made of inorganic materialceramic coatings on glassClay-waresceramic layers characterised by their compositionJoining a ceramic layer to another layerporous ceramic productsCoatings of ceramicsAspects relating to ceramic starting mixtures or sintered ceramic productsAspects relating to ceramic laminates or to joining of ceramic articles with other articles by heatingsensor elements of laminated structure containing a solid electrolyteStacked fixed capacitors, e.g. multilayer ceramic capacitors","B32B9/005|B32B17/00|B32B38/14|B01D71/02|C03C17/00|C04B33/00|C04B35/00|C04B37/00|C04B38/00|C04B41/45|C04B2235/00|C04B2237/00|G01N27/4071|H01G4/30","Under  the emphasis is on how the articles are joined. If two ceramic layers are joined, but the emphasis is not on how they are joined, classification would be in .Secondary aspects of making ceramic laminates () and of joining ceramic articles with other articles through heating () are classified with Indexing Code , e.g. the composition of the layers or articles that are laminated or joined.Aspects regarding the heat treatments that are used for laminating are classified in  and with Indexing Code , where the heat treatment of the laminating step should be considered as a sintering step. If for instance pressure is exerted during heating to laminate the articles,  should be given. Aspects regarding the atmosphere of the heating step, possible annealing steps, heating rate, cooling rate, etc. are given Indexing Code .If much detail regarding the composition and/or synthesis of one or more ceramic layers or articles is given, classification in  should be considered.Electrode and electrodes layers that are inserted between ceramic substrate layers are normally not seen as interlayers, since they normally do not have the function of joining the two ceramic substrates. They therefore do not receive a  Indexing Code. Only if it is clear that the electrode does have a joining effect, would it be regarded as an interlayer, and an Indexing Code under  would be allocated. In that case  has to be used and there is no classification in .","C04B37/00|B32B18/00|B32B18/00|C04B37/00|C04B2237/00|C04B35/64|C04B2235/65|C04B35/645|C04B2235/65|C04B35/00|C04B2237/12|C04B2237/12|C04B37/006|B32B18/00","","This place covers: At least two pre-shaped green ceramic, ceramic pre-form (e.g. a ceramic fiber pre-form) or sintered ceramic layers are joined together, where the emphasis is not on the joining method. It also encompasses two layers of ceramic powders that are pressed together in a press. If after joining the two ceramic layers other type of layers, e.g. metallic or plastic layers are joined to the initial ceramic laminate, classification under other main groups of   will be necessary as well, but classification in   remains. If in between the two ceramic layers there is a thin, non-essential layer of another material, e.g. a metallic electrode, it is still classified in  , but classification in other groups of   should be considered.   is normally not used for laminates containing identical ceramic layers, such as in multilayer capacitors.  also contains cold bonding of ceramic substrates."
"B32B19/00","Layered products comprising {a layer of} natural mineral fibres or particles, e.g. asbestos, mica","","Layered products characterised by having a layer of rockwool fibres, ","B32B5/02|B32B2262/108","Product features classified in this group are also classified in .","B32B5/00","","This place covers: Layered products characterised by having a layer made of naturally occurring mineral fibres or particles."
"B32B19/02","{the layer of fibres or particles being impregnated or} embedded in a plastic substance","","Products characterised by a plastic layer with natural mineral fibres or particles being present as additives, ","B32B25/02|B32B27/18","","","",""
"B32B21/00","Layered products comprising {a layer of} wood, e.g. wood board, veneer, wood particle board","","Working veneer or plywood Treating of woodManufacturing articles made of fibres or particles of wood","B27D|B27K|B27N","Coating on a wood layer is classified with an appropriate Indexing symbol in .Impregnation of a wood layer is classified with an appropriate Indexing symbol in .","B32B2255/00|B32B2260/00","",""
"B32B23/00","Layered products comprising {a layer of} cellulosic plastic substances {, i.e. substances obtained by chemical modification of cellulose, e.g. cellulose ethers, cellulose esters, viscose}","","Products characterised by having fibrous or filamentary layer made of a cellulosic plastic substance,  - Layered products characterised by having a particulate layer made of a cellulosic plastic substance,  -  ","B32B5/02|B32B2262/00|B32B2262/14|B32B5/16|B32B2264/00|B32B2264/12","","","",""
"B32B25/00","Layered products comprising {a layer of} natural or synthetic rubber {(fibrous or filamentary layer made of a natural or synthetic rubber B32B5/02; particulate layer made of a natural or synthetic rubber B32B5/16; foamed layer made of a natural or synthetic rubber B32B5/18)}","B32B5/02|B32B5/16|B32B5/18","Layered product having a layer comprised of a thermoplastic elastomerManufacture of polymeric films or sheetsCompositions of macromolecular compounds","B32B2274/00|C08J5/00|C08L","Layered products wherein all layers are polymeric are classified in .Coating on a layer of natural or synthetic rubber is classified with an appropriate Indexing symbol in .","B32B2250/24|B32B2255/00","Thermosetting Rubber Vulcanized rubber that cannot be re-melted or remolded without destroying its original characteristics. VulcanizationAn irreversible process during which a rubber compound through a change in its chemical structure (for example, cross-linking) becomes less plastic and more resistant to swelling by organic liquids and elastic properties are conferred, improved, or extended over a greater range of temperature.","This place covers: Layered products characterised by a layer of thermosetting synthetic rubber."
"B32B25/02","with fibres or particles {being present as additives in the layer}","","","","The nature of the fibres or filaments present as additives is classified in .The nature of the particles present as additives is classified in .","B32B2262/00|B32B2264/00","",""
