"cpc_code","title","title_cpc_codes","informative_references","informative_references_cpc_codes","special_rules","special_rules_cpc_codes","glossary_of_terms","definition_statement"
"B66C13/40","Applications of devices for transmitting control pulses; Applications of remote control devices  (control in general G05)","G05","","","","","","This place covers: Remote controls for cranes and winches, i.e. outside cabin, includes both hard wired and wireless units. See for example US 2003/0164349"
"B66C13/42","Hydraulic transmitters","","","","","","","This place covers: Control arrangements using hydraulic signal transmission, e.g. between sensor and central unit."
"B66C13/44","Electrical transmitters","","","","","","","This place covers: Control arrangements using electric signal transmission, e.g. between sensor and central unit. See for example US 2009/0250424"
"B66C13/46","Position indicators for suspended loads or for crane elements","","","","","","","This place covers: Sensors and cameras for detecting position of loads or parts of crane. See for example US 2004/0015264"
"B66C13/48","Automatic control of crane drives for producing a single or repeated working cycle; Programme control","","","","","","","This place covers: Systems allowing the crane to carry out an automatic movement, for example based on a program or target position, includes path planning and stack optimisation. See for example US 6 065 619"
"B66C13/50","Applications of limit circuits or of limit-switch arrangements  (for winding mechanisms B66D1/56)","B66D1/56","","","","","","This place covers: See for example US 2011/0089131"
"B66C13/52","Details of compartments for driving engines or motors or of operator's stands or cabins","","","","","","","This place covers: Engine and motor compartments. See for example US 4 045 866"
"B66C13/54","Operator's stands or cabins","","","","","","","This place covers: Operator's compartments. See for example EP 0 870 725"
"B66C13/56","Arrangements of handles or pedals","","","","","","","This place covers: Control devices actuated by the operator. See for example US 2007/0156280"
"B66C15/00","Safety gear  (for rope, cable, or chain winding mechanisms B66D1/54)","B66D1/54","","","","","","This place covers: General crane safety devices not covered by one of the following subgroups for example component testing. US 4 643 031"
"B66C15/02","for retaining load-engaging elements in the event of rope or cable breakage","","","","","","","This place covers: See for example US 5 735 507"
"B66C15/04","for preventing collisions, e.g. between cranes or trolleys operating on the same track","","","","","","","This place covers: See for example DE 10 2009 006 103"
"B66C15/045","{electrical}","","","","","","","This place covers: Electrical anti-collision devices. See for example US 3 167 753"
"B66C15/06","Arrangements or use of warning devices","","","","","","","This place covers: Non-electric devices, e.g. with visual indication See for example US 2007/0205618"
"B66C15/065","{electrical}","","","","","","","This place covers: See for example EP 1 221 426"
"B66C17/04","with lifting beams, e.g. slewable beams, carrying load-engaging elements, e.g. magnets, hooks  (constructions of load-engaging elements B66C1/00, B66C3/00)","B66C1/00|B66C3/00","","","","","","This place covers: Devices where the load carrying element is connected to the lifting beam, i.e. not suspended by cables. See for example EP 0 314 632"
"B66C17/06","specially adapted for particular purposes, e.g. in foundries, forges; combined with auxiliary apparatus serving particular purposes  (B66C17/04 takes precedence)","B66C17/04","","","","","","This place covers: Specially adapted devices, i.e. with particular mechanical features making them especially suitable for a particular application not covered by the following subgroups."
"B66C17/08","for charging treatment chambers, e.g. furnaces, kilns, ovens  (charging furnaces in general F27D3/00)","F27D3/00","","","","","","This place covers: See for example EP 2 275 764"
"B66C17/10","for transporting ladles","","","","","","","This place covers: See for example US 3 874 513"
"B66C17/12","for handling workpieces, e.g. ingots, which require to be supported temporarily within, or withdrawn from, a treatment chamber, e.g. tong cranes, soaking-pit cranes, stripper cranes  (for manipulating ingots during forging B66C17/18; grippers for handling or stripping castings or ingots during manufacture B22D29/00)","B66C17/18|B22D29/00","","","","","","This place covers: See for example US 4 736 971"
"B66C17/14","Tong cranes with means for moving article-pushers relative to the tongs","","","","","","","This place covers: See for example DE 1 181 866 B"
"B66C17/16","Tong cranes with means for turning the tongs about a vertical axis","","","","","","","This place covers: See for example DE 1 109 196 B"
"B66C17/18","for manipulating workpieces during forging operations  (work-pieces manipulators in forging machines B21J13/10)","B21J13/10","","","","","","This place covers: See for example DE 35 08 195"
"B66C17/20","for hoisting or lowering heavy load carriers, e.g. freight containers, railway wagons","","","","","","","This place covers: See for example US 5 803 280"
"B66C17/22","for hoisting or lowering locomotives","","","","","","","This place covers: See for example US 1 497 961"
"B66C17/26","combined with auxiliary apparatus, e.g. log saws, pushers for unloading vehicles, means for shunting railway vehicles","","","","","","","This place covers: See for example US 2011/0142590"
"B66C19/00","Cranes comprising trolleys or crabs running on fixed or movable bridges or gantries  (B66C17/00 takes precedence; base supporting structures with legs B66C5/00; jib cranes B66C23/00)","B66C17/00|B66C5/00|B66C23/00","","","","","","This place covers: Gantry cranes not covered by the following subgroups. See for example US 5 405 029"
"B66C19/002","{Container cranes  (B66C19/007 takes precedence)}","B66C19/007","","","","","","This place covers: Gantry cranes for containers, i.e. static cranes or cranes with wheels which are static when handling loads. See for example US 2009/0191028"
"B66C19/005","{Straddle carriers  (B66C19/007 takes precedence)}","B66C19/007","","","","","","This place covers: Straddle carriers for loads other than containers, e.g. boats. See for example US 5 893 471"
"B66C19/007","{for containers}","","","","","","","This place covers: Straddle carriers for containers, i.e. wheeled devices which carry containers around ports. See for example EP 1 829 810"
"B66C19/02","collapsible {(B66C19/002, B66C19/005 takes precedence)}","B66C19/002|B66C19/005","","","","","","This place covers: Easily dismantlable gantry cranes. See for example US2007/0163982"
"B66C21/00","Cable cranes, i.e. comprising hoisting devices running on aerial cable-ways  (rope or cable drives for trolleys, combinations of such drives with hoisting gear B66C11/16; railway systems B61B; rope or cable winding mechanisms B66D1/00)","B66C11/16|B61B|B66D1/00","","","","","","This place covers: Devices not falling into one of the following subgroups. See for example US 7 234 605"
"B66C21/02","with cable-ways supported on framework swingably connected to groundengaging elements","","","","","","","This place covers: Cable cranes where one support for the end of the cable is pivotable. See for example GB 130 008"
"B66C21/04","with cable-ways supported at one end or both ends on bodily movable framework, e.g. framework mounted on rail track","","","","","","","This place covers: Cable cranes where one end of the cable is not fixed. See for example US 5 816 636"
"B66C21/06","with one end supported on a framework movable in a curved, e.g. circular, path and the other end by a column rotatable around a vertical axis","","","","","","","This place covers: See for example DE 30 37 894"
"B66C21/08","Sag carriers or rope trolleys, suspended or not, e.g. fixed but offering clearance for travelling gear","","","","","","","This place covers: Arrangements for supporting cables. See for example US 4 355 727"
"B66C21/10","travelling","","","","","","","This place covers: Supports which are movable along the cable. See for example GB 374 921"
"B66C23/00","Cranes comprising essentially a beam, boom, or triangular structure acting as a cantilever and mounted for translatory of swinging movements in vertical or horizontal planes or a combination of such movements, e.g. jib-cranes, derricks, tower cranes  (base supporting structures with legs B65C5/00)","B65C5/00","","","Stationary cranes are classified in  - .Tower type cranes (which may be mobile) are classified in  - .Mobile cranes are classified in  and later subgroups.Groups  onwards apply to all types of crane.","B66C23/00|B66C23/24|B66C23/26|B66C23/34|B66C23/36|B66C23/54","",""
"B66C23/005","{with balanced jib, e.g. pantograph arrangement, the jib being moved manually}","","","","","","","This place covers: See for example US 5 203 837"
"B66C23/02","with non-adjustable and non-inclinable jibs mounted solely for slewing movements","","","","This group is only used if the following subgroups are not applicable. Documents may be classified in more than one subgroup.","","","This place covers: Jib cranes with a fixed vertical column mounted on the ground as the sole support, with a jib mounted for slewing at the top of the column, i.e. the column does not rotate and the inclination of the jib can not be altered."
"B66C23/022","{Pivot axis common with column}","","","","","","","This place covers: Jibs pivoting around the centre of the column. See for example WO 2009/003554"
"B66C23/025","{with particular mounting for base of column}","","","","","","","This place covers: See for example EP 1 460 024"
"B66C23/027","{Pivot axis separated from column axis}","","","","","","","This place covers: Jibs whose pivot is not in line with the axis of the column. See for example US 6 367 855"
"B66C23/04","with jibs the effective length of which is variable in operation, e.g. longitudinally displaceable, extensible","","","","","","","This place covers: See for example US 5 509 638"
"B66C23/06","with jibs mounted for jibbing or luffing movements","","","","","","","This place covers: Fixed cranes with luffing jibs not covered by one of the subgroups   -  ."
"B66C23/08","and adapted to move the loads in predetermined paths","","","","","","","This place covers: Mechanical arrangements for following a particular non-horizontal path. See for example DE 44 15 029"
"B66C23/10","the paths being substantially horizontal; Level-luffing jib-cranes","","","","","","","This place covers: See for example US 3 884 359"
"B66C23/12","with means for automatically varying the effective length of the hoisting rope or cable","","","","","","","This place covers: See for example GB 1 392 223"
"B66C23/14","with means, e.g. pantograph arrangements, for varying jib configuration","","","","","","","This place covers: See for example GB 985 801"
"B66C23/16","with jibs supported by columns, e.g. towers having their lower end mounted for slewing movements","","","","","","","This place covers: Jib cranes with a fixed vertical column mounted on the ground as the sole support, includes cranes with a jib mounted for slewing at the centre or bottom of the column, i.e. at least part of the column rotates. the jib may or may not be inclinable. See for example US 3 358 849"
"B66C23/163","{where only part of the column rotates, i.e. at least the bottom part is fixed}","","","","","","","This place covers: See for example US 3 181 707"
"B66C23/166","{Simple cranes with jibs which may be fixed or can slew or luff}","","","","","","","This place covers: Small cranes without wheels. See for example US 2005/0161422"
"B66C23/18","specially adapted for use in particular purposes","","","","","","","This place covers: Cranes with jibs for specific applications not covered by the following groups   -  . See for example US 2001/0051074"
"B66C23/185","{for use erecting wind turbines  (B66C23/207 takes precedence)}","B66C23/207","","","","","","This place covers: See for example US 2005/0211653"
"B66C23/20","with supporting couples provided by walls of buildings or like structures","","","","","","","This place covers: Jib cranes which are not supported only by a simple foot on the ground, but (also) by other means, e.g. additional support from a building, which do not fit one of the following subgroups."
"B66C23/201","{with supporting couples provided from above, e.g. by ceilings of buildings}","","","","","","","This place covers: Supported either from only above or from both above and below. See for example US 4 096 952"
"B66C23/202","{with supporting couples provided from below, e.g. by floors of buildings}","","","","","","","This place covers: Cranes supported only from below, but requiring extra support, i.e. not merely mounted by a simple crane foot. See for example US 2 382 299"
"B66C23/203","{with supporting couples provided by posts, e.g. scaffolding, trees or masts}","","","","","","","This place covers: See for example US 4 880 345"
"B66C23/205","{for use on top of roofs}","","","","","","","This place covers: See for example US 3 671 015"
"B66C23/206","{with supporting couples provided by iso containers}","","","","","","","This place covers: Cranes mounted on or in containers See for example EP 2 196 427"
"B66C23/207","{with supporting couples provided by wind turbines}","","","","","","","This place covers: Mounted on or supported by wind turbines or for erecting wind turbines. See for example EP1 677 007"
"B66C23/208","{with supporting couples provided from the side, e.g. by walls of buildings}","","","","","","","This place covers: Cranes fixed to walls, i.e. which do not move relative to the wall. See for example GB 2 037 701"
"B66C23/22","Window cranes, i.e. adapted to be supported in window openings","","","","","","","This place covers: See for example US 2008/0035594"
"B66C23/24","Mobile wall cranes","","","","","","","This place covers: Cranes with a jib which runs along a wall. See for example US 3 050 195"
"B66C23/26","for use on building sites; constructed, e.g. with separable parts, to facilitate rapid assembly or dismantling, for operation at successively higher levels, for transport by road or rail  (with supporting couples provided by walls or buildings B66C23/20; mounted on vehicles B66C23/36; jib constructions B66C23/64)","B66C23/20|B66C23/36|B66C23/64","","","","","","This place covers: Tower type cranes not fitting one of the subgroups   -  . See for example US 6 422 408"
"B66C23/28","constructed to operate at successively higher levels","","","","","","","This place covers: Tower cranes where the jib does not have a fixed tower height relative to the ground and do not fit the following two subgroups."
"B66C23/283","{with frameworks composed of assembled elements}","","","","","","","This place covers: Cranes which have towers which can be extended by adding an extra section to the tower. See for example US 4 028 792"
"B66C23/286","{with locking devices}","","","","","","","This place covers: See for example US 3 499 258"
"B66C23/30","with frameworks composed of telescopic elements","","","","","","","This place covers: Cranes which have towers which can be extended by a telescoping section of the tower. See for example US 4 196 814"
"B66C23/305","{with locking devices}","","","","","","","This place covers: See for example US 3 361 456"
"B66C23/32","Self-hoisting cranes","","","","","","","This place covers: Cranes which can alter the height of the jib and top of tower by climbing up other structures. See for example US 3 485 384"
"B66C23/34","Self-erecting cranes, i.e. with hoisting gear adapted for crane erection purposes","","","","","","","This place covers: Cranes which can assemble or erect themselves into their working configuration, not falling into one of the following four subgroups. See for example US 3 378 147"
"B66C23/342","{with telescopic elements}","","","","","","","This place covers: Cranes which erect by extending a telescopic section. See for example US 4 446 975"
"B66C23/344","{adapted for transport purposes}","","","","","","","This place covers: Where the arrangement relates specifically to transport of the crane, i.e. not merely to folding the tower and jib to the horizontal position. See for example US 2004/0221673"
"B66C23/346","{with locking devices}","","","","","","","This place covers: Cranes with devices for locking the elements into their operating or transport positions. See for example US 3 856 150"
"B66C23/348","{the erection being operated by jacks}","","","","","","","This place covers: Cranes where the erecting mechanism uses jacks instead of for example winches and cables. See for example US 2003/0127409"
"B66C23/36","mounted on road or rail vehicles; Manually-movable jib-cranes for use in workshops; Floating cranes  (with pneumatic or hydraulic motors B66C23/54; vehicle or ship aspects B60 - B63)","B66C23/54|B60|B63","","","","","","This place covers: Vehicle mounted cranes not fitting one of the subgroups   –  ."
"B66C23/365","{dismantable into smaller units for transport purposes}","","","","","","","This place covers: See for example US 2007/0221600"
"B66C23/38","with separate prime movers for crane and vehicle","","","","","","","This place covers: Mobile cranes with more than one engine, e.g. where the engine driving the crane lifting functions is not used for propelling the crane along a road."
"B66C23/40","with a single prime mover for both crane and vehicle","","","","","","","This place covers: Where the same engine is used for driving the lifting functions and wheels or tracks."
"B66C23/42","with jibs of adjustable configuration, e.g. foldable","","","","","","","This place covers: Mobile cranes with telescopic or extendable jibs, or jibs which change configuration during operation. See for example US 5 704 498"
"B66C23/44","Jib-cranes adapted for attachment to standard vehicles, e.g. agricultural tractors","","","","","","","This place covers: Vehicle mounted cranes, i.e. mounted on a normal vehicle rather than a mobile crane where the chassis is specially constructed for a crane. pipe laying cranes where a boom is mounted to one side of a wheeled or tracked chassis. See for example US 6 138 991 or US 7 600 646"
"B66C23/46","Mobile jib-cranes with non-slewable jibs","","","","","","",""
"B66C23/48","Manually-movable jib cranes for use in workshops","","","","","","","This place covers: Small cranes on wheels which can be moved around manually or have simple drives. See for example US 2011/0043062"
"B66C23/485","{for lifting and moving engines, e.g. car or aero engines or parts thereof}","","","","","","","This place covers: See for example US 5 800 000"
"B66C23/50","mounted on railway vehicles, e.g. breakdown cranes","","","","","","","This place covers: See for example US 6 691 881"
"B66C23/52","Floating cranes  (floating dredgers E02F)","E02F","","","","","","This place covers: Cranes mounted on a ship or other floating structure. See for example US2011/0031205"
"B66C23/525","{Double slewing cranes on ships}","","","","","","","This place covers: Cranes with double jibs. See for example US 3 684 104"
"B66C23/53","including counterweight or means to compensate for list, trim, or skew of the vessel or platform  (counterweights or supports for balancing lifting couples B66C23/72; equipment to decrease unwanted vessel movements B63B39/00)","B66C23/72|B63B39/00","","","","","","This place covers: See for example WO2011/019121"
"B66C23/54","{with pneumatic or hydraulic motors, e.g. for actuating jib-cranes on tractors}","","","","No corresponding IPC exists. Subject matter should be given an IPC classification in ","B66C23/68","","This place covers: Jib cranes with hydraulic cylinders, e.g. for folding jib for transport. See for example EP 1 707 529"
"B66C23/545","{with arrangements for avoiding dead centre problems during cylinder motion}","","","","","","","This place covers: See for example EP 0 733 585"
"B66C23/58","arranged to carry out a desired sequence of operations automatically, e.g. hoisting followed by luffing and slewing","","","","","","","This place covers: See for example US 4 091 943"
"B66C23/60","Derricks","","","","","","","This place covers: See for example US 4 826 023"
"B66C23/605","{employing ships' masts  (B66C23/525 takes precedence)}","B66C23/525","","","","","","This place covers: See for example US 4 187 949"
"B66C23/64","Jibs","","","","","","","This place covers: Construction of jibs not covered by the following subgroups, e.g. non-telescopic jibs. See for example US 2011/0114587"
"B66C23/66","Outer or upper end constructions","","","","","","","This place covers: See for example EP 1 156 007"
"B66C23/68","foldable or otherwise adjustable in configuration","","","","","","","This place covers: See for example US 2010/0294738"
"B66C23/70","constructed of sections adapted to be assembled to form jibs or various lengths","","","","","","","This place covers: See for example US 2004/0238471"
"B66C23/701","{telescopic}","","","","","","","This place covers: Telescopic sections. See for example EP 1 302 435 Telescoping actuator arrangements with a combination of actuators, e.g. by both cables and cylinders. See for example US3721054"
"B66C23/702","{with a jib extension boom}","","","","","","","This place covers: See for example US 2005/0098524"
"B66C23/703","{telescoped by flexible elements, e.g. cables, chains or bands}","","","","","","","This place covers: See for example US 3 638 806"
"B66C23/705","{telescoped by hydraulic jacks}","","","","","","","This place covers: See for example US 5 678 708"
"B66C23/706","{telescoped by other means}","","","","","","","This place covers: See for example US 4 298 128"
"B66C23/707","{guiding devices for telescopic jibs}","","","","","","","This place covers: Bearings between telescopic sections. See for example US 6 499 612"
"B66C23/708","{locking devices for telescopic jibs}","","","","","","","This place covers: Arrangements to lock the telescopic sections in a particular position. See for example US 6 216 895"
"B66C23/72","Counterweights or supports for balancing lifting couples","","Counterweights for excavators","E02F9/18","","","","This place covers: Counterweights associated with jib. See for example US 6 494 330"
"B66C23/74","separate from jib","","","","","","","This place covers: Static counterweights not associated with jib. See for example US 2006/0043042"
"B66C23/76","and movable to take account of variations of load or of variations of length of jib","","","","","","","This place covers: Movable counterweights not associated with jib. See for example US 6 568 547"
"B66C23/78","Supports, e.g. outriggers, for mobile cranes","","Outriggers for excavators","E02F9/08","","","","This place covers: See for example US 2010/0102018"
"B66C23/80","hydraulically actuated","","","","","","","This place covers: See for example US 2004/0197181"
"B66C23/82","Luffing gear","","","","","","","This place covers: Devices for luffing the jib, including for erection purposes. See for example US 2005/0098522"
"B66C23/821","{Bracing equipment for booms}","","","","","","","This place covers: Bracing equipment to support bending load on the jib or boom, not covered by one of the following subgroups."
"B66C23/823","{Bracing equipment acting in vertical direction}","","","","","","","This place covers: See for example EP 1 213 254"
"B66C23/825","{Bracing equipment acting in horizontal direction}","","","","","","","This place covers: See for example EP 2 271 576"
"B66C23/826","{Bracing equipment acting at an inclined angle to vertical and horizontal directions}","","","","","","","This place covers: See for example US 2004/0129663"
"B66C23/828","{where the angle is adjustable}","","","","","","","This place covers: See for example US 2002/0070187"
"B66C23/84","Slewing gear  (anti-friction bearings F16C)","F16C","","","","","","This place covers: Devices for slewing the upper works or boom of a crane. See for example US2009/0074552"
"B66C23/86","hydraulically actuated","","","","","","","This place covers: Devices for slewing the upper works or boom of a crane using hydraulic motors or cylinders. See for example US 7 677 861"
"B66C23/88","Safety gear  (for cranes in general B66C15/00; for rope, cable, or chain winding mechanisms B66D1/54)","B66C15/00|B66D1/54","","","","","","This place covers: Safety gear for boom cranes not covered by one of the subgroups   -  ."
"B66C23/90","Devices for indicating or limiting lifting moment","","","","","","","This place covers: Non-electrical safety devices."
"B66C23/905","{electrical}","","","","","","","This place covers: Electrical safety devices."
"B66C23/92","Snubbers or dashpots for preventing backwards swinging of jibs, e.g. in the event of cable or tackle breakage","","","","","","","This place covers: See for example US 2 840 244"
"B66C23/94","for limiting slewing movements","","","","","","","This place covers: See for example US 2007/0144995"
