"cpc_code","title","title_cpc_codes","informative_references","informative_references_cpc_codes","special_rules","special_rules_cpc_codes","glossary_of_terms","definition_statement"
"C08C","TREATMENT OR CHEMICAL MODIFICATION OF RUBBERS","","","","The IPC group  is covered by .","C08C1/16|C08C1/14","Diene rubberHomopolymer or copolymer of compounds having as the major part one or more unsaturated aliphatic radicals, at least one having two or more carbon-to-carbon double bonds","This place covers: processes directed to natural rubber or to conjugated diene rubber treatment of diene rubber chemical modification of diene rubber"
"C08C1/00","Treatment of rubber latex","","Preserving ingredients ","C08K","","","","This place covers: Chemical or physical treatment of rubber latex before or during concentration, e.g. purifying, deproteinising, preservation of rubber latex or concentrating Coagulation"
"C08C2/00","Treatment of rubber solutions","","","","","","","This place covers: Treatment of rubber solutions, e.g. by purification, removal of catalyst residues or wining of rubber from solutions."
"C08C3/00","Treatment of coagulated rubber","","","","","","","This place covers: Treatment of coagulated rubber, e.g. by purification"
"C08C19/00","Chemical modification of rubber","","Crosslinking agent, other than provided for by group ","C08C19/30|C08K","In  - , in the absence of an indication to the contrary a process is classified in the last appropriate place.","C08C19/00|C08C19/44","","This place covers: Chemical modification of rubber, e.g. hydrogenation, oxidation, depolymerisation, isomerisation, cyclisation, incorporation of halogen, sulphur, nitrogen, phosphorus, silicon or metal atoms into the molecule, reaction with compounds containing carbon-to-carbon unsaturated bonds or addition of a reagent which reacts with a hetero atom or a group containing hetero atoms of the macromolecule."
"C08C19/44","of polymers containing metal atoms exclusively at one or both ends of the skeleton","","","","","","HeteroatomsRefers to any atoms at the end of the skeleton chain not being carbon or hydrogen. Metals are also hetero-atoms.","This place covers: Processes directed to the addition of a reagent which reacts with a hetero atom or a group containing heteroatoms of the macromolecule containing metal atoms exclusively at one or both ends of the skeleton, i.e. chemical reaction at the end of polymerchains prepared by living polymerization."
