"cpc_code","title","title_cpc_codes","informative_references","informative_references_cpc_codes","special_rules","special_rules_cpc_codes","glossary_of_terms","definition_statement"
"E04B1/62","Insulation or other protection; Elements or use of specified material therefor  (chemical compositions C01 - C11; implements for applying insulation or sealings E04F21/00; buildings to withstand or to provide protection against external undesired influences E04H9/00; sealing pipes in walls or partitions F16L5/02; shielding against dangerous radiation G21F; constructions of particular parts of buildings, see the relevant groups for those parts)","C01|C11|E04F21/00|E04H9/00|F16L5/02|G21F","","","","","","This place covers: Insulation or other protection for buildings in general; Elements or use of specified material for insulation of buildings or other protection of buildings."
"E04B1/64","for making damp-proof; Protection against corrosion  (sealings E04B1/66)","E04B1/66","","","","","",""
"E04B1/642","{Protecting metallic construction elements against corrosion  (for concrete reinforcing elements made of steel E04C5/01; anodic or cathodic protection C23F13/00)}","E04C5/01|C23F13/00","","","","","",""
"E04B1/644","{Damp-proof courses  (in combination with lintels E04C3/02)}","E04C3/02","Sealing membranes, sealing coatings","E04B1/66","","","","This place covers: Damp-proof courses installed during construction of the structure, also retro-fitted e.g. by driving plates in masonry joints."
"E04B1/646","{obtained by removal and replacement of a horizontal layer of an existing wall}","","","","","","","This place covers: Damp-proof courses made of a plate, sheet, or hardening composition, e.g. mortar."
"E04B1/648","{obtained by injection or infiltration of water-proofing agents into an existing wall}","","","","Documents with details of the composition and manufacture of water-proofing agents should be additionally classified in the relevant classes for these compositions, e.g.  for bituminous compositions","C08L","",""
"E04B1/66","Sealings  ({damp-proof courses E04B1/644; fire-proof sealings E04B1/948}; additions of anti-leak properties to plaster C04B; bituminous sealing masses C08L95/00; sealings for hydraulic engineering work in general E02B3/16; against ground humidity or ground water E02D31/02; coverings against rain or other precipitations of the atmosphere E04D; composition of material or manufacture of sealing foils, see the relevant classes for these foils)","E04B1/644|E04B1/948|C04B|C08L95/00|E02B3/16|E02D31/02|E04D","Sealing in water managementRepairs, e.g. by sealing impregnation","E02B3/00|E04G23/02","Documents with details of the composition or manufacture of sealing agents should be additionally classified in the relevant classes for these compositions.","","","This place covers: Sealing membranes or coatings for buildings in general."
"E04B1/68","of joints, e.g. expansion joints  (packing for joints in roads or airfields E01C11/02; expansion joints for bridges E01D19/06; sealing joints between foundation piles E02D5/14; joints in foundation structures E02D29/16; devices for sealing the spaces or joints between roof-covering elements E04D1/36; sealing joints between roof-covering elements E04D3/38; {construction of joints for flooring or floor layers composed of a number of similar elements E04F15/02005}; construction of joints for flooring or floor layers made of masses in situ E04F15/14)","E01C11/02|E01D19/06|E02D5/14|E02D29/16|E04D1/36|E04D3/38|E04F15/02005|E04F15/14"," Sealing of joints in water managementSealing in mechanical engineering","E02B3/16|F16J15/00","Use  for documents classified in  -  for classifying additional information of joints comprising swellable parts.","E04B2001/6818|E04B1/68|E04B1/6816","",""
"E04B1/6801","{Fillings therefor}","","","","","","","This place covers: Joints using a putty-like filler, with or without backing strip."
"E04B1/6803","{Joint covers  (E04B1/6815 takes precedence)}","E04B1/6815","","","","","",""
"E04B1/6806","{Waterstops  (E04B1/6807 takes precedence)}","E04B1/6807","","","","","","This place covers: Sealing strips embedded in two succesively poured concrete structures."
"E04B1/6807","{Expansion elements for parts cast in situ}","","","","","","","This place covers: Waterstops with a central deformable section, e.g. hollow or folded."
"E04B1/6813","{Compressable seals of hollow form  (E04B1/6816 takes precedence)}","E04B1/6816","","","","","",""
"E04B1/6815","{Expansion elements specially adapted for wall or ceiling parts}","","","","","","",""
"E04B1/6816","{Porous tubular seals for injecting sealing material  (filling of cracks in existing buildings E04G23/02)}","E04G23/02","","","","","",""
"E04B1/70","Drying or keeping dry, e.g. by air vents  ({using damp-proof courses E04B1/644; using sealings, e.g. sealing masses or foils, E04B1/66}; during erection E04G21/28)","E04B1/644|E04B1/66|E04G21/28","","","","","",""
"E04B1/7007","{by using electricity, e.g. electro-osmosis  (electrochemical desalination or re-alkalisation of reinforced concrete C04B41/00)}","C04B41/00","Removing salts from walls","E04G23/00","","","","This place covers: Drying or keeping dry by the use of electricity, e.g. electro-osmosis, electrical heating of a wall or a room, electrical ventilation."
"E04B1/7015","{by heating the ambient air}","","Cellars","E04B1/0007","","","","This place covers: Drying by heating the ambient air, e.g. using a burner."
"E04B1/7023","{by collecting water in basements}","","Cellars","E04B1/0007","","","",""
"E04B1/7069","{by ventilating  (means for ventilating in floors E04B5/48, in ceilings E04B9/02, in building blocks E04C1/392, in building panels E04C2/521, in roofs E04D13/16; ventilating wall coverings E04F13/007)}","E04B5/48|E04B9/02|E04C1/392|E04C2/521|E04D13/16|E04F13/007","Electrical ventilation for drying roomsAir-ducts or air channels","E04B1/7007|E04F17/04","","","",""
"E04B1/7076","{Air vents for walls}","","Arrangements for catching or killing insects","A01M1/24","Documents with air vents for walls in combination with other aspects of ventilation are classified in .Pest control , .","E04B1/7069|E04B1/72","","This place covers: Connections of the interior of the building or the interior of the wall with the exterior of the building; Air vents for crawl spaces."
"E04B1/74","Heat, sound or noise insulation, absorption, or reflection  (forms of, or arrangements in, rooms for influencing or directing sound E04B1/99). Other building methods affording favourable thermal or acoustical conditions, e.g. accumulating of heat within walls  (fire protection E04B1/94; elements chiefly adapted for structural purposes E04C1/00 - E04C3/00; chiefly adapted for surface coverings E04F13/00; as underlayers for floor coverings E04F15/18; closures for wall or like openings E06B)","E04B1/99|E04B1/94|E04C1/00|E04C3/00|E04F13/00|E04F15/18|E06B","Thermal insulation in generalUse of solar heat, Heat storage using latent heatNoise damping in general","F16L59/00|F24S20/00|F24S21/00|F28D20/02|G10K11/00","Heat insulation of the whole building enveloppe and active heat insulation, e.g. walls with ventilation conduits for insulation purpose, are classified in .","E04B1/74","",""
"E04B1/76","specifically with respect to heat only  (heat insulation in general F16L59/00)","F16L59/00","","","Use  -  for classifying additional information of the documents classified in  -  and , ","E04B2001/741|E04B2001/7695|E04B1/76|E04B1/806|E04B1/88|E04B1/90","",""
"E04B1/7604","{fillings for cavity walls}","","","","","","",""
"E04B1/7616","{with insulation-layer locating devices combined with wall ties}","","","","Also classify in  or  when combined with masonry wall ties.","E04B1/4178|E04B1/4185","",""
"E04B1/762","{Exterior insulation of exterior walls}","","Bases for plaster ","E04F13/04","","","",""
"E04B1/7633","{Dowels with enlarged insulation retaining head}","","Fastening of an exterior insulation on a roof using screws or nails ","E04D3/3601","","","",""
"E04B1/7637","{Anchoring of separate elements through the lining to the wall}","","","","","","",""
"E04B1/7654","{comprising an insulating layer, disposed between two longitudinal supporting elements, e.g. to insulate ceilings}","","Insulating material disposed between the purlins or rafters of a roof ","E04D13/1625","","","",""
"E04B1/7662","{comprising fiber blankets or batts}","","","","Documents concerning fiber blankets or batts mentioning heat and sound insulation but without giving characteristics specific to sound insulation are classified in  - .","E04B1/7662|E04B1/767","",""
"E04B1/78","Heat insulating elements {(E04B1/7662 takes precedence)}","E04B1/7662","","","","","",""
"E04B1/80","slab-shaped","","Nailable or screwable inserts for foam panels","E04B2001/386","","","",""
"E04B1/803","{with vacuum spaces included in the slab}","","Thermal insulation in general, using vacuumCold rooms, refrigerators using vacuum insulation","F16L59/06|F25D2201/14","","","",""
"E04B1/82","specifically with respect to sound only  ({of floors or ceilings E04B9/001; of flooring E04F15/20}; noise damping in ducts or channels E04F17/00; {sound damping devices for pipes F16L55/033}; noise damping in general G10K11/00)","E04B9/001|E04F15/20|E04F17/00|F16L55/033|G10K11/00","","","Use  -  and  -  for classifying additional information of the documents classified in  - .","E04B2001/741|E04B2001/748|E04B2001/8245|E04B2001/8495|E04B1/82|E04B1/90","","This place covers: Sound insulation for buildings in general and for structural walls."
"E04B1/8209","{sound absorbing devices  (E04B1/8218, E04B1/8227 take precedence)}","E04B1/8218|E04B1/8227","","","","","","This place covers: Passive noise absorbtion body located in a room for absorbing the noise generated in the room."
"E04B1/8218","{soundproof enclosures}","","","","","","","This place covers: Enclosures keeping the noise out or in."
"E04B1/8227","{screens  (E04B2/74 takes precedence; for road or railway traffic E01F); Arrangements of sound-absorbing elements, e.g. baffles}","E04B2/74|E01F","","","","","",""
"E04B1/84","Sound-absorbing elements","","Structural building elements in general","E04C","","","","This place covers: Structural elements, specifically for sound absorbtion."
"E04B1/8404","{block-shaped}","","Block-shaped building elements in general","E04C1/00","","","",""
"E04B1/8409","{sheet-shaped}","","Sheet-shaped building elements in general","E04C2/00","","","",""
"E04B1/86","slab-shaped","","Panel or slab-shaped building elements in general","E04C2/00","","","",""
"E04B1/88","Insulating elements for both heat and sound","","Structural building elements in general","E04C","Documents concerning fiber blankets or batts mentioning heat and sound insulation but without giving characteristics specific to sound insulation are classified in  - ","E04B1/7662|E04B1/767","",""
"E04B1/90","slab-shaped","","Panel or slab-shaped building elements in general","E04C2/00","","","",""
"E04B1/92","Protection against other undesired influences or dangers  (buildings providing protection against external dangers E04H9/00; shielding against dangerous radiation G21F)","E04H9/00|G21F","","","Use  for classifying additional information of the documents classified in .","E04B2001/925|E04B1/92","","This place covers: Protection against other undesired influences or dangers for buildings in general, e.g. fire or vibrations and shocks originating from inside the building or due to wind or traffic, e.g. using mass damping systems."
"E04B1/94","against fire  ({fire protection of partitions E04B2/7403, E04B2/7409; supporting constructions for ceilings having the capability of expansion in case of fire E04B9/08}; fire-fighting A62C, {e.g. fire prevention or containment A62C2/00}; impregnation of wood or similar materials B27K; {fireproof paints C09D5/18; fireproofing materials C09K21/00; flame-resistant papers D21H5/0002; coverings or linings, e.g. for walls or ceilings, in general E04F13/00}; fireproof doors E06B5/16; {firebreak devices for pipes or the like passing through walls F16L5/04; protection of pipes by means of non-inflammable material F16L57/04})","E04B2/7403|E04B2/7409|E04B9/08|A62C|A62C2/00|B27K|C09D5/18|C09K21/00|D21H5/0002|E04F13/00|E06B5/16|F16L5/04|F16L57/04","","","Documents with details of the composition of fireproofing compounds should also be classified in the relevant classes for these compositions;Use  for classifying additional information of the documents classified in  -  .","E04B2001/949|E04B1/94|E04B1/945","",""
"E04B1/941","{Building elements specially adapted therefor}","","","","Fusible suspension supports are classified in .","E04B1/941","",""
"E04B1/942","{slab-shaped}","","","","Documents with details of the composition should be classified also in  and should receive classes for the compositions per se;Details of fire-proof sealing of the connection of panels should additionally be classified in .","E04B1/94|E04B1/948","",""
"E04B1/944","{covered with fire-proofing material}","","Beam coverings","E04B9/005","","","",""
"E04B1/947","{by closing openings in walls or the like in the case of fire  (fire-proof doors E06B5/16)}","E06B5/16","","","","","",""
"E04B1/948","{Fire-proof sealings or joints  (for doors or windows E06B5/164)}","E06B5/164","","","","","",""
"E04B1/98","against vibrations or shocks  (on foundations E02D31/08); against mechanical destruction, e.g. by air-raids  (against incendiary damage only E04B1/94; finishing work therefor E04F; buildings withstanding earthquake or the like, shelters, arrangements of splintercatching walls E04H9/00)","E02D31/08|E04B1/94|E04F|E04H9/00","Pressure relieve panels in case of over-pressure, , , ","E06B5/12|B65D90/325|H02B13/025|E05B65/102","","","","This place covers: Protection of buildings against vibrations or shocks originating from inside the building, e.g. an explosion within the building, or are caused by the wind or nearby construction works or traffic."
"E04B1/99","Room acoustics, i.e. forms of, or arrangements in, rooms for influencing or directing sound  (E04B1/82 takes precedence; acoustics in general G10K11/00; electric signal processing for producing a reverberation or echo sound G10K15/08)","E04B1/82|G10K11/00|G10K15/08","","","","","","This place covers: Arrangments for adjusting the acoustics of e.g. a concert hall"
"E04B2/00","Walls, e.g. partitions, for buildings; Wall construction with regard to insulation; Connections specially adapted to walls  (connections for building structures in general E04B1/38; insulation for buildings in general E04B1/62; building elements of relatively thin form for parts of buildings E04C2/00)","E04B1/38|E04B1/62|E04C2/00","","","Load-bearing walls made from panels are classified in  - .Load-bearing or non-load-bearing walls built-up from layers of building elements, e.g. brick or block walls, are classified in  - .Load-bearing walls having a framework or a pillarwork, and walls incorporating load-bearing elongated members, are classified in  - .Non-load-bearing walls made of panels or posts and panels are classified in  - .Load-bearing or non-load-bearing walls made by casting, pouring or tamping in situ are classified in  - .","E04B1/02|E04B1/14|E04B2/02|E04B2/54|E04B2/56|E04B2/709|E04B2/72|E04B2/828|E04B2/84|E04B2/8664","","This place covers: Load-bearing and non-load-bearing walls for buildings, wall construction with regard to insulation, and connections specially adapted to walls for buildings."
"E04B2/02","built-up from layers of building elements","","Masonry wall ties, i.e. anchorsDetails of connections of block or brick shaped building elementsDetails of connectionsSpecial features of block or brick shaped building elementsRetaining walls","E04B1/4178|E04B2002/0202|E04B2002/0202|E04B2002/0256|E02D29/02","Building elements of block or brick shape, for the construction of parts of buildings, are classified in  - , even if they do not explicitly form part of a wall.Building elements of block or brick shape, for the construction of parts of buildings, and characterised by special adaptations, e.g. serving for locating conduits, for forming soffits, cornices or shelves, for fixing wall-plates or door-frames, for claustra, are classified in  - .Building elements of block or brick shape, for the construction of parts of buildings, and being built-up from parts of different materials are classified in  - .Building elements of glass or other transparent material, for the construction of parts of buildings, are classified in .All aspects of the block or brick shaped building elements, e.g. special features, and details of connections among themselves, should be classified in  - .","E04B2/02|E04B2/54|E04C1/39|E04C1/397|E04C1/40|E04C1/41|E04C1/42|E04B2/02|E04B2002/0297","Block shapeblock shape is not restricted to parallelepiped shape","This place covers: Walls for buildings built-up from layers of building elements, e.g. brick or block walls, as well as building elements of block or brick shape for the construction of parts of buildings. The walls can be bearing walls or non-bearing walls, e.g. partition walls, and the building elements accordingly."
"E04B2/04","Walls having neither cavities between, nor in, the solid elements","","","","","","","This place covers: Walls having neither cavities between, nor in, the solid building elements, as well as solid brick or block shape building elements having no cavities in them."
"E04B2/10","by filling material with or without reinforcements in small channels in, or in grooves between, the elements","","Separate spacers between building elementsReinforcing elements of low bending resistanceLight-weight girdersReinforcing elements of material other than metal","E04B2002/0282|E04C5/02|E04C5/065|E04C5/07","","","","This place covers: Walls built-up from layers of solid building elements of brick or block shape, and having no cavities in the elements, wherein the joints, e.g. small channels or grooves between the building elements and/or between the successive layers are filled with material, with or without additional reinforcements in the joints, small channels or grooves."
"E04B2/14","Walls having cavities in, but not between, the elements, i.e. each cavity being enclosed by at least four sides forming part of one single element","","Building elements of brick or block shape with holes filled with insulating materialBuilding elements of block shape, serving for ventilating, heating, cooling, and for locating conduits, ","E04B2002/0289|E04C1/392|E04C1/397","","","","This place covers: Walls built-up from layers of building elements of brick or block shape having cavities in, but not between, the building elements, as well as brick or block shape building elements having cavities in them."
"E04B2/20","by filling material with or without reinforcements in small channels in, or in grooves between, the elements","","Separate spacers between building elementsReinforcing elements of low bending resistanceLight-weight girdersReinforcing elements of material other than metal","E04B2002/0282|E04C5/02|E04C5/065|E04C5/07","","","","This place covers: Walls built-up from layers of building elements of brick or block shape, and having cavities in the elements, wherein the joints, e.g. small channels or grooves between the building elements and/or between the successive layers are filled with material, with or without additional reinforcements in the joints, small channels or grooves."
"E04B2/24","the walls being characterised by fillings in some of the cavities forming load-bearing pillars or beams","","Load-bearing walls of framework or pillarwork - ","E04B2/56|E04B2/709","","","",""
"E04B2/26","the walls being characterised by fillings in all cavities in order to form a wall construction","","Walls made by casting, pouring, or tamping in situ, e.g. in permanent forms, but not by filling cavities in brick or block elements exclusively","E04B2/84","","","",""
"E04B2/28","Walls having cavities between, but not in, the elements; Walls of elements each consisting of two or more parts kept in distance by means of spacers, all parts being solid","","","","","","","This place covers: Walls made from layers of building elements of brick or block shape, the walls having cavities between, but not in, the elements, e.g. walls made of solid building elements having special profiles on their small side faces in order to create a cavity when connected with the adjacent elements; Walls made from layers of building elements of brick or block shape, each consisting of two or more parts kept in distance, in a direction perpendicular to the wall, by means of spacers, all parts of the elements being solid."
"E04B2/30","using elements having specially designed means for stabilising the position; Spacers for cavity walls {(masonry wall ties E04B1/4178)}","E04B1/4178","Masonry wall ties, i.e. anchorsDetails of connections","E04B1/4178|E04B2002/0202","","","Spacers for cavity wallsspacers between solid parts of brick or block shaped elements for building cavity walls, e.g. spacers integrated in a block consisting of two parallel solid slab shaped parts kept at a distance by the spacer",""
"E04B2/34","by filling material with or without reinforcements in small channels in, or in grooves between, the elements","","Separate spacers between building elementsReinforcing elements of low bending resistanceLight-weight girdersReinforcing elements of material other than metal","E04B2002/0282|E04C5/02|E04C5/065|E04C5/07","","","","This place covers: Walls made from layers of building elements of brick or block shape, the walls having cavities between, but not in, the elements, wherein the joints, e.g. small channels or grooves between the building elements and/or between the successive layers are filled with material, with or without additional reinforcements in the joints, small channels or grooves."
"E04B2/38","the walls being characterised by fillings in some of the cavities forming load-bearing pillars or beams","","Load-bearing walls of framework or pillarwork - ","E04B2/56|E04B2/709","","","",""
"E04B2/40","the walls being characterised by fillings in all cavities in order to form a wall construction","","Walls made by casting, pouring, or tamping in situ, e.g. in permanent forms, but not by filling cavities in brick or block elements exclusively","E04B2/84","","","",""
"E04B2/42","Walls having cavities between, as well as in, the elements; Walls of elements each consisting of two or more parts, kept in distance by means of spacers, at least one of the parts having cavities","","","","","","","This place covers: Walls made from layers of building elements of brick or block shape, the walls having cavities between, as well as in the elements, e.g. walls made of building elements having cavities and having special profiles on their small side faces in order to create a cavity when connected with the adjacent elements; Walls made from layers of building elements of brick or block shape, each consisting of two or more parts kept in distance, in a direction perpendicular to the wall, by means of spacers, at least one of the parts of the elements having cavities."
"E04B2/44","using elements having specially-designed means for stabilising the position; Spacers for cavity walls {(masonry wall ties E04B1/4178)}","E04B1/4178","Masonry wall ties, i.e. anchorsDetails of connections","E04B1/4178|E04B2002/0202","","","Spacers for cavity wallsspacers between parts of brick or block shaped elements for building cavity walls, at least one of the parts having cavities, e.g. spacers integrated in a block consisting of two parallel, non-massive, slab shaped parts kept at a distance by the spacer",""
"E04B2/48","by filling material with or without reinforcements in small channels in, or in grooves between, the elements","","Separate spacers between building elementsReinforcing elements of low bending resistanceLight-weight girdersReinforcing elements of material other than metal","E04B2002/0282|E04C5/02|E04C5/065|E04C5/07","","","","This place covers: Walls made from layers of building elements of brick or block shape, the walls having cavities between, as well as in the elements, wherein the joints, e.g. small channels or grooves between the building elements and/or between the successive layers are filled with material, with or without additional reinforcements in the joints, small channels or grooves."
"E04B2/52","the walls being characterised by fillings in some of the cavities forming load-bearing pillars or beams","","Load-bearing walls of framework or pillarwork - ","E04B2/56|E04B2/709","","","",""
"E04B2/54","the walls being characterised by fillings in all cavities in order to form a wall construction","","Walls made by casting, pouring, or tamping in situ, e.g. in permanent forms, but not by filling cavities in brick or block elements exclusively","E04B2/84","","","",""
"E04B2/56","{Load-bearing} walls of framework or pillarwork; Walls incorporating load-bearing elongated members  (E04B2/74, E04B2/88 take precedence; pillars E04C3/30)","E04B2/74|E04B2/88|E04C3/30","","","","","",""
"E04B2/562","{with fillings between the load-bearing elongated members}","","","","","","","This place covers: Nogging of half-timbered walls."
"E04B2/62","the members being formed of two or more elements in side-by-side relationship","","Framework with metallic elongated load-supporting parts formed of a number of parallel profiles","E04B2001/2472","","","",""
"E04B2/68","made by filling-up wall cavities  (E04B2/24, E04B2/38, E04B2/52 take precedence)","E04B2/24|E04B2/38|E04B2/52","","","","","",""
"E04B2/701","{with integrated supporting and obturation function}","","","","","","","This place covers: Walls made from horizontally laid logs or beams, e.g. log cabins."
