"cpc_code","title","title_cpc_codes","informative_references","informative_references_cpc_codes","special_rules","special_rules_cpc_codes","glossary_of_terms","definition_statement"
"E04B","GENERAL BUILDING CONSTRUCTIONS; WALLS, e.g. PARTITIONS; ROOFS; FLOORS; CEILINGS; INSULATION OR OTHER PROTECTION OF BUILDINGS  (border constructions of opening in walls, floors or ceilings E06B1/00; {electromagnetic shielding H05K9/0001})","E06B1/00|H05K9/0001","","","","","","This place covers: Building constructions, i.e. construction of edifices, their structural or non structural walls, their roof structures, their floor structures, suspended or false ceilings; Insulation of buildings or other protection of buildings."
"E04B1/00","Constructions in general; Structures which are not restricted either to walls, e.g. partitions, or floors or ceilings or roofs  (scaffolds, shutterings E04G; structures specially adapted for buildings for special purposes, general layout of buildings, e.g. modular co-ordination, E04H; the particular parts of buildings, see the relevant groups for those parts)","E04G|E04H","","","","","","This place covers: Building constructions in general, i.e. construction of edifices; Structures of buildings which are not restricted either to walls, or floors or ceilings or roofs. Special structures and methods of construction of buildings, e.g. arched, movable, collapsible, box-like structures; Connections for building structures, e.g. connections of slab-shaped or elongated members; Insulation or other protection of buildings, e.g. against water-damage, heat, sound, fire."
"E04B1/0007","{Base structures; Cellars}","","","","Exterior insulation of cellars is classified here.","","","This place covers: Cellars, basements, also retrofitted under existing buildings; Crawl spaces."
"E04B1/0023","{Building characterised by incorporated canalisations  (E04B1/34869, E03C1/01, E04C2/52, E04F17/00 take precedence; canalisation per se F16L; conducts for ventilation, heating systems or air-conditioning F24)}","E04B1/34869|E03C1/01|E04C2/52|E04F17/00|F16L|F24","","","","","","This place covers: Building with passages for fluids integrally formed with structural elements of the building."
"E04B1/0046","{Loggias}","","GreenhousesGlass roofsBay windows","A01G9/14|E04D3/06|E06B1/363","","","","This place covers: Loggias, wintergardens, enclosed balconies, verandas."
"E04B1/02","Structures consisting primarily of load-supporting, block-shaped, or slab-shaped elements  (E04B1/32 - E04B1/36 take precedence)","E04B1/32|E04B1/36","","","","","","This place covers: Structures consisting primarily of large load-supporting panels or large load-supporting panel-shaped blocks."
"E04B1/12","the elements consisting of other material","","","","","","","This place covers: Structures with elements consisting of specified materials other than concrete, stone-like material, metal or wood."
"E04B1/14","the elements being composed of two or more materials  (of reinforced concrete E04B1/04)","E04B1/04","","","","","","This place covers: Structures with elements consisting of the combination of two or more specified structural materials."
"E04B1/16","Structures made from masses, e.g. of concrete, cast or similarly formed in situ with or without making use of additional elements, such as permanent forms, substructures to be coated with load-bearing material  (E04B1/32 - E04B1/36 take precedence)","E04B1/32|E04B1/36","","","","","",""
"E04B1/161","{with vertical and horizontal slabs, both being partially cast in situ}","","Stacked prefabricated cells, e.g. with concrete poured between the cells Permanent inflatable forms for concrete","E04B1/34807|E04G11/04","Use  -  for classifying additional information of details of lost formwork of cast in-situ walls.","E04B2/84|E04B2002/8694","",""
"E04B1/163","{with vertical and horizontal slabs, only the vertical slabs being partially cast in situ  (E04B2/86 takes precedence)}","E04B2/86","","","Use  -  for classifying additional information of details of lost formwork of cast in-situ walls.","E04B2/84|E04B2002/8694","",""
"E04B1/165","{with elongated load-supporting parts, cast in situ  (E04B1/161, E04B1/163 and E04B1/164 take precedence)}","E04B1/161|E04B1/163|E04B1/164","","","","","",""
"E04B1/166","{with curved surfaces, at least partially cast in situ in order to make a continuous concrete shell structure  (E04B1/169 takes precedence)}","E04B1/169","","","","","",""
"E04B1/18","Structures comprising elongated load-supporting parts, e.g. columns, girders, skeletons  (E04B1/32 - E04B1/36 take precedence; elongated load-supporting parts as elements, trusses, truss-like structures E04C3/00)","E04B1/32|E04B1/36|E04C3/00","","","Structures made from a horizontal or vertical juxtaposition of elongated elements other than wood are classified in ;Structures made from a juxtaposition of porticos or stacks of frames are only classified in , irrespective of the material of the elongated elements.","E04B1/18|E04B1/18","","This place covers: Structures comprising elongated load-supporting parts, e.g. columns, beams, girders, skeletons."
"E04B1/19","Three-dimensional framework structures {(folded structures and grid-like formations acting as shell structures E04B7/10)}","E04B7/10","TrussesTruss-like towers or mats","E04C3/02|E04H12/00","Documents showing large parts of the space frame are classified here, even if they show details of component parts or their connections; Use  -  for classifying additional information of the details of the component parts of the space frame, their connections and the type of space frame for the documents classified in .","E04B1/1903|E04B2001/1996|E04B1/19","","This place covers: Space frames, i.e. truss-like lightweight structures constructed from interconnected struts in a geometric pattern spanning a large area, with either short struts connected at the nodes or continuous struts folded at the nodes."
"E04B1/1903","{Connecting nodes specially adapted therefor}","","Node corner connector for furniture","A47B47/0016","Use  -  for classifying additional information of the details of the component parts of the space frame, their connections and the type of space frame for the documents classified in ","E04B2001/1924|E04B2001/1996|E04B1/1903","",""
"E04B1/1906","{with central spherical, semispherical or polyhedral connecting element}","","","","Use  -  for classifying additional information of the details of the component parts of the space frame, their connections and the type of space frame for the documents classified in ","E04B2001/1924|E04B2001/1996|E04B1/1906","",""
"E04B1/1909","{with central cylindrical connecting element}","","","","Use  -  for classifying additional information of the details of the component parts of the space frame, their connections and the type of space frame for the documents classified in .","E04B2001/1924|E04B2001/1996|E04B1/1909","",""
"E04B1/1912","{with central cubical connecting element}","","","","Use  -  for classifying additional information of the details of the component parts of the space frame, their connections and the type of space frame for the documents classified in .","E04B2001/1924|E04B2001/1996|E04B1/1912","",""
"E04B1/20","the supporting parts consisting of concrete, e.g. reinforced concrete, or other stonelike material","","","","Documents showing large parts of the structure are classified here, even if they show details of connections.","","","This place covers: Structures with posts and beams made from concrete."
"E04B1/24","the supporting parts consisting of metal","","","","Documents showing large parts of the structure are classified here, even if they show details of component parts and their connections. Use  -  for classifying additional information of the details of the component parts and their connections of the structures classified in .","E04B1/2403|E04B2001/2496|E04B1/24","","This place covers: Structures with posts and beams made of metal"
"E04B1/2403","{Connection details of the elongated load-supporting parts}","","","","Use  -  for classifying additional information of the documents classified in .","E04B2001/2466|E04B2001/2496|E04B1/2403","",""
"E04B1/26","the supporting parts consisting of wood","","Load-bearing walls with posts of wood","E04B2/706","Documents showing large parts of the structure are classified here, even if they show details of component parts and their connections; Use  -  for classifying additional information of the documents classified in .","E04B1/2604|E04B2001/2696|E04B1/26","","This place covers: Structures with posts and beams made of wood."
"E04B1/2604","{Connections specially adapted therefor  (shear dowels E04B1/486, E04B1/49)}","E04B1/486|E04B1/49","","","Use  for classifying additional information of the documents classified in .","E04B2001/2696|E04B1/2604","",""
"E04B1/2608","{Connectors made from folded sheet metal  (E04B1/2612 takes precedence)}","E04B1/2612","","","","","",""
"E04B1/28","the supporting parts consisting of other material","","","","","","","This place covers: Structures with posts and beams made of specified material other than concrete, stone-like material, metal, wood."
"E04B1/30","the supporting parts being composed of two or more materials; Composite steel and concrete constructions  (of reinforced concrete E04B1/20)","E04B1/20","","","","","","This place covers: Structures with posts and beams made of at least two specified different materials having a structural function, e.g. a steel pipe filled with concrete"
"E04B1/32","Arched structures; Vaulted structures; Folded structures  ({E04B1/34378 takes precedence;} vaulted roofs E04B7/08)","E04B1/34378|E04B7/08","","","Use  -  for classifying additional information of the component parts, their connections and the type of structures of the documents classified in  - .Do not use  to classify the documents of  - ","E04B2001/3217|E04B2001/3294|E04B1/32|E04B1/3211|E04B2001/0061|E04B1/32|E04B1/3211","","This place covers: Arched structures; Vaulted structures; Arched or vaulted structures with a folded surface."
"E04B1/3205","{Structures with a longitudinal horizontal axis, e.g. cylindrical or prismatic structures}","","","","","","","This place covers: Structures in the shape of a portion of a cylinder, with a smooth or faceted surface."
"E04B1/3211","{Structures with a vertical rotation axis or the like, e.g. semi-spherical structures}","","","","","","","This place covers: Structures in the shape of a portion of a sphere, with a smooth or faceted surface."
"E04B1/34","Extraordinary structures, e.g. with suspended or cantilever parts supported by masts or tower-like structures enclosing elevators or stairs; Features relating to the elastic stability  (E04B1/342, E04B1/343, E04B1/348 take precedence; for floors E04B5/43; buildings for special purposes, e.g. withstanding earthquake, E04H)","E04B1/342|E04B1/343|E04B1/348|E04B5/43|E04H","","","Exterior staircases retrofitted to buildings are classified in .","E04B1/34","",""
"E04B1/3412","{mainly supported by a central column or footing  (E04B1/3416 takes precedence)}","E04B1/3416","","","","","",""
"E04B1/3416","{Structures comprising mainly a central support column and a cantilevered roof}","","","","","","","This place covers: Mushroom-type structures or elongated structures having a ""T"" or ""Y"" vertical cross-section."
"E04B1/342","Structures covering a large free area, whether open-sided or not, e.g. hangars, halls  (roof trusses E04C3/00; non-structural features for specified purposes, see the relevant groups of E04H)","E04C3/00|E04H","","","","","",""
"E04B1/343","Structures characterised by movable, separable, or collapsible parts, e.g. for transport  (movable roof parts E04B7/16; floatable buildings B63B; small prefabricated buildings, transportable as a whole E04H1/12; small garages E04H6/02; tents or canopies, in general E04H15/00 {; containers B65G})","E04B7/16|B63B|E04H1/12|E04H6/02|E04H15/00|B65G","","","","","",""
"E04B1/34305","{telescopic}","","Telescopic wheeled arched structuresTelescopic roofs Caravans or campers with telescopic sectionsSwimming pools with movable roof sections","E04B1/34368|E04B7/166|B60P3/34|E04H3/165","Structures with more than one telescopic section extendable each from different surfaces of the structure, or with telescopic sections comprising two or more nested sub-sections are classified here;Use  for classifying additional information of documents showing vertically telescoping structures.","E04B2001/34394","","This place covers: Structure with room-sized telescopic section extendable horizontally from a side of the structure or vertically from the top or bottom of the structure."
"E04B1/3431","{with only one level of nesting}","","","","Use  for classifying additional information of documents showing vertically telescoping structures","E04B2001/34394","","This place covers: Structure with a single telescopic section extendable horizontally from a side of the structure or vertically from the top or bottom of the structure"
"E04B1/34315","{characterised by separable parts}","","","","Structures formed of a combination of structural elongated elements and structural panels are classified here.Use  for classifying additional information of documents showing a set of building elements forming a self-contained package for transport before assembly.","E04B2001/34389","",""
"E04B1/34321","{mainly constituted by panels}","","","","Use  for classifying additional information of documents showing a set of building elements forming a self-contained package for transport before assembly.Use  -  for classifying additional information of the details of the connections of the panels.","E04B2001/34389|E04B1/61|E04B2001/6195","",""
"E04B1/34326","{mainly constituted by longitudinal elements}","","","","Use  for classifying additional information of documents showing a set of building elements forming a self-contained package for transport before assembly.Use  -  for classifying additional information of the details of the connections of the longitudinal elements.","E04B2001/34389|E04B1/58|E04B2001/5893","",""
"E04B1/34336","{Structures movable as a whole}","","","","Use ,  and  for classifying additional information of documents showing telescoping structures.","E04B1/34305|E04B1/3431|E04B2001/34394","","This place covers: Mobile home structures"
"E04B1/34347","{Anchoring means therefor}","","Ground anchors","E02D5/80","","","",""
"E04B1/34357","{Foldable or retractable structures}","","","","Use  for classifying additional information of documents showing a set of building elements forming a self-contained package for transport before assembly.","E04B2001/34389","",""
"E04B1/34363","{with provisions to raise or lower the whole structure}","","Telescopic structuresBuildings raisable in case of floods","E04B1/34305|E04H9/145","","","","This place covers: Structures with means for raising and lowering them above ground level; Structures with means for retracting them into the ground and returning them to ground level."
"E04B1/34368","{Wheeled arch-type structures}","","Roofs with movables sectionsGreenhouses with sliding roofsWeather protection for road worksWeather protection for building worksSwimming pools with movable roof sections","E04B7/16|A01G9/16|E01C23/03|E04G21/28|E04H3/165","Half-arches wheeled at one extremity against a building wall and at the other end on the ground are also classified here.","","",""
"E04B1/344","with hinged parts","","Collapsible caravans","B60P3/34","Use  for classifying additional information of documents showing mobile homes.Do not use  to classify the documents of .","E04B1/34336|E04B1/34321|E04B1/344","",""
"E04B1/3441","{with articulated bar-shaped elements}","","","","Collapsible articulated space frames are classified here.","","",""
"E04B1/3445","{foldable in a flat stack of parallel panels}","","Collapsible large containers","B65D88/52","Do not use  to classify the documents of  and .","E04B2001/34389|E04B1/3445|E04B1/3447","",""
"E04B1/3448","{with rotating shell-forming segments}","","Roof structures with movable sectionsSwimming pools with movable roof sections","E04B7/16|E04H3/165","","","","This place covers: Structures with rotating shell-forming segments, e.g. armadillo plates type structure."
"E04B1/346","Rotary buildings; Buildings with rotary units, e.g. rooms","","Carousels for milking stationsTurntable for vehicles","A01K1/126|B60S13/02","Do not use  to classify the documents of .","E04B2001/0061|E04B1/346","",""
"E04B1/348","Structures composed of units comprising at least considerable parts of two sides of a room, e.g. box-like or cell-like units closed or in skeleton form","","","","In  -  use  -  for classifying additional information of documents showing sloping or barrel roof, or means allowing access to the structures.","E04B1/348|E04B1/34861|E04B2001/34876|E04B2001/34892","","This place covers: Structures composed of units comprising at least considerable parts of two sides of a room, e.g. box-like or cell-like units closed or in skeleton form, i.e. only the edges of the boxes or cells are materialized (only frame, no infill panels)"
"E04B1/34807","{Elements integrated in a skeleton}","","","","","","","This place covers: Box-like units resting on shelves or beams of a supporting structure; Stacked cells with concrete poured between the cells."
"E04B1/34823","{the supporting structure consisting of concrete}","","","","","","","This place covers: Structures with the main vertical structural parts consisting of concrete."
"E04B1/3483","{the supporting structure consisting of metal}","","","","","","","This place covers: Structures with the main vertical structural parts consisting of metal."
"E04B1/34838","{the supporting structure consisting of wood}","","","","","","","This place covers: Structures with the main vertical structural parts consisting of wood."
"E04B1/34846","{the supporting structure consisting of other specified material, e.g. of plastics}","","","","","","","This place covers: Structures with the main vertical structural parts consisting of specified material other than concrete, metal, wood."
"E04B1/34853","{the supporting structure being composed of two or more materials}","","","","","","","This place covers: Structures with the main vertical structural parts consisting of the combination of two or more specified structural materials."
"E04B1/34869","{Elements for special technical purposes, e.g. with a sanitary equipment  (combination of baths, douches, sinks, wash-basins, closets or urinals A47K4/00; plumbing installations for baths, douches, or the like, E03C1/01; panels serving for locating conduits E04C2/521; ducts for receiving installation lines E04F17/08)}","A47K4/00|E03C1/01|E04C2/521|E04F17/08","Structures composed of a number of box-like units","E04B1/348","Use  -  for classifying additional information of documents of  showing sloping or barrel roof, or means allowing access to the structures.","E04B2001/34876|E04B2001/34892|E04B1/34869","","This place covers: Structures composed of units comprising at least considerable parts of two sides of a room where the units are pre-fitted for special technical purposes, e.g. with pre-fitted piping, plumbing, sanitary equipment or electrical wiring"
"E04B1/35","Extraordinary methods of construction, e.g. lift-slab, jack-block  (E04B1/34 takes precedence; falsework, shuttering for shaping walls, floors, ceilings or roofs in situ E04G11/04; conveying or assembling of building materials E04G21/00; working measures on existing buildings E04G23/00)","E04B1/34|E04G11/04|E04G21/00|E04G23/00","","","Use  -  for classifying additional information of the documents of  - .","E04B2001/3561|E04B2001/3594|E04B1/35|E04B1/3555","",""
"E04B1/3505","{characterised by the in situ moulding of large parts of a structure  (E04B1/3511, E04B1/3516, E04B1/3522, E04B1/3533, E04B1/3544, E04B1/355 take precedence)}","E04B1/3511|E04B1/3516|E04B1/3522|E04B1/3533|E04B1/3544|E04B1/355","Structures made from masses cast in-situ","E04B1/16","","","",""
"E04B1/3522","{characterised by raising a structure and then adding structural elements under it  (E04B1/3511, E04B1/3516, E04B1/3533 take precedence)}","E04B1/3511|E04B1/3516|E04B1/3533","","","","","","This place covers: Structure raisable using temporary supports, e.g. scaffolding or lifting machines, or permanent supports."
"E04B1/3527","{the structure being a roof}","","Enlarging an existing structure","E04G23/0266","","","","This place covers: Method of construction whereby the walls are added under the raised roof, e.g. in order to enable work in dry conditions"
"E04B1/3533","{characterised by the raising of hingedly-connected building elements, e.g. arches, portal frames  (E04B1/355 takes precedence)}","E04B1/355","Structures with hinged parts","E04B1/344","","","",""
"E04B1/3544","{characterised by the use of a central column to lift and temporarily or permanently support structural elements  (E04B1/3516 and E04B1/355 take precedence)}","E04B1/3516|E04B1/355","Small buildings mainly supported by a central column or footing","E04B1/3412","","","",""
"E04B1/36","Bearings or like supports allowing movement  (for bridges E01D19/04; buildings with-standing earthquakes E04H9/02)","E01D19/04|E04H9/02","Rubber bearings, ","F16F1/36|F16F3/08","","","","This place covers: Bearings allowing movement of the supported structure due to exterior influences, but also allowing movement for the purpose of adjusting horizontal or angular position of the supported structure."
"E04B1/38","Connections for building structures in general","","","","Documents should only exceptionally be classified in , connections for general applications should be classified in subclass .","E04B1/38|F16B","",""
"E04B1/40","{Separate connecting elements  (for forms, falsework, or shutterings E04G17/00; releasable clips or clamps, hooks, wedges, wall-dowels, nails, bolts, rivets, screws, wood-screws F16B)}","E04G17/00|F16B","","","Documents should only exceptionally be classified in , connections for general applications should be classified in subclass .","E04B1/40|F16B","",""
"E04B1/41","Connecting devices specially adapted for embedding in concrete  ({joist hangers E04B1/2612; shear dowels E04B1/483}; spacers {other than masonry wall ties} for cavity walls E04B2/30, E04B2/44; connectors for reinforcing elements E04C5/16; supporting devices for connector reinforcing rods for concrete walls E04G21/125; fastening frames to the border of openings E06B1/56)","E04B1/2612|E04B1/483|E04B2/30|E04B2/44|E04C5/16|E04G21/125|E06B1/56","","","Use  for classifying additional information of connecting devices which are attached to the concrete reinforcement members for the documents classified in  - .","E04B2001/4192|E04B1/41|E04B1/4178","",""
"E04B1/4114","{Elements with sockets  (E04B1/4107 takes precedence)}","E04B1/4107","","","","","",""
"E04B1/4142","{with transverse hook- or loop-receiving parts  (E04B1/415 takes precedence)}","E04B1/415","","","","","",""
"E04B1/4171","{Nailable or non-threaded screwable elements  (dowels F16B13/00)}","F16B13/00","","","","","",""
"E04B1/4178","{Masonry wall ties  (with insulation-layer locating devices E04B1/7616; replacing or adding wall ties E04G23/0222)}","E04B1/7616|E04G23/0222","Walls of framework or pillar-work with a brick veneer facing","E04B2002/565","Use  for classifying additional information of connecting devices which are attached to the concrete reinforcement members.Use  for classifying additional information of connecting devices which are combined with insulation-layer locating devices.","E04B2001/4192|E04B1/7616","","This place covers: Separate tie rods embedded in the horizontal or vertical masonry joints, for tying a masonry wall to a non-masonry support, e.g. a concrete wall or posts, or for making a T-junction between two masonry walls."
"E04B1/4185","{for cavity walls with both wall leaves made of masonry  (spacers for permanent forms E04B2/86)}","E04B2/86","","","Use  for classifying additional information of connecting devices which are combined with insulation-layer locating devices.","E04B1/7616","","This place covers: Separate tie rods embedded in horizontal or vertical masonry joints, for tying two parallel masonry walls together."
"E04B1/486","{Shear dowels for wood  (E04B1/49 takes precedence)}","E04B1/49","","","","","",""
"E04B1/49","with self-penetrating parts, e.g. claw dowels {(nail plates F16B15/0023)}","F16B15/0023","","","","","",""
"E04B1/54","{Joints substantially without separate connecting elements, e.g. jointing by inter-engagement  (welded, glued, or the like joints, in general F16B)}","F16B","","","","","",""
"E04B1/58","of bar-shaped building elements {(framework connections E04B1/21, E04B1/2403, E04B1/2604)}","E04B1/21|E04B1/2403|E04B1/2604","Connections of rods","F16B7/00","Use  -  for classifying additional information of the documents classified in  - .","E04B2001/5862|E04B2001/5893|E04B1/58|E04B1/5818","",""
"E04B1/5825","{with a closed cross-section}","","","","Use  -  and  for classifying additional information of the documents of  - .","E04B2001/5862|E04B2001/5893|E04B2001/5856|E04B1/5825|E04B1/585","",""
"E04B1/61","of slab-shaped building elements with each other","","Joining sheets or plates","F16B5/00","Use  as additional information to classify slabs connected at an angle for documents classified in  -  and .","E04B2001/6195|E04B1/61|E04B1/6187|E04B2001/6191","",""
"E04B1/6183","{with rotatable locking means co-operating with a recess  (similar devices for sliding doors E05B65/0817)}","E05B65/0817","Locks for sliding doors with bolt pivoting about an axis perpendicular to the wingsRotating connectors, ","E05B65/0817|F16B5/0092|F16B12/2009","","","",""
