"cpc_code","title","title_cpc_codes","informative_references","informative_references_cpc_codes","special_rules","special_rules_cpc_codes","glossary_of_terms","definition_statement"
"F01P","COOLING OF MACHINES OR ENGINES IN GENERAL; COOLING OF INTERNAL-COMBUSTION ENGINES  (arrangements in connection with cooling of propulsion units in vehicles B60K11/00; heat-transfer, heat-exchange or heat-storage materials C09K5/00; {cooling of gas-turbine engines F02C7/12}; heat exchange in general, radiators F28)","B60K11/00|C09K5/00|F02C7/12|F28","Cooling by lubricant when the lubrication aspect predominates","F01M","","","Airgaseous cooling fluidsLiquid coolingincludes also cooling where liquid is used as the heat transferring fluid between parts to be cooled and the air, e.g. using radiatorsAir coolingdirect air cooling and thus excludes indirect air cooling occurring in liquid cooling systems as explained hereforeCooling airdirectly or indirectly acting air for coolingEnginedevice for continuously converting fluid energy into mechanical power. Thus, this term includes, for example, steam piston engines or steam turbines, per se, or internal-combustion piston engines, but it excludes single-stroke devices. ""Engine"" also includes the fluid-motive portion of a meter unless such portion is particularly adapted for use in a meterMachinedevice which could equally be an engine and a pump, and not a device which is restricted to an engine or one which is restricted to a pump","This place covers: Cooling of machines, where ""machine"" means a device which could equally be an engine and a pump, and not a device which is restricted to an engine or one which is restricted to a pump. Cooling of engines, where ""engine"" means a device for continuously converting fluid energy into mechanical power, e.g. steam piston engines or steam turbines. Cooling of internal combustion engines."
"F01P1/00","Air cooling","","For the engine room cooling ","F01P2001/005","","","Enginean internal combustion engine","This place covers: Air cooling of the engine parts as cylinders or cylinder heads, but also cooling of the engine room, when related to the engine cooling circuit."
"F01P3/00","Liquid cooling","","Heating of the vehicle cabin from the coolant as suchIntercooler arrangementProfiting from waste heat of the exhaust gases, EGR cooling as such","B60H1/04|F02B29/0406|F02G5/04|F01N5/02|F02M26/13","Cooling circuit specific details related to cabin heater, intercooler, EGR, turbo- charger, retarder, fuel cooling, battery and hybrid vehicles are classified in  and under .","F01P3/20|F01P2060/00","EGRExhaust Gas Recirculation","This place covers: Arrangements for liquid cooling of engine or machine parts."
"F01P5/00","Pumping cooling-air or liquid coolants  (controlling circulation or supply of coolants by influencing drive of pumps F01P7/00)","F01P7/00","Casings","F04D29/403","","","","This place covers: Arrangements related to water pumps and fans including their driving, as long a cooling circuit of an engine is claimed as well."
"F01P7/00","Controlling of coolant flow","","Cooling after the engine stopHeating and cooling of the vehicle in generalFriction clutches in generaValves in generalField thermostats, ","F01P2031/30|B60H1/00|F16D13/00|F16K|G05D23/1925|F01P7/167"," includes systems where besides the main loop and bypass-loop, other loops present, e.g. a low temperature loop.","F01P7/165","","This place covers: Controlling of the system such that the coolant and/or an engine part has a given temperature and/or in accordance with certain engine parameters, e.g. speed, load."
"F01P9/00","Cooling having pertinent characteristics not provided for in, or of interest apart from, groups F01P1/00 - F01P7/00  (profiting from waste heat of combustion-engine cooling F02G5/00)","F01P1/00|F01P7/00|F02G5/00","","","","","",""
"F01P11/00","Component parts, details, or accessories not provided for in, or of interest apart from, groups F01P1/00 - F01P9/00","F01P1/00|F01P9/00","Using heat accumulators, ","B60H1/00492|F01P2011/205","When the deaeration devices, venting devices are mounted on the expansion reservoir they are classified in .When the deaeration devices, venting devices are mounted on the closure caps they are classified in .","F01P11/029|F01P11/0204","","This place covers: Venting, overflow, deaeration, filling of the circuit, expansion reservoirs, reservoir caps, draining and purging, indicating and safety devices, filtration and silencing of the cooling air and also regenerative heat accumulators."
