"cpc_code","title","title_cpc_codes","informative_references","informative_references_cpc_codes","special_rules","special_rules_cpc_codes","glossary_of_terms","definition_statement"
"G01C21/26","specially adapted for navigation in a road network","","Precision agricultureNavigation assistance for the blind or visually impairedDisplay devices for vehicle air conditioningSpeed or cruise control depending on curvesHeadlights adjustable depending on position, curves etc.Parking assistanceMechanical construction of the navigation device mounting in a vehicleCircuits for registering vehicle tilting or roll overControl of driving parameters, , Adaptive cruise controlEstimation or calculation of driving parameters for road vehicle drive control systems related to road conditionsLane keeping, Gear shifting depending on position as determined by navigation systemHand-held measuring wheels for measuring distances on mapsHand manipulated computing devices for air or sea navigationGIS Geographic 3D modelsTaximetersToll collectionService reminders, Data recordersEmergency signalling and personal security systemsTraffic information including RDS/TMC, , Location based services in a mobile phone networkLocating mobile subscriber using cellular telephony","A01B79/005|A61H3/061|B60H1/00985|B60K31/0066|B60Q1/06|B60Q1/48|B60R11/0258|B60R16/0233|B60T8/00|B60K28/10|B62D6/00|B60W30/16|B60W40/06|B62D1/28|B60W30/10|F16H61/0213|G01B3/12|G06G1/0052|G06T17/05|G07B13/00|G07B15/00|G07C5/006|B60R16/0234|G07C5/08|G08B25/016|H04H20/55|G08G1/091|G08G1/0968|H04W4/02|H04W64/00","","","","This place covers: Navigation specially adapted for navigation in a road network, whereby the means of transportation is not relevant: the user may be moving on foot, on horseback, on a bicycle, or in or on a motor vehicle of any kind."
"G01C21/28","with correlation of data from several navigational instruments","","","","","","","This place covers: Whereby the several navigational instruments may be similar (simple redundancy) or dissimilar."
"G01C21/30","Map- or contour-matching","","","","","","",""
"G01C21/32","Structuring or formatting of map data","","Geographic Information Systems (GIS) databasesAutomatic recognition/extraction of roads or features from maps","G06F16/29|G06V30/422","","","",""
"G01C21/34","Route searching; Route guidance","","Optimisation of energy usage for electrical vehiclesOptimisation of routes, e.g. travelling salesman problem, ","B60L15/2045|G06Q10/047|G06Q10/109","","","",""
"G01C21/3407","{specially adapted for specific applications}","","Fleet management, taxi dispatching","G08G1/202","","","",""
"G01C21/3415","{Dynamic re-routing, e.g. recalculating the route when the user deviates from calculated route or after detecting real-time traffic data or accidents}","","The complete route is dynamically recomputed based on new data","G08G1/096844","","","","This place covers: The use of route searching in navigation devices, systems or methods for dynamic re-routing, including predictive systems in which alternative routes are calculated even before the user has actually deviated and also routing from a predicted future starting point."
"G01C21/3461","{Preferred or disfavoured areas, e.g. dangerous zones, toll or emission zones, intersections, manoeuvre types, segments such as motorways, toll roads, ferries}","","","","","","","This place covers: Areas disfavoured because of weather conditions, (dis)favouring certain roads because of curves, e.g. for motorcycle (favoured) or towing vehicle (disfavoured), or because of physical requirements (e.g., weight, length, height, width) of non-standard vehicles. Carpooling/High Occupancy Vehicle restrictions. Also taking into account whether the user is entitled to use a road or road type (Vignette)."
"G01C21/3476","{using point of interest [POI] information, e.g. a route passing visible POIs}","","","","","","POIpoint of interest",""
"G01C21/3484","{Personalized, e.g. from learned user behaviour or user-defined profiles}","","User preferences are taken into account or the user selects one route out of a plurality","G08G1/096838","","","",""
"G01C21/3492","{employing speed data or traffic data, e.g. real-time or historical  (traffic control systems for road vehicles involving transmission of navigation instructions to the vehicle G08G1/0968)}","G08G1/0968","Traffic control systems for road vehicles involving transmission of navigation instructions to the vehicle ","G08G1/0968","","","","This place covers: Employing traffic data whereby those traffic data may relate either to the vehicle traffic of the physical vehicle or to the data traffic in mobile communication networks."
"G01C21/36","Input/output arrangements for on-board computers","","Arrangements of vehicle instruments on dashboard, Mechanical construction of the display mounting in a vehicleElectric circuits for voice controlAudible indication of meter readingsInput arrangements for transferring data to be processed into a form capable of being handled by the computer; Output arrangements for transferring data from processing unit to output unit, e.g. interface arrangementsI/O for computers in generalInteraction techniques for graphical user interfaces, e.g. interaction with windows, icons or menusManipulating 3D models or images for computer graphicsVoice analysis, synthesis, ","B60K35/00|B60K37/02|B60R11/0235|B60R16/0373|G01D7/12|G06F3/00|G06F3/033|G06F3/048|G06T19/00|G10L|G10L15/26","","","",""
"G01C21/3602","{Input other than that of destination using image analysis, e.g. detection of road signs, lanes, buildings, real preceding vehicles using a camera}","","Image data processing per se","G06T","","","",""
"G01C21/3605","{Destination input or retrieval}","","Gesture based interaction between user and computer","G06F3/017","","","",""
"G01C21/3608","{using speech input, e.g. using speech recognition}","","Speech recognition ","G10L15/00","","","",""
"G01C21/3611","{using character input or menus, e.g. menus of POIs  (character input methods in general G06F3/0233)}","G06F3/0233","Character input methodsInput is assisted by the navigation device, i.e. the user does not type the complete name of the destination, e.g. using zip codes, telephone numbers, progressively selecting from initial letters","G06F3/0233|G08G1/096894","","","",""
"G01C21/3617","{using user history, behaviour, conditions or preferences, e.g. predicted or inferred from previous use or current movement}","","Input information is obtained using learning systems, e.g. history databases","G08G1/096888","","","",""
"G01C21/362","{received from an external device or application, e.g. PDA, mobile phone or calendar application}","","Input information is obtained using a mobile device, e.g. a mobile phone, a PDA","G08G1/096883","","","","This place covers: Destinations derived from radio or TV broadcasts. Destination being the (dynamic) position of a mobile device and received therefrom."
"G01C21/3626","{Details of the output of route guidance instructions  (traffic control systems for road vehicles involving transmission of navigation instructions to the vehicle G08G1/0968)}","G08G1/0968","Traffic control systems for road vehicles involving transmission of navigation instructions to the vehicle","G08G1/0968","","","","This place covers: Instructions to assist the user to follow the calculated route as well as to warn the user in order to prevent the user from leaving the calculated route."
"G01C21/3629","{Guidance using speech or audio output, e.g. text-to-speech  (text to speech systems per se G10L13/00)}","G10L13/00","Instructions are given by voiceSpeech systems per se","G08G1/096872|G10L13/00","","","",""
"G01C21/3632","{Guidance using simplified or iconic instructions, e.g. using arrows  (G01C21/365 takes precedence)}","G01C21/365","The immediate route instructions are output to the driver, e.g. arrow signs for next turn","G08G1/096861","","","","This place covers: Details on guidance in navigation devices, systems or methods, wherein the guidance uses simplified or iconic instructions, e.g. directional arrows or other symbols, textual instructions."
"G01C21/3638","{including 3D objects and buildings  (three dimensional [3D] modelling, e.g. data description of 3D objects G06T17/00; geographic models G06T17/05)}","G06T17/00|G06T17/05","Three dimensional [3D] modelling, e.g. data description of 3D objectsGeographic models","G06T17/00|G06T17/05","","","",""
"G01C21/3641","{Personalized guidance, e.g. limited guidance on previously travelled routes}","","","","","","","This place covers: Details on guidance in navigation devices, systems or methods, wherein specific guidance adapted to the user is used, including user-defined guidance preferences relating to the manner of guidance, e.g. language, 2D/3D and guidance adapted to the instantaneous workload of the driver, considering also his mental and/or physical health."
"G01C21/3647","{Guidance involving output of stored or live camera images or video streams}","","","","","","","This place covers: Details on guidance in navigation devices, systems or methods, wherein the guidance involves camera images, including images taken by a camera in the vehicle itself, by a camera in another vehicle, by a roadside camera, or by a camera in an aircraft or in a satellite."
"G01C21/3658","{Lane guidance}","","","","","","","This place covers: Details on guidance in navigation devices, systems or methods, wherein the guidance takes road lanes into account, including showing a representation of an upcoming intersection including the pattern of the lanes."
"G01C21/3664","{Details of the user input interface, e.g. buttons, knobs or sliders, including those provided on a touch screen; remote controllers; input using gestures}","","Gesture based interactionInteraction techniques for image manipulation, e.g. dragging, rotationInteraction techniques involving entering handwritten data on touch screens","G06F3/017|G06F3/04845|G06F3/04883","","","","This place covers: Details on the user-input interface in navigation devices, systems or methods, including e.g. touch-screen interfaces, remote controllers, gesture-based input, interfaces which disallow the driver to access certain functions, e.g. while driving, input using handwriting."
"G01C21/3667","{Display of a road map  (G01C21/3614 takes precedence; guidance using 3D or perspective road maps G01C21/3635)}","G01C21/3614|G01C21/3635","Map spot or coordinate position indicators or map reading aids, using electronic means","G09B29/106","","","","This place covers: Input/output arrangements in navigation devices, systems or methods focusing on the display of a road map, including also simplified map representing connections between nodes."
"G01C21/367","{Details, e.g. road map scale, orientation, zooming, illumination, level of detail, scrolling of road map or positioning of current position marker}","","Interaction techniques for image manipulation, e.g. dragging, rotation","G06F3/04845","","","",""
"G01C21/3673","{Labelling using text of road map data items, e.g. road names, POI names}","","","","","","","This place covers: Input/output arrangements in navigation devices, systems or methods focusing on the labelling using text on road map displays, including also the displaying of house numbers."
"G01C21/3676","{Overview of the route on the road map}","","The complete route is shown to the driver","G08G1/096866","","","",""
"G01C21/3679","{Retrieval, searching and output of POI information, e.g. hotels, restaurants, shops, filling stations, parking facilities  (G01C21/3611 takes precedence)}","G01C21/3611","Location based services in a mobile phone network, , ","H04W4/02|H04L29/08657|H04M3/42348","","","",""
"G01C21/3682","{output of POI information on a road map  (G01C21/3614, G01C21/3685 take precedence)}","G01C21/3614|G01C21/3685","","","","","",""
"G01C21/3688","{Systems comprising multiple parts or multiple output devices (not client-server), e.g. detachable faceplates, key fobs or multiple output screens}","","","","","","","This place covers: Systems where multiple parts show a functional relationship (cooperation, synergy) between the part which remains in the vehicle and the portable part; this is different from the mechanical mounting of a mobile part to some part of a vehicle. The portable part must perform some navigation-related function on its own when taken out of the vehicle."
"G01C21/3691","{Retrieval, searching and output of information related to real-time traffic, weather, or environmental conditions  (arrangements for giving variable traffic instructions G08G1/09)}","G08G1/09","Arrangements for giving variable traffic instructionsArrangements for broadcast of traffic information","G08G1/09|H04H20/55","","","","This place covers: Input/output arrangements in navigation devices, systems or methods focusing on the processing of real-time traffic or weather information, including also traffic information sent from the vehicle to a server."
"G01C21/3697","{Output of additional, non-guidance related information, e.g. low fuel level  (G01C21/3679 takes precedence)}","G01C21/3679","Commerce, e.g. advertising","G06Q30/02","","","","This place covers: Output arrangements in navigation devices, systems or methods focusing on the output of specific information not related to guidance, e.g. low remaining fuel, fuel efficient driving, gear change, speeding, dangerous curve ahead, slippery road, traffic incident ahead, school zone, traffic cameras or road signs and including also advertisements displayed on maps or projected onto the landscape; providing information to the driver concerning his driving behaviour; warnings for speed traps."
"G01C22/00","Measuring distance traversed on the ground by vehicles, persons, animals or other moving solid bodies, e.g. using odometers, using pedometers","","Golf cartsTyresIndicating or recording positions or identities of vehicles or vehicle trainsHand-held measuring wheels for measuring distances on mapsResetting mechanismsMeasuring tyre performance on wheel standsCounting mechanisms per se Anti tamper countersTaximetersService reminders, Stepping motors","A63B55/60|B60C23/00|B61L25/02|G01B3/12|G01D4/04|G01M17/00|G06M|G06M3/12|G07B13/00|G07C5/006|B60R16/0234|H02P8/00","","","","This place covers: Devices and methods for measuring distance traversed on the ground by vehicles, persons, animals or other moving solid bodies, e.g. using pedometers, odometers including mechanical odometers."
"G01C22/002","{for cycles}","","","","","","","This place covers: The cycles can be monocycles, bicycles, tricycles or motorcycles."
"G01C22/004","{for golf carts }","","Wheeled carriers for golf bags","A63B55/60","","","",""
"G01C22/006","{Pedometers}","","FootwearPortable device for measuring pulse or heart rateElectronic controls for exercising apparatus","A43B3/00|A61B5/02438|A63B24/00","","","",""
"G01C22/008","{for skates}","","","","","","","This place covers: Devices and methods for measuring distance traversed on the ground, specially adapted for skates, including roller skates, in-line skates, ice skates, and skis."
"G01C22/02","by conversion into electric waveforms and subsequent integration, e.g. using tachometer generator {(G01C22/002, G01C22/004, G01C22/006 take precedence)}","G01C22/002|G01C22/004|G01C22/006","Wheel hubs","B60B27/00","","","","This place covers: Odometers involving electrical or electronic components."
"G01C22/025","{Differential odometers}","","","","","","","This place covers: Systems in which direction (orientation, azimuth) is determined by measuring the distances traversed by wheels on either side of the vehicle, and taking the difference of these distances."
"G01C23/00","Combined instruments indicating more than one navigational value, e.g. for aircraft; Combined measuring devices for measuring two or more variables of movement, e.g. distance, speed or acceleration","","Artificial horizons for aircraft, Arrangements for passenger entertainment, including display of navigation data using TV screensFlight simulators","G01C19/44|G01C19/32|B64D11/0015|G09B9/42","","","","This place covers: Devices, systems and methods for indicating more than one navigational value, e.g position and azimuth, devices, systems and methods for measuring two or more variables of movement, e.g. distance, speed and acceleration"
"G01C23/005","{Flight directors  (indicating arrangements specially adapted for rotary gyroscopes G01C19/32)}","G01C19/32","Arrangements or adaptations of instruments for aircraftIndicating or recording in connection with measuring, in generalControl of course of land or air vehicles by controlling or regulating non-electric variablesNavigation or guidance aids for a single aircraftAnti-collision systems for aircraft","B64D43/00|G01D|G05D1/00|G08G5/0047|G08G5/04","","","","This place covers: Flight directors, i.e. devices which provide visual steering cues to the pilot for e.g. pitch , roll, yaw attitude controls to allow a pilot to manipulate the aircraft controls in a manner to keep the steering cues aligned with corresponding fixed symbols, in order to satisfy the pitch and roll attitude control laws so that the aircraft is maintained on a predetermined flight path."
"G01C25/00","Manufacturing, calibrating, cleaning, or repairing instruments or devices referred to in the other groups of this subclass  (testing, calibrating or compensating compasses G01C17/38)","G01C17/38","","","","","","This place covers: Devices and methods for manufacturing, calibrating, cleaning or repairing instruments and devices referred to in the preceding groups."
