"cpc_code","title","title_cpc_codes","informative_references","informative_references_cpc_codes","special_rules","special_rules_cpc_codes","glossary_of_terms","definition_statement"
"G01R","MEASURING ELECTRIC VARIABLES; MEASURING MAGNETIC VARIABLES  (indicating correct tuning of resonant circuits H03J3/12)","H03J3/12","ElectrotherapyMagnetotherapyMeasuring not specially adapted for a specific variable Tariff metering apparatusMeasuring temperature based on the use of electric elements directly sensitive to heatMeasuring temperature based on the use of magnetic elements directly sensitive to heatMeasuring diffusion of ions in an electric field, e.g. electrophoresis, electro-osmosisSystems for regulating electric variables - Systems for regulating magnetic variablesImage data processing or generationMonitoring of signal or alarm line circuits, e.g. signalling of line faults Superconducting magnetsMagnets, Electric switches; Emergency protective devicesCathode-ray tubesThermo-electric solid state devices , Thermo-magnetic solid state devices , Devices using galvano-magnetic or similar magnetic effects, e.g. Hall effectAerialsEmergency protective circuit arrangementsCircuit arrangements for charging, or depolarising batteries or for supplying loads from batteriesMethods or apparatus specially adapted for manufacturing, assembling, maintaining or repairing dynamo-electric machinesGeneration of oscillationsModulationFrequency discriminators; Phase discriminatorsAmplifiersImpedance networks, e.g. resonant circuits; ResonatorsTuning resonant circuits; Selecting resonant circuitsPulse techniqueMonitoring electronic pulse countersA/D or D/A conversionMonitoring operation of communication systemsHousings for electric apparatusScreening of electric apparatus or components against electric fieldsScreening of electric apparatus or components against magnetic fieldsArrangements for monitoring manufacture of assemblages of electric components","A61N1/00|A61N2/00|G01D|G01D4/00|G01K7/00|G01K7/36|G01N|G05F1/00|G05F5/00|G05F7/00|G06T|G08B29/06|H01F6/00|H01F7/00|H01H|H01J31/00|H01L35/00|H01L37/00|H01L35/00|H01L37/00|H01L43/00|H01Q|H02H|H02J7/00|H02K15/00|H03B|H03C|H03D|H03F|H03H|H03J|H03K|H03K21/40|H03M1/00|H04|H05K|H05K9/00|H05K9/00|H05K13/08","General remark:  (electric part) is a big subclass with many low level subgroups. When classifying at group or subgroup level, care should taken to see to it that the document(s) really concern the measuring of an electric variable and that all higher level (subclass, group, subgroup) definitions are met with.The scheme was created at a time when electromechanical instruments were common. The groups closely linked to such instruments are rarely used for classifying measuring or testing devices that fall under .","G01R|G01R","Measuring propertiescan also be interpreted as investigating propertiesRemark: Measuring ""properties"" is rarely a subject for patenting in .Instruments or measuring instruments means electro-mechanical measuring mechanisms Remark: This rule is of little relevance, as electromechanical devices are basically obsolete.DUTDevice Under TestArrangements for measuringmeans apparatus, circuits, or methods for measuring","This place covers: Measuring electric variables or properties. Measuring electric variables directly, e.g. electromechanical instruments (see Glossary of terms) where the measured electric variables directly effect the indication of the measured value. Measuring electric variables by derivation from other electric variables, i.e. arrangements (see Glossary of terms) involving circuitry to obtain an indication of a measured value by deriving, calculating or otherwise processing electric variables, e.g. by comparison with another value. Measuring or investigating electric properties of materials. Electric testing of analogue or digital electric devices, apparatus or networks, or measuring their characteristics. Indicating presence or sign of current or voltage. The following technical subjects are therefore covered, the list being non-exhaustive: Measuring time integral of electric power or current (i.e. Energy), e.g. Of consumption Displaying electric variables or waveforms Measuring currents or voltages or for indicating presence or sign thereof Measuring electric power or power factor Measuring time integral of electric power or current, e.g. By electronic methods Measuring frequencies (of electric signals); measuring and analysing frequency spectra (of electric signals) Measuring phase angle between a voltage and a current or between voltages or currents Measuring resistance, reactance, impedance, or electric characteristics derived therefrom Testing electric properties of apparatus, e.g. Discharge tubes, amplifiers, transistors, integrated circuits Locating electric faults Electrical testing characterised by what is being tested not provided for elsewhere Testing for digital signal parameters (delay, skew, signal level) and characterization of device performance by use of test patterns; test apparatus or integrated test circuits therefor; methods for test pattern generation Details, testing or calibrating of   related instruments or arrangements Measuring magnetic variables or properties Measuring magnetic variables. Measuring or investigating magnetic properties of materials. The following technical subjects are therefore covered, the list being non-exhaustive: Measuring direction or amount of magnetic fields, or measuring characteristics of magnetic materials Apparatus based on magnetic resonance, e.g. Nmr, mri, epr (i.e. Esr) (see synonyms and keywords) and not specially adapted for a particular application Details, testing or calibrating of related instruments or arrangements"
"G01R1/02","General constructional details","","Details of a kind applicable to measuring arrangements not specially adapted for a specific variableConstructional details common to different types of electric apparatus","G01D7/00|H05K7/00","","","","This place covers: Structural, tangible details of devices."
"G01R1/04","Housings; Supporting members; Arrangements of terminals","","External aspects, e.g. related to chambers, contacting devices or handlersTerminalsTerminal strips or boardsHousings for electrical apparatus","G01R31/286|H01R|H02B|H05K","","","",""
"G01R1/0425","{Test clips, e.g. for IC's}","","","","","","","This place covers: Test clips, which are contacting devices that clip onto the integrated circuit to be tested."
"G01R1/06","Measuring leads; Measuring probes  (G01R19/145, G01R19/165 take precedence)","G01R19/145|G01R19/165","End pieces for leads","H01R11/00","","","",""
"G01R1/067","Measuring probes","","Plugs, sockets or clipsContacting IC's for test purposes when probe design is not the essential featureUsing radiation beam as probeTesting of connectionsEnd pieces for wires terminating in a probe","G01R1/0408|G01R31/2886|G01R31/302|G01R31/66|H01R11/18","","","","This place covers: Probes for connecting to electric devices for measuring or testing purposes."
"G01R1/06711","{Probe needles; Cantilever beams; ""Bump"" contacts; Replaceable probe pins}","","End pieces terminating in a probe","H01R11/18","","","","This place covers: Constructional details of individual probe elements or tips."
"G01R1/06744","{Microprobes, i.e. having dimensions as IC details}","","","","","","","This place covers:  Geometric details where the dimensions are of microscopic dimensions, corresponding to features of integrated elements."
"G01R1/06755","{Material aspects}","","","","","","","This place covers: Details related to the material as such (alloy, heat treatment, surface deposit...)"
"G01R1/06766","{Input circuits therefor}","","","","","","","This place covers: Circuits being part of or closely linked to a probe, such as amplifiers, filters or power supplies integrated in a probe."
"G01R1/06772","{High frequency probes}","","","","","","","This place covers: Probes adapted for the measuring of high frequencies, for example by having low inductance leads, low loss or linear frequency properties."
"G01R1/06777","{High voltage probes}","","","","","","","This place covers: Probes specially adapted for measuring high voltages."
"G01R1/07","Non contact-making probes","","Wireless interface with the DUT ","G01R31/3025","","","",""
"G01R1/073","Multiple probes","","","","","","","This place covers: Probes having multiple contacting points"
"G01R1/0735","{arranged on a flexible frame or film}","","","","","","","This place covers: Probes mounted on a flexible membrane, such as so called ""membrane probes""."
"G01R1/07357","{with flexible bodies, e.g. buckling beams}","","","","","","DUTDevice under test","This place covers: Probes having long needles, which flex when pressed against the DUT."
"G01R1/07364","{with provisions for altering position, number or connection of probe tips; Adapting to differences in pitch}","","","","","","","This place covers: Features related to geometrical adaption between probe tips and probe output, e.g. using an adapter board."
"G01R1/07392","{manipulating each probe element or tip individually}","","Manipulating a single (i.e. single contact) probe.Manipulating a complete ""multi probe""","G01R1/06705|G01R31/2886","","","","This place covers: Manipulation of one or more individual probe elements, e.g. the tip part."
"G01R1/10","Arrangements of bearings","","Bearings in general ","F16C","","","",""
"G01R1/18","Screening arrangements against electric or magnetic fields, e.g. against earth's field","","Screening of electrical apparatus or components in generalMeasuring shielding efficiency","H05K9/00|H05K9/0069","","","",""
"G01R1/20","Modifications of basic electric elements for use in electric measuring instruments; Structural combinations of such elements with such instruments","","Instrument transformers per se","H01F38/20","","","",""
"G01R1/22","Tong testers acting as secondary windings of current transformers","","Voltage or current isolation using transformers","G01R15/18","","","",""
"G01R1/38","Arrangements for altering the indicating characteristic, e.g. by modifying the air gap","","Circuits","G01R15/005","","","",""
"G01R1/44","Modifications of instruments for temperature compensation","","When measuring current or voltage","G01R19/32","","","",""
"G01R5/00","Instruments for converting a single current or a single voltage into a mechanical displacement","","Vibration galvanometers","G01R9/02","","","","This place covers: Instruments classified in this group may be used as indicating instruments for electric or non-electric variables."
"G01R5/22","Thermoelectric instruments","","Measuring effective values of currents or voltages using thermoconverters","G01R19/03","","","",""
"G01R5/28","Electrostatic instruments","","Electrometers without passively moving electrodesMeasuring electrostatic fieldsMeasuring charge","G01R15/165|G01R29/12|G01R29/24","","","",""
"G01R7/00","Instruments capable of converting two or more currents or voltages into a single mechanical displacement  (G01R9/00 takes precedence)","G01R9/00","","","","","","This place covers: Instruments classified in this group may be used as indicating instruments for electric or non-electric variables."
"G01R11/00","Electromechanical arrangements for measuring time integral of electric power or current, e.g. of consumption  (monitoring electric consumption of electrically-propelled vehicles B60L3/00)","B60L3/00","Electronic power meters are classifiedOther arrangements for measuring time integral of electric power or currentElectronic electricity (energy) metersMonitoring or controlling batteries or fuel cellsTariff metering apparatus, e.g. for measuring gas or water consumption but also for general metering where the type of consumption is not of interest; utility metersRemote reading of utility metersBoards, panels, desks (and parts or accessories therefor) for energy meters","G01R21/133|G01R22/00|G01R22/06|B60L58/00|G01D4/00|G01D4/002|H02B1/03","","","","This place covers: Electromechanical arrangements for measuring time integral of electric power or current such as conventional electromechanical electricity meters, i.e. comprising a rotating disk."
"G01R11/02","Constructional details","","Applicable to electric measuring instruments in general","G01R1/00","","","","This place covers: Unless one of the subgroups apply, add-ons, such as electronic counters or optical ports, are seen as ""constructional details""."
"G01R11/04","Housings; Supporting racks; Arrangements of terminals","","","","","","","This place covers: Housings for electromechanical electricity meters. ""Supporting racks"" are the internal supports for holding the Ferraris wheels, decade counters, transformers and other internal components of the electromechanical electricity meters. See e.g. US4791362, CH158284."
"G01R11/12","Arrangements of bearings","","Bearings in general","F16C","","","",""
"G01R11/24","Arrangements for avoiding or indicating fraudulent use","","Measures against unauthorised operation of bolts, nuts or pinsPreventing of tampering with detection circuits in signaling or alarm circuitsSecurity seals","F16B41/005|G08B29/046|G09F3/03","","","",""
"G01R11/25","Arrangements for indicating or signalling faults","","Preventing tampering with detection circuits in signalling or alarm circuitsSeals","G08B29/046|G09F3/03","","","",""
"G01R11/36","Induction meters, e.g. Ferraris meters","","Ferraris instruments","G01R5/20","","","",""
"G01R11/56","Special tariff meters","","Tariff metering in general","G01D4/00","","","",""
"G01R11/57","Multi-rate meters  (G01R11/63 takes precedence)","G01R11/63","","","","","",""
"G01R13/00","Arrangements for displaying electric variables or waveforms","","Display by mechanical displacement only, , Frequency spectrumRecognising patterns in signalsControl arrangements or circuits for visual indicators common to CRT indicators and other visual indicators","G01R5/00|G01R7/00|G01R9/00|G01R23/18|G06K9/00496|G09G5/00","","","","This place covers: Oscilloscopes and the like for measuring and displaying waveforms."
"G01R13/02","for displaying measured electric variables in digital form","","Cathode-ray oscilloscopes with intermediate digital signal processingLCD display of oscilloscopesTwo or three dimensional representation of valuesGeneral arrangements for monitoring or analysing measured signals, using A.D. converters measuring current or voltage using digital measurement techniquesModular arrangements for computer based systems for measuringcurrent or voltageData acquisition and logging in generalCountersAnalogue/digital conversion in general ","G01R13/345|G01R13/403|G01R13/408|G01R19/25|G01R19/2516|G06F17/40|G06M|H03M1/00","","","","This place covers: All digital oscilloscopes."
"G01R13/0209","{in numerical form}","","","","","","","This place covers: Systems for displaying a waveform by a table or the like with numerical values. Other characterising values, even single values, of waveforms are also covered here."
"G01R13/0254","{for triggering, synchronisation}","","","","","","",""
"G01R13/0272","{for sampling}","","","","","","","This place covers: Details of sampling circuits when they are used only in digital oscilloscopes."
"G01R13/029","{Software therefor}","","","","If the software calculates a trigger event an additional class is given in  (although the title thereof relates to circuits). Similarly the other groups of  are given in parallel to .","G01R13/0254|G01R13/0218|G01R13/029","","This place covers: Software used in digital oscilloscopes and the like."
"G01R13/20","Cathode-ray oscilloscopes","","Digital oscilloscopesLCD displays of oscilloscopesControl arrangements or circuits for cathode-ray tube indicatorsCathode ray tubes","G01R13/02|G01R13/403|G09G1/00|H01J31/00","","","","This place covers: Analogue oscilloscopes with cathode-ray screens or oscilloscopes which have an intermediate digital part but which use a traditional cathode-ray screen."
"G01R13/202","{Non-electric appliances, e.g. scales, masks  (luminescent screens for CRT provided with permanent marks or references H01J29/34; optical or photographic arrangements combined with CRT vessels H01J29/89)}","H01J29/34|H01J29/89","","","","","",""
"G01R13/204","{Using means for generating permanent registrations, e.g. photographs  (optical or photographic arrangements combined with CRT vessel H01J29/89)}","H01J29/89","","","","","",""
"G01R13/206","{Arrangements for obtaining a 3- dimensional representation  (stereoscopic T.V. H04N13/00)}","H04N13/00","","","","","",""
"G01R13/22","Circuits therefor","","Circuits for generating pulses, e.g. saw-tooth waveforms","H03K3/00","","","",""
"G01R13/225","{particularly adapted for storage oscilloscopes}","","","","","","","This place covers: Circuits of analogue storage oscilloscopes."
"G01R13/26","Circuits for controlling the intensity of the electron beam {or the colour of the display}","","Brilliance control","H01J29/98","","","",""
"G01R13/28","Circuits for simultaneous or sequential presentation of more than one variable","","Electronic switches","H03K17/00","","","",""
"G01R13/34","Circuits for representing a single waveform by sampling, e.g. for very high frequencies","","Sample and hold arrangements in general","G11C27/02","","","",""
"G01R13/342","{for displaying periodic H.F. signals  (G01R13/345 takes precedence)}","G01R13/345","","","","","",""
"G01R13/345","{for displaying sampled signals by using digital processors by intermediate A.D. and D.A. convertors (control circuits for CRT indicators)}","","","","","","","This place covers: Cathode-ray oscilloscopes whereby the intermediary signal processing is performed by a digital processor but the resulting waveform is converted back to an analogue signal to be displayed on the cathode-ray screen."
"G01R13/347","{using electro-optic elements}","","","","","","",""
"G01R13/36","using length of glow discharge, e.g. glowlight oscilloscopes","","Discharge tubes","H01J","","","",""
"G01R13/38","using the steady or oscillatory displacement of a light beam by an electromechanical measuring system","","Measuring systems per se, , ","G01R5/00|G01R7/00|G01R9/00","","","",""
"G01R13/40","using modulation of a light beam otherwise than by mechanical displacement, e.g. by Kerr effect {(visual indication of correct tuning H03J3/14)}","H03J3/14","","","","","","This place covers: Documents where the type of the display of the oscilloscope is of interest."
"G01R13/402","{using active, i.e. light-emitting display devices, e.g. electroluminescent display  (G01R13/36 and G01R13/42 take precedence)}","G01R13/36|G01R13/42","","","","","",""
"G01R13/403","{using passive display devices, e.g. liquid crystal display or Kerr effect display devices}","","","","","","","This place covers: Documents where the type of the display of the oscilloscope is of interest."
"G01R13/404","{for discontinuous display, i.e. display of discrete values  (analogue/digital conversion H03M1/00)}","H03M1/00","Analogue/digital conversion","H03M1/00","","","",""
"G01R13/406","{representing measured value by a dot or a single line  (G01R13/408 takes precedence)}","G01R13/408","","","","","",""
"G01R13/407","{using a plurality of passive display elements, e.g. liquid crystal or Kerr-effect display elements  (G01R13/408 takes precedence)}","G01R13/408","","","","","",""
"G01R15/00","Details of measuring arrangements of the types provided for in groups G01R17/00 - G01R29/00, G01R33/00 - G01R33/26 or G01R35/00","G01R17/00|G01R29/00|G01R33/00|G01R33/26|G01R35/00","Details of instrumentsOverload protection arrangements","G01R1/00|G01R1/36","","","",""
"G01R15/005","{Circuits for altering the indicating characteristic, e.g. making it non-linear}","","Altering a transfer function when measuring not specially adapted for a specific (e.g. electric) variable","G01D3/02","","","",""
"G01R15/06","having reactive components, e.g. capacitive transformer","","When the HV capacitor/sensor as such is the essential","G01R15/16","","","",""
"G01R15/08","Circuits for altering the measuring range","","Range change when measuring not specially adapted for a specific (e.g. electric) variable","G01D3/024","","","",""
"G01R15/14","Adaptations providing voltage or current isolation, e.g. for high-voltage or high-current networks","","Voltage dividersMeans for converting the output of a sensing member to another variableVisible signalling arrangements or devicesTransmission systems for measured values, Instrument transformers","G01R15/04|G01D5/00|G08B5/00|G08C17/00|G08C23/00|H01F38/20","","","",""
"G01R15/16","using capacitive devices","","Circuits constituting a voltage dividerMeasuring an electric field as such","G01R15/06|G01R29/08","","","","This place covers: Measuring of voltage or through capacitive coupling with the conductor to be measured."
"G01R15/18","using inductive devices, e.g. transformers","","Transformers and inductances as such","H01F","","","","This place covers: Measuring current or voltage using coils or transformers (having interacting windings; the primary winding can be made up by a straight conductor surrounded by the secondary)."
"G01R15/20","using galvano-magnetic devices, e.g. Hall-effect devices {, i.e. measuring a magnetic field via the interaction between a current and a magnetic field, e.g. magneto resistive or Hall effect devices}","","Measuring magnetic fields as such, using galvano-magnetic devices","G01R33/06","","","Galvano magnetic deviceHaving an interaction between a current and a magnetic field in the device itself ",""
"G01R15/202","{using Hall-effect devices  (Hall elements in arrangements for measuring electrical power G01R21/08)}","G01R21/08","Hall effect devices as such","H01L43/06","","","",""
"G01R15/241","{using electro-optical modulators, e.g. electro-absorption  (probes containing electro-optic elements G01R1/071)}","G01R1/071","Measuring an electric field as such, using electro-optical modulation","G01R29/0885","","","",""
"G01R17/10","AC or DC measuring bridges","","Automatic comparison or rebalancing arrangements","G01R17/02","","","",""
"G01R17/20","AC or DC potentiometric measuring arrangements","","Automatic comparison or re-balancing arrangements","G01R17/02","","","",""
"G01R19/00","Arrangements for measuring currents or voltages or for indicating presence or sign thereof  (G01R5/00 takes precedence; for measuring bioelectric currents or voltages A61B5/24)","G01R5/00|A61B5/24","Voltage measurements using secondary electron emission when testing electronic circuits","G01R31/305","","","",""
"G01R19/003","{Measuring mean values of current or voltage during a given time interval}","","When not specially adapted for a specific variable","G01D1/02","","","",""
"G01R19/0038","{Circuits for comparing several input signals and for indicating the result of this comparison, e.g. equal, different, greater, smaller (comparing pulses or pulse trains according to amplitude)}","","Logic circuits characterised by logic function","H03K19/20","","","",""
"G01R19/02","Measuring effective values, i.e. root-mean-square values","","Measuring RMS values when not specially adapted for a current or voltage measurementAnalogue computers for evaluating mean square values.","G01D1/02|G07G7/20","","","",""
"G01R19/03","using thermoconverters","","Using ac-dc conversion by means of thermocouples or other heat sensitive elements","G01R19/225","","","",""
"G01R19/04","Measuring peak values {or amplitude or envelope} of ac or of pulses","","Peak detectors for pulses.","H03K5/1532","","","","This place covers: Measuring of amplitude of periodic voltage or current is also covered."
"G01R19/12","Measuring rate of change","","Emergency protective circuit arrangements responsive to the rate of change of electrical quantities","H02H3/44","","","",""
"G01R19/145","Indicating the presence of current or voltage","","Measuring probes in generalIndicating continuity or short circuits in electric apparatus or lines or components ","G01R1/06|G01R31/50","","","",""
"G01R19/165","Indicating that current or voltage is either above or below a predetermined value or within or outside a predetermined range of values","","Circuits with regenerative action, e.g. Schmitt triggerTransition or edge detectors for pulsesThreshold switches","H03K3/00|H03K5/1534|H03K17/00","","","","This place covers: Threshold detectors as such, when seen as a measurement circuit (for current or voltage)."
"G01R19/175","Indicating the instants of passage of current or voltage through a given value, e.g. passage through zero","","Zero-crossing detectors for pulses","H03K5/1536","","","",""
"G01R19/18","using conversion of DC into AC, e.g. with choppers","","DC amplifiers with modulators at input and demodulator at output","H03F3/38","","","",""
"G01R19/20","using transductors {, i.e. a magnetic core transducer the saturation of which is cyclically reversed by an AC source on the secondary side}","","Other DC current transducers, e.g. using the 0-flux principleMagnetic amplifiers","G01R15/185|H03F9/00","","","",""
"G01R19/25","using digital measurement techniques","","Arrangements for displaying measured electric variables in digital formAnalogue/digital conversion ","G01R13/02|H03M","","","",""
"G01R19/252","using analogue/digital converters of the type with conversion of voltage or current into frequency and measuring of this frequency","","Analog to digital converters as such ","H03M1/12","","","",""
"G01R19/255","using analogue/digital converters of the type with counting of pulses during a period of time proportional to voltage or current, delivered by a pulse generator with fixed frequency","","Analogue to digital converters as such","H03M1/12","","","",""
