"cpc_code","title","title_cpc_codes","informative_references","informative_references_cpc_codes","special_rules","special_rules_cpc_codes","glossary_of_terms","definition_statement"
"G01R19/257","using analogue/digital converters of the type with comparison of different reference values with the value of voltage or current, e.g. using step-by-step method","","Analogue to digital converters as such","H03M1/12","","","",""
"G01R19/28","adapted for measuring in circuits having distributed constants","","Testing of microwave or radiofrequency circuits","G01R31/2822","","","","This place covers: Adaptations where the measured signals have wavelengths in the order of magnitude of the circuits present, i.e. high frequencies (theoretically, signals on very long conductors are also covered, but such applications are unusual)."
"G01R19/30","Measuring the maximum or the minimum value of current or voltage reached in a time interval  (G01R19/04 takes precedence)","G01R19/04","Modifications of instruments to indicate the maximum or the minimum value reached in a time intervalUsing digital methods","G01R1/40|G01R19/2506","","","",""
"G01R19/32","Compensating for temperature change","","Modifications of instruments for temperature compensation","G01R1/44","","","",""
"G01R21/00","Arrangements for measuring electric power or power factor  (G01R7/12 takes precedence)","G01R7/12","","","","","","This place covers: Analogue and digital measurements of power or power factor. Also measurements of power for high frequency signals. This group covers additionally the measurement of power when it is an essential aspect of a measurement of electric energy (time integral of power)."
"G01R21/001","{Measuring real or reactive component; Measuring apparent energy  (G01R21/01, G01R21/02, G01R21/08, G01R21/10 and G01R21/127 take precedence)}","G01R21/01|G01R21/02|G01R21/08|G01R21/10|G01R21/127","","","","","",""
"G01R21/002","{Measuring real component}","","","","","","",""
"G01R21/003","{Measuring reactive component}","","","","","","",""
"G01R21/005","{Measuring apparent power}","","","","","","",""
"G01R21/007","{Adapted for special tariff measuring  (G01R21/01, G01R21/02, G01R21/08, G01R21/10, G01R21/1278 and G01R21/1333 take precedence)}","G01R21/01|G01R21/02|G01R21/08|G01R21/10|G01R21/1278|G01R21/1333","","","","","",""
"G01R21/008","{Measuring maximum demand}","","","","","","","This place covers: maximum load or demand monitors."
"G01R21/01","in circuits having distributed constants  (G01R21/04, G01R21/07, G01R21/09, G01R21/12 take precedence)","G01R21/04|G01R21/07|G01R21/09|G01R21/12","","","","","","This place covers: Power measurements whereby the wavelength comes into the geometrical order of the underlying medium, i.e. for very high frequencies."
"G01R21/02","by thermal methods {, e.g. calorimetric}","","","","","","","This place covers: Power measurements by thermal methods for high frequency signals."
"G01R21/04","in circuits having distributed constants","","","","","","","This place covers: Power measurements by thermal methods whereby the wavelength comes into the geometrical order of the underlying medium, i.e. for very high frequencies."
"G01R21/06","by measuring current and voltage  (G01R21/08 - G01R21/133 take precedence)","G01R21/08|G01R21/133","","","","","",""
"G01R21/07","in circuits having distributed constants  (G01R21/09 takes precedence)","G01R21/09","","","","","","This place covers: Power measurements by using voltage and current measurements whereby the wavelength comes into the geometrical order of the underlying medium, i.e. for very high frequencies."
"G01R21/08","by using galvanomagnetic-effect devices, e.g. Hall-effect devices","","Galvano-magnetic effect devices, e.g. Hall effect devices, for current measurements onlySuch devices per seHall effect devices per se, ","G01R15/20|H01L|H01L43/06|G01R33/07","","","",""
"G01R21/09","in circuits having distributed constants","","","","","","","This place covers: Power measurements by using galvano-magnetic effect devices whereby the wavelength comes into the geometrical order of the underlying medium, i.e. for very high frequencies."
"G01R21/10","by using square-law characteristics of circuit elements, e.g. diodes, to measure power absorbed by loads of known impedance  (G01R21/02 takes precedence)","G01R21/02","","","","","","This place covers: Power measurement for high frequency signals which use such square-law characteristics of circuit elements."
"G01R21/12","in circuits having distributed constants","","","","","","","This place covers: Power measurements by using square-law characteristics of circuit elements whereby the wavelength comes into the geometrical order of the underlying medium, i.e. for very high frequencies."
"G01R21/127","by using pulse modulation  (G01R21/133 takes precedence)","G01R21/133","Digital multiplication via delta sigma modulation","G06F7/60","","","",""
"G01R21/133","by using digital technique","","","","","","","This place covers: Power meters using a digital processor. Additionally measurements of power in meters for electric energy (time integral of power) when the measurement of power is the essential aspect."
"G01R21/1338","{Measuring maximum demand}","","","","","","","This place covers: Maximum load or maximum demand power meters."
"G01R22/00","Arrangements for measuring time integral of electric power or current, e.g. electricity meters",""," Electromechanical arrangements for measuring time integral of power or currentArrangements for measuring electric powerMonitoring electric consumption of electrically-propelled vehicles , Coin freed devices Arrangements for AC mains network controllingArrangements for providing remote indication of network conditions ","G01R11/00|G01R21/00|B60L3/00|B60L58/00|G07F15/00|H02J3/00|H02J13/00","","","","This place covers: Methods other than electromechanical for measuring time integral of electric power."
"G01R22/06","by electronic methods","","","","","","","This place covers: Electronic methods for measuring time integral of power, whereby analogue or digital techniques can be used."
"G01R22/063","{related to remote communication}","","","","","","","This place covers: Aspects of electricity meters for remote reading in the sense that the meter has special adaptations which go beyond standard communication systems."
"G01R22/065","{related to mechanical aspects}","","","","","","","This place covers: Housings specially adapted (or used only) for electronic electricity meters. This group also covers adaptations to the housing of an electronic electricity meter in order to add a certain functionality and whereby mechanical aspects of this adaptation are of importance."
"G01R22/066","{Arrangements for avoiding or indicating fraudulent use}","","","","","","",""
"G01R22/08","using analogue techniques","","","","","","","This place covers: Electricity meters which are based on an analogue electronic circuit."
"G01R22/10","using digital techniques","","","","","","","This place covers: Digital arrangements for measuring time integral of electric power, such as electricity meters, whereby the digital processing is of importance."
"G01R23/00","Arrangements for measuring frequencies; Arrangements for analysing frequency spectra","","High frequency probesInvestigating materials by use of microwavesInvestigating materials by use of electric or magnetic meansArrangements for providing remote indication of network conditions Frequency discriminators Demodulation of frequency modulated signalsReceivers for broadcast information","G01R1/06772|G01N22/00|G01N27/00|H02J13/00|H03D1/00|H03D3/00|H04H40/18","","","","This place covers: Arrangements for measuring frequencies of electrical signals as such. arrangements for analysing frequency spectra of electric signals if the analysis thereof comprises aspects of the determination of frequency components."
"G01R23/005","{Circuits for comparing several input signals and for indicating the result of this comparison, e.g. equal, different, greater, smaller (comparing phase or frequency of 2 mutually independent oscillations in demodulators)}","","","","","","",""
"G01R23/02","Arrangements for measuring frequency, e.g. pulse repetition rate; Arrangements for measuring period of current or voltage","","Arrangements for measuring frequency using vibrating reeds Measuring short-time intervals ","G01R9/04|G04F1/00","","","",""
"G01R23/04","adapted for measuring in circuits having distributed constants","","","","","","","This place covers: Measurements of frequencies whereby the wavelength comes into the geometrical order of the underlying medium, i.e. for very high frequencies."
"G01R23/07","using response of circuits tuned on resonance, e.g. grid-drip meter","","","","","","","This place covers: Measuring instruments using a resonant frequency, e.g. an oscillator output energy which changes in the vicinity of a resonant circuit which is tuned to the frequency the oscillator generates."
"G01R23/09","using analogue integrators, e.g. capacitors establishing a mean value by balance of input signals and defined discharge signals or leakage","","Radiation-measuring instruments in which pulses generated by a radiation detector are integrated ","G01T1/15","","","",""
"G01R23/14","by heterodyning; by beat-frequency comparison","","Generation of oscillations by beating unmodulated signals of different frequencies ","H03B21/00","","","","This place covers: Frequency measurements wherein signals of different frequencies are combined in order to generate intermediate frequencies / interference signals which are used for the measurement (heterodyning). Also frequency measurements based on a comparison to a signal of a similar reference frequency."
"G01R23/145","{by heterodyning or by beat-frequency comparison with the harmonic of an oscillator}","","","","","","","This place covers: Frequency measurements wherein the reference signal is a harmonic signal of an (adjustable) oscillator."
"G01R23/155","{giving an indication of the number of times this occurs, i.e. multi-channel analysers (for pulse characteristics)}","","","","","","","This place covers: Also digital determinations of a single frequency."
"G01R23/16","Spectrum analysis; Fourier analysis","","Investigating materials by use of microwavesInvestigating materials by use of electric or magnetic meansComputing with Fourier series or Walsh functions , Feature extraction from signalsDemodulation of frequency modulated signalsReceivers for broadcast information","G01N22/00|G01N27/00|G06F17/14|G06G7/19|G06K9/00523|H03D3/00|H04H40/18","","","","This place covers: Spectrum-analysers and the like, e.g. digital spectrum analysers using algorithms performed on a microprocessor whereby the electric signal measurement apparatus, and not only a pure mathematical algorithm, is of interest."
"G01R23/163","adapted for measuring in circuits having distributed constants","","","","","","","This place covers: Spectrum analysis for frequencies whereby the wavelength comes into the geometrical order of the underlying medium, i.e. for very high frequencies."
"G01R23/167","with digital filters","","","","","","",""
"G01R23/173","Wobbulating devices similar to swept panoramic receivers","","Panoramic receivers per se ","H03J7/32","","","",""
"G01R23/18","with provision for recording frequency spectrum","","","","","","","This place covers: For example devices which such provisions for recording in order to display the result on a screen."
"G01R23/20","Measurement of non-linear distortion","","Measurement of phase shift of four pole networksMeasurement of noise figure, signal-to-noise ratio or jitter (phase noise) Testing of individual semiconductor devicesTesting (or characterising) of electronic circuitsAnalysis of signal quality ","G01R27/28|G01R29/26|G01R31/26|G01R31/28|G01R31/31708","","","","This place covers: The measurement of non-linear distortion by frequency analysis."
"G01R25/00","Arrangements for measuring phase angle between a voltage and a current or between voltages or currents","","Measuring power factor Measuring position of individual pulses in a pulse train Phase discriminatorsCircuits for comparing the phase of two mutually independent oscillationsPhase locked loops","G01R21/00|G01R29/02|H03D|H03D13/00|H03L7/08","","","","This place covers: Phase measurements of electrical signals as such."
"G01R25/005","{Circuits for comparing several input signals and for indicating the result of this comparison, e.g. equal, different, greater, smaller, or for passing one of the input signals as output signal}","","","","","","",""
"G01R25/02","in circuits having distributed constants","","","","","","","This place covers: Phase measurements whereby the wavelength comes into the geometrical order of the underlying medium, i.e. for very high frequencies."
"G01R25/08","by counting of standard pulses","","Measuring position of individual pulses in a pulse trainMeasuring time intervals ","G01R29/02|G04F1/00","","","",""
"G01R27/00","Arrangements for measuring resistance, reactance, impedance, or electric characteristics derived therefrom","","Sensors using a resistive elementSensors using an inductive elementMeasuring superconductive propertiesSensors using a capacitive element","G01R5/16|G01R5/20|G01R33/1238|G01D5/24","","","","This place covers: Measurements of resistance, reactance or impedance as such whereby the measurement comprises aspects which are not generally known in the art."
"G01R27/02","Measuring real or complex resistance, reactance, impedance, or other two-pole characteristics derived therefrom, e.g. time constant  (by measuring phase angle only G01R25/00)","G01R25/00","","","","","","This place covers: Measurements of complex impedance. Groups   -   cover variables that directly or indirectly can be measured over two poles of a component or a Thevenin two-pole equivalent. Subgroup   also covers other techniques, e.g. using electro-magnetic waves or network analyzers. Measurements of capacitance only is classified in  . Measurements of inductance only is classified in  ."
"G01R27/025","{Measuring very high resistances, e.g. isolation resistances, i.e. megohm-meters}","","","","","","",""
"G01R27/04","in circuits having distributed constants {, e.g. having very long conductors or involving high frequencies}","","","","","","","This place covers: Impedance measurements whereby the wavelength comes into the geometrical order of the underlying medium, i.e. for very high frequencies."
"G01R27/06","Measuring reflection coefficients; Measuring standing-wave ratio","","","","","","",""
"G01R27/14","Measuring resistance by measuring current or voltage obtained from a reference source  (G01R27/16, G01R27/20, G01R27/22 take precedence)","G01R27/16|G01R27/20|G01R27/22","","","","","",""
"G01R27/18","Measuring resistance to earth {, i.e. line to ground}","","Measurement of isolation resistanceTesting of leakage or ground faults","G01R27/025|G01R31/52","","","","This place covers: Measurements of resistance between a high voltage line and ground when current from another source is passing the high voltage line."
"G01R27/20","Measuring earth resistance; Measuring contact resistance, {e.g.} of earth connections, e.g. plates","","Testing of continuityTesting of connections","G01R31/54|G01R31/66","","","","This place covers: Measurements of resistance of lines which are intended for grounding, such as the resistance of the PE line or of the resistance of the earth as such."
"G01R27/205","{Measuring contact resistance of connections, e.g. of earth connections}","","","","","","","This place covers: Contact resistance measurements, e.g. of earth connections, but also of other connections, e.g. between terminal blades and sockets."
"G01R27/22","Measuring resistance of fluids","","Measuring vessels, electrodes for measuring resistance of fluids","G01N27/07","","","",""
"G01R27/26","Measuring inductance or capacitance; Measuring quality factor, e.g. by using the resonance method; Measuring loss factor; Measuring dielectric constants {; Measuring impedance or related variables}","","","","The group  represents only a parent-class which is not actively used. Instead the groups  -  are used.In cases where an impedance with a real and an imaginary part is determined, and none of the groups listed hereabove are relevant, the group  is used.","G01R27/26|G01R27/2605|G01R27/2688|G01R27/02","",""
"G01R27/2605","{Measuring capacitance  (capacitive sensors G01D5/24)}","G01D5/24","","","The mere use of an existing capacity measurement method or device should not be classified in this group. In particular no sensors which are based on capacitance effects are classified here. Such sensors are classified in the classes of the corresponding applications.","","","This place covers: Measurements of capacitance as such in the sense that particular steps of the measurement or particular features thereof are disclosed. Only in very rare and exceptional cases where the capacity measurement has particular aspects capacitive sensors may be classified here."
"G01R27/2611","{Measuring inductance}","","","","","","","This place covers: Measurements of inductance as such in the sense that particular steps of the measurement or particular features thereof are disclosed. Only in very rare and exceptional cases where the inductance measurement has particular aspects, sensors may be classified here."
"G01R27/2617","{Measuring dielectric properties, e.g. constants  (testing dielectric strength G01R31/12; detecting insulation faults G01R31/52; G01R27/2688 takes precedence)}","G01R31/12|G01R31/52|G01R27/2688","","","","","","This place covers: Measurements of the relative permittivity   or electric susceptibility X or the like of a dielectric material."
"G01R27/2623","{Measuring-systems or electronic circuits  (G01R27/2635, G01R27/2682 take precedence)}","G01R27/2635|G01R27/2682","","","","","",""
"G01R27/2629","{Bridge circuits  (bridges for measuring loss angle G01R27/2694)}","G01R27/2694","","","","","",""
"G01R27/2658","{Cavities, resonators, free space arrangements, reflexion or interference arrangements  (G01R27/2647 takes precedence; optical methods G01R27/2682)}","G01R27/2647|G01R27/2682","","","","","",""
"G01R27/2688","{Measuring quality factor or dielectric loss, e.g. loss angle, or power factor  (power factor related to power measurements G01R21/006; testing capacitors G01R31/016)}","G01R21/006|G01R31/016","","","","","","This place covers: Dielectric loss measurements e.g. of cables."
"G01R27/28","Measuring attenuation, gain, phase shift or derived characteristics of electric four pole networks, i.e. two-port networks; Measuring transient response  (in line transmission systems H04B3/46)","H04B3/46","","","","","","This place covers: For example hf network analysers."
"G01R27/32","in circuits having distributed constants {, e.g. having very long conductors or involving high frequencies}","","","","","","","This place covers: Measuring attenuation, gain, phase shift or derived characteristics of electric four pole networks whereby the wavelength comes into the geometrical order of the underlying medium, i.e. for very high frequencies, and this fact is essential for the invention."
"G01R29/02","Measuring characteristics of individual pulses, e.g. deviation from pulse flatness, rise time or duration","","AmplitudeMeasuring peak valuesOf repetition rateOf phase difference of two cyclic pulse trainsClock generators with changeable/programmable clock frequencyManipulating pulses using a chain of active delay devicesMonitoring pattern of pulse trains","G01R19/00|G01R19/04|G01R23/00|G01R25/00|G06F1/08|H03K5/133|H03K5/19","","","",""
"G01R29/0276","{the pulse characteristic being rise time  (measuring rate of change G01R19/12)}","G01R19/12","","","","","",""
"G01R29/04","Measuring form factor, i.e. quotient of root-mean-square value and arithmetic mean of instantaneous value; Measuring peak factor, i.e. quotient of maximum value and root-mean-square value","","Measuring effective values, i.e. root-mean square values","G01R19/02","","","",""
"G01R29/06","Measuring depth of modulation","","Monitoring, testing of transmission systems","H04B3/46","","","",""
"G01R29/08","Measuring electromagnetic field characteristics","","Measuring or estimating received signal strength","H04B17/318","","","",""
"G01R29/0814","{Field measurements related to measuring influence on or from apparatus, components or humans  (EMC, EMI and similar testing in general G01R31/001), e.g. in ESD, EMI, EMC, EMP testing, measuring radiation leakage; detecting presence of micro- or radiowave emitters; dosimetry; testing shielding; measurements related to lightning}","G01R31/001","EMC, EMI and similar testing in general ","G01R31/001","","","",""
"G01R29/0821","{rooms and test sites therefor, e.g. anechoic chambers, open field sites or TEM cells  (for testing antennas G01R29/105)}","G01R29/105","","","","","",""
"G01R29/085","{for detecting presence or location of electric lines or cables  (fault detection G01R31/50; fault location G01R31/08)}","G01R31/50|G01R31/08","","","","","",""
"G01R29/0857","{Dosimetry, i.e. measuring the time integral of radiation intensity; Level warning devices for personal safety use  (nuclear radiation dosimetry G01T)}","G01T","","","","","",""
"G01R29/0871","{Complete apparatus or systems; circuits, e.g. receivers or amplifiers  (G01R29/0878, G01R29/0892 take precedence; dosimeters, warning devices G01R29/0857)}","G01R29/0878|G01R29/0892|G01R29/0857","","","","","",""
"G01R29/0878","{Sensors; antennas; probes; detectors  (wave guide measuring sections G01R1/24)}","G01R1/24","","","","","",""
"G01R29/10","Radiation diagrams of antennas","","Analysing the shape of a waveformAntennas in generalPhased-array testing or checking devices","G06K9/0053|H01Q1/00|H01Q3/267","","","","This place covers: Testing of antennas and/or measurements of radiation diagrams of aerials."
"G01R29/105","{using anechoic chambers; Chambers or open field sites used therefor  (test sites used for measuring on other objects than aerials G01R29/0828; wave absorbing devices H01Q17/00)}","G01R29/0828|H01Q17/00","","","","","",""
"G01R29/12","Measuring electrostatic fields {or voltage-potential}","","Analysing materials by investigating electrostatic variables","G01N27/60","","","",""
"G01R29/14","Measuring field distribution","","Measuring radiation diagrams of antennasAnalysing materials by investigating electrostatic variables","G01R29/10|G01N27/60","","","",""
"G01R29/16","Measuring asymmetry of polyphase networks","","Testing AC power supplies, e.g. frequency converters","G01R31/42","","","",""
"G01R29/18","Indicating phase sequence; Indicating synchronism","","Arrangements for synchronising receiver with transmitter in communication networks","H04L7/00","","","","This place covers: Indicating phase sequence or Indicating synchronism of power supply networks."
"G01R29/20","Measuring number of turns; Measuring transformation ratio or coupling factor of windings","","Testing of transformers for e.g. short circuitsTesting of electric windingsTesting or calibrating of instrument transformers Transformers in general - ","G01R31/62|G01R31/72|G01R35/02|H01F19/00|H01F38/00","","","",""
"G01R29/22","Measuring piezo-electric properties","","Piezo-electric devices in general","H01L41/00","","","",""
"G01R29/24","Arrangements for measuring quantities of charge","","Electrostatic instruments Measuring electrostatic potential, e.g. with electrostatic voltmeters or electrometers, when the design of the sensor is essential Indicating presence of current Electrolytic meters, calorimetric meters, for measuring time integral of electric current, Measuring electrostatic fields","G01R5/28|G01R15/165|G01R19/15|G01R22/02|G01R22/04|G01R29/12","","","",""
"G01R29/26","Measuring noise figure; Measuring signal-to-noise ratio","","Measurement of non-linear distortion, e.g. relation of harmonics to input signalNoise measuring in individual transistorsAnalysis of signal quality or jitter of digital circuits","G01R23/20|G01R31/2616|G01R31/31708","","","","This place covers: The measurement of noise figure, signal-to-noise ratio and of jitter (phase noise)."
"G01R31/00","Arrangements for testing electric properties; Arrangements for locating electric faults; Arrangements for electrical testing characterised by what is being tested not provided for elsewhere  ({measuring superconductive properties G01R33/1238;} testing or measuring semiconductors or solid state devices during manufacture {H01L22/00}; testing line transmission systems H04B3/46)","G01R33/1238|H01L22/00|H04B3/46","Measuring leads or measuring probesTesting or monitoring of control systemsIndicating electrical condition of switchgear or protective devices, , , Testing substation equipment, e.g. mobile phones","G01R1/06|G05B23/02|H01H71/04|H01H73/12|H02B11/10|H02H3/04|H04M1/24","","","","This place covers: Electric testing of electric devices."
"G01R31/003","{Environmental or reliability tests  (of individual semiconductors G01R31/2642; of PCB's G01R31/2817; of IC's G01R31/2855; of other circuits G01R31/2849)}","G01R31/2642|G01R31/2817|G01R31/2855|G01R31/2849","","","","","","This place covers: Stress and burn-in testing, subjecting the DUT to hot or cold temperatures, radiation, vibration or similar."
"G01R31/005","{Testing of electric installations on transport means}","","Safety, indicating or supervising devices for combustion engines.","F02B77/08","","","",""
"G01R31/008","{on air- or spacecraft, railway rolling stock or sea-going vessels}","","Testing or inspecting aircraft components or systems ","B64F5/60","","","",""
