"cpc_code","title","title_cpc_codes","informative_references","informative_references_cpc_codes","special_rules","special_rules_cpc_codes","glossary_of_terms","definition_statement"
"G07F11/62","in which the articles are stored in compartments in fixed receptacles","","Dispensers for pharmaceutical articlesChest of drawers or cabinets characterised by the arrangement of drawersDrawers for cabinets and tables, or like furnitureMedicament distribution means for multiple medicamentsCash register drawersComputer-assisted distribution of medication from dispensers, i.e. making sure that medication is correctly delivered to patients","G07F17/0092|A47B67/04|A47B88/00|A61J7/0084|G07G1/0027|G16H20/13","","","","This place covers: Payment actuated apparatus for dispensing, or the like, of discrete articles, from compartments, storage containers or defined storage supports, which may be organised as a moving drawer composed of fixed compartments."
"G07F11/64","in which the articles are individually suspended from stationary supports","","","","","","","This place covers: Storage of articles hanging one by one or suspended along supports such as rails."
"G07F11/68","in which the articles are torn or severed from strips or sheets","","","","","","","This place covers: Storage along a strip of articles and severing one of the articles, blister-pack."
"G07F11/70","in which the articles are formed in the apparatus from components, blanks, or material constituents","","","","Additionally to the concept classified in this group, the fitting class in the storage or delivery method or means in a separate  entry is required.","G07F11/00","","This place covers: Storage and articles which are stored as components which need to be combined for dispensing, or which serve only as required for the use of another article even if not dispensed from same dispenser, e.g. bun dispensing for a food vending machine."
"G07F11/72","Auxiliary equipment, e.g. for lighting cigars, opening bottles","","","","Cups dispensed with a drink should be classified according to the type of drink and in .","G07F13/10","","This place covers: Storage and dispensing of articles which are supplementary to a main article dispensed, e.g. lighter or matches for a cigarette vending machine, bottle opener for drink bottle vendor."
"G07F13/00","Coin-freed apparatus for controlling dispensing or fluids, semiliquids or granular material from reservoirs","","Apparatus for making beveragesLiquid dispensing in general, such as water or petrolApparatus for dispensing beverages on draught ","A47J31/00|B65D7/00|B67D1/00","Fuel dispensing systems at petrol stations in . Drinks in  except hot drinks such as coffee, in  (as mostly a cup is also dispensed if required).","G07F13/025|G07F13/065|G07F13/10","","This place covers: Dispensing a quantity of a liquid such as water or oil, if not provided for the definition of any of the dependent groups. NB: The term ""coin-freed"" is to be read as ""payment activated""."
"G07F13/025","{wherein the volume is determined during delivery}","","","","","","","This place covers: Fuel dispensing systems at petrol stations"
"G07F13/065","{for drink preparation}","","","","","","","This place covers: Coin-freed apparatus for controlling dispensing or fluids, semi liquids or granular material from reservoirs, with selective dispensing of different fluids or materials (e.g. mixed), e.g. for drink preparation."
"G07F13/08","in the form of a spray","","","","Needs also a class in  if for cosmetic beauty products.","G07F17/18","",""
"G07F13/10","with associated dispensing of containers, e.g. cups or other articles","","Dispensing discrete articles per seDispensers for drinks without further details about associated dispensing of containers, e.g. cups or other articlesBeverage-making apparatus with dispensing means for adding a measured quantity of ingredients, e.g. coffee, sugar, cocoa, milk, tea","G07F11/00|G07F13/065|A47J31/40","","","","This place covers: Coin-freed apparatus for controlling dispensing or fluids, semi liquids or granular material from reservoirs, with associated dispensing of containers, e.g. cups or other containers."
"G07F15/00","Coin-freed apparatus with meter-controlled dispensing of liquid, gas or electricity","","For vending, access and use of specific services not covered anywhere else in, , Gas or electricity for washing or hygiene or persons and animals (e.g. oxygen, shower, sun-tan cabin)Tariff-metering apparatus in generalData processing for electricity, gas and water supply","G07F15/00|G07F17/00|G07F17/0014|G07F17/18|G01D4/00|G06Q50/06","The groups  -  may also be applied in combination, if necessary, with a group from  - .","G07F15/00|G07F15/008|G07F15/02|G07F15/12","","This place covers: Payment activated access to facilities such as public services, e.g. gas, electricity, water for housing. NB: The term ""coin-freed"" is to be read as ""payment activated""."
"G07F15/001","{for gas}","","Dispensing of gas for washing, drying or hygiene of persons (and animals)Electric propulsion with power supplied within the vehicle","G07F17/18|B60L50/00","","","","This place covers: Coin-freed apparatus for meter-controlled dispensing of gas."
"G07F15/003","{for electricity}","","Dispensing of gas for washing, drying or hygiene of persons (and animals)Electric propulsion with power supplied within the vehicleCircuit arrangements for charging or depolarising batteries or for supplying loads from batteries","G07F17/18|B60L50/00|H02J7/00","","","","This place covers: Payment activated dispensing of electricity or charging of electricity into an object or apparatus."
"G07F15/005","{dispensed for the electrical charging of vehicles  (electrical charging as such, B60L50/00)}","B60L50/00","Electrical (circuits for) charging of vehiclesTechnologies related to electric vehicle charging (not used as head-group but see subgroups)","B60L53/00|Y02T90/10","","","","This place covers: Payment actuated apparatus for meter-controlled and billed electricity for charging vehicles, such as cars and bicycles."
"G07F15/006","{dispensed for the electrical charging of other devices than vehicles}","","Stations for charging mobile units, e.g. mobile telephonesCircuits specially adapted for holding portable devices containing batteries","H02J7/0027|H02J7/0044","","","","This place covers: Payment actuated apparatus for meter-controlled and billed electricity for charging devices other than vehicles, such as mobile phones."
"G07F15/008","{Rewarding for providing delivery of electricity to the network}","","Electric propulsion with power supplied within the vehicleEnabling technologies with a potential or indirect contribution to GHG emissions mitigation","B60L50/00|Y02T90/00","","","","This place covers: Payments received for providing electricity back to the grid, e.g. in house environment or vehicle plugged into a charging station connected to the electrical network."
"G07F17/00","Coin-freed apparatus for hiring articles; Coin-freed facilities or services","","Coin-freed facilities for specific storage or delivery of single objectsCoin-freed facilities for liquid or granular articlesCoin-freed facilities for facilities such as electricity and gasPrepayment telephone systems","G07F11/00|G07F13/00|G07F15/00|H04M17/00","","","","This place covers: Payment activated access to various services and specific types of objects independently of their manner of storageor delivery arrangements. NB: The term ""coin-freed"" is to be read as ""payment activated""."
"G07F17/0014","{for vending, access and use of specific services not covered anywhere else in G07F17/00  (meter-controlled dispensing of liquid, gas or electricity G07F15/00)}","G07F17/00|G07F15/00","Coin-freed apparatus with meter-controlled dispensing of liquid, gas or electricity (tariff-metering apparatus in general, )","G01D4/00|G07F15/00","","","","This place covers: Devices for access to specific services not being facilities covered anywhere else in   (metered dispensing of water, electricity, or gas) or specific services such as services for which a fitting indexation is possible within the   scheme, such as hotel reservations, conditional access to locations, waste deposits."
"G07F17/0021","{Access to services on a time-basis}","","Arrangements for time-control in telephone networks","H04M15/00","","","","This place covers: Devices giving access to services metered or charged on a time-basis."
"G07F17/0028","{Use of a wired telephone or public communication device  (charging and metering the use of the telecommunication network H04M17/02)}","H04M17/02","Prepayment for use of wireline communication systems or telephone systems","H04M17/00","","","","This place covers: Devices giving access to services through the public communication or wired telephone."
"G07F17/0035","{Participation in a loyalty or discount scheme  (data processing for shopping and discounts G06Q30/00)}","G06Q30/00","Data processing for granting discounts or incentives, e.g. coupons, rebates, offers or up-sales","G06Q30/0207","","","","This place covers: Devices such as SST that give access to loyalty or discount schemes."
"G07F17/0064","{for processing of food articles  (cooking vessels A47J37/00)}","A47J37/00","Drinks and liquid food dispensers or Cooking vessels and devices","G07F13/06|G07F13/10|A47J37/00","","","","This place covers: Payments actuated dispensing of solid food products that need to be processed before delivery."
"G07F17/0092","{for assembling and dispensing of pharmaceutical articles  (medical dispensers for private use, A61J7/00)}","A61J7/00","Tables, desks, cabinets, drawers, general details of the sameSpecial furniture, fittings or accessories for shops, store houses or the likeDiagnosis, surgery, identificationTrolleys for transport of medicaments, transportation or accommodation for patientsMedicament (to be taken orally) distribution systemsDevices for introducing media into the bodyBlister packagesPackaging of pills and medicationsContainers for storage of articlesTransport or storage devices, e.g. industrial process for conveying packaged productsHandling thin or filamentary material, e.g. cutting or perforating stripsSystems or methods specially adapted for patient record managementData processing specially adapted for medical matters and control of correct dispensing to patient","A47B|A47F|A61B|A61G12/00|A61J7/0076|A61M|B32B|B65B|B65D|B65G|B65H|G16H10/60|G16H20/13","","","","This place covers: Payment and identity actuated assembling and dispensing of orders of pharmaceutical articles or products. Only devices similar to vending machines and dispensers are to be classified in  ."
"G07F17/10","for means for safe-keeping of property, left temporarily, e.g. by fastening the property","","","","","","","This place covers: Payment for temporary keeping and locking of objects such as bicycles."
"G07F17/12","comprising lockable containers, e.g. for accepting clothes to be cleaned","","Interlocks, e.g. for locking the doors of compartments other than that to be usedDispensers for articles in compartments in fixed receptaclesDeposit receptacles for parcels","G07F5/26|G07F11/62|A47G29/14","","","","This place covers: Payment actuated facilities or services comprising lockable containers, e.g. accepting clothes to be cleaned."
"G07F17/13","{the containers being a postal pick-up locker}","","Interlocks, e.g. for locking the doors of compartments other than that to be usedDispensers for articles in compartments in fixed receptaclesMail and letter boxes, deposit receptaclesIndividual access control to personal compartments","G07F5/26|G07F11/62|A47G29/00|G07C9/00","","","","This place covers: Payment or identity actuated safe-keeping of property left temporarily for mail delivery in personally accessible lockers or locked compartments."
"G07F17/14","for fastenings for doors  (of containers for safe keeping G07F17/12); for turnstiles","G07F17/12","Interlocks (coin-freed) for locking doors of compartments other than that to be usedIndividual entry or exit control for access to restricted areas","G07F5/26|G07C9/00","","","","This place covers: Payment actuated control only of real doors of accessible rooms and spaces, NOT doors of compartments in a cupboard or dispenser."
"G07F17/16","for devices exhibiting advertisements, announcements, pictures or the like","","Mechanisms and devices for returning box-like containersPayment actuated system or device for printing, stamping, franking, tele-printing apparatus, e.g. delivering content onto blank records Payment actuated processing of accepting of ordersBilling for content delivered in television system","G07F7/069|G07F17/26|G07F17/40|H04N21/2543","","","","This place covers: Payment actuated providing of content such as advertisements, announcements and pictures or video content, e.g. for display. Further also dispensing of on request created content carriers such as DVDs with on request or customized recorded matter, e.g. a payment activated machine for selling/hiring CDs or DVDs."
"G07F17/18","for washing or drying persons","","","","Towels are also classified according to the principle of storage e.g. from a roll ().Towels and articles required for washing and drying anything lese than a living being such as a person or animal, classify in .","G07F11/68|G07F17/20","","This place covers: Payment activated dispensing of any article required for personal hygiene of user or animal, such as cosmetics or towels."
"G07F17/20","for washing or drying articles, e.g. clothes, motor cars","","","","Towels and articles required for washing and drying anything lese than a living being suchAs a person or animal, classify in .","G07F17/18","","This place covers: Payment activated dispensing of any article required for washing or drying of anything else than a living being such human or animal."
"G07F17/24","for parking meters","","Measuring parking time","G07B15/02","","","","This place covers: Payment for use of parking facilities."
"G07F17/26","for printing, stamping, franking, typing or teleprinting apparatus  (ticket printing or the like apparatus G07F17/42)","G07F17/42","Recording of content on carriers, e.g. CDs, DVDs","G07F17/16","","","","This place covers: Paying for (remotely) printed matter such as greeting cards."
"G07F17/32","for games, toys, sports, or amusements","","Sports; Games; AmusementsCard, Board, Roulette Games or Video GamesToysRandom number generators per se","A63|A63F|A63H|G07C15/00","A document concerning a gaming system which provides a financial reward must always be classified in at least one of the groups  -  according to the functional feature(s) it discloses (such a classification needs to be as INVention, not as an ADDitional classification).Furthermore, one or more of the  -  may optionally be assigned as ADDitional classification, depending on the type of game that the document discloses.","G07F17/32|G07F17/3283|G07F17/3286|G07F17/38","","This place covers: Gaming systems, or aspects thereof, which provide a financial reward, such as gambling, (Internet) betting and casino games. These aspects may relate to hardware, software, data processing, payments, security and game play specifics within the field of gaming systems providing financial rewards."
"G07F17/34","depending on the stopping of moving members {in a mechanical slot machine}, e.g. ""fruit"" machines","","Playing without coin collecting meansTraditional board, card or dice games without financial Reward - Video games without providing a financial rewardToysRandom number generators per se","A63|A63F1/00|A63F11/00|A63F13/00|A63H|G07C15/00","A document concerning a mechanical slot machine must always be classified in at least one of the groups  -  according to the functional feature(s) it discloses (such a classification needs to be as INVention, not as an ADDitional classification).Furthermore, one or more of the  -  may optionally be assigned as ADDitional classification, depending on the type of game that the document discloses.","G07F17/32|G07F17/3283|G07F17/3286|G07F17/38","","This place covers: Mechanical slot machines depending on the stopping of moving members, e.g. ""fruit machines""."
"G07F17/40","for devices for accepting orders, advertisements, or the like","","Payment actuated systems and devices for exhibiting content such as advertisements, announcements, pictures and the likePayment actuated system or device for printing, stamping, franking, tele-printing apparatus, e.g. delivering content onto blank recordsPayment actuated access to content providing services, e.g. fax","G07F17/16|G07F17/26|H04N1/34","","","","This place covers: Payment actuated processing of accepted orders, or advertisements."
"G07F17/42","for ticket printing or like apparatus {, e.g. apparatus for dispensing of printed paper tickets or payment cards}","","","","The system for storage and dispensing should be classified if pertinent in .","G07F11/00","","This place covers: Payment activated access to printed matter such as paper tickets and payment cards."
"G07F19/00","Complete banking systems; Coded card-freed arrangements adapted for dispensing or receiving monies or the like and posting such transactions to existing accounts, e.g. automatic teller machines  (data processing equipment for bank accounting G06Q40/02)","G06Q40/02","Mechanisms in general actuated by objects other than coinsProtocols and data processing of paymentsHandling coins or paper currencies apart from coin-freed or like apparatus","G07F7/00|G06Q20/00|G07D","","","","This place covers: Automatic Banking machines (ATM) or complete banking networks."
"G07F19/20","{Automatic teller machines [ATMs]}","","Testing the genuineness of paper currencyHandling of coins or of paper currency","G07D7/00|G07D13/00","","","","This place covers: ATM (Automatic Transaction Machines) and Banking Terminals."
"G07F19/208","{Use of an ATM as a switch or hub}","","Network arrangements or protocols for real-time communications","H04L65/00","","","","This place covers: Use of an ATM as an information hub or switch for the service to be provided or (non-payment related) data to be delivered."
