"cpc_code","title","title_cpc_codes","informative_references","informative_references_cpc_codes","special_rules","special_rules_cpc_codes","glossary_of_terms","definition_statement"
"G09B","EDUCATIONAL OR DEMONSTRATION APPLIANCES; APPLIANCES FOR TEACHING, OR COMMUNICATING WITH, THE BLIND, DEAF OR MUTE; MODELS; PLANETARIA; GLOBES; MAPS; DIAGRAMS  (devices for psychotechnics or for testing reaction times A61B5/16; games, sports, amusements A63; projectors, projector screens G03B)","A61B5/16|A63|G03B","Devices for psychotechnicsTelephone sets with features to facilitate their use, e.g. for blind people , ","A61B5/16|H04M1/247|H04M1/72475","","","",""
"G09B1/00","Manually or mechanically operated educational appliances using elements forming, or bearing, symbols, signs, pictures, or the like which are arranged or adapted to be arranged in one or more particular ways  (puzzle-games A63F9/00; advertising or displaying in general G09F)","A63F9/00|G09F","Games not otherwise privided forBuilding blocks and structures in general","A63F9/00|A63H33/00","","","",""
"G09B3/00","Manually or mechanically operated teaching appliances working with questions and answers  (electrically-operated G09B7/00; {e.g. G09B7/063} advertising or displaying in general G09F)","G09B7/00|G09B7/063|G09F","","","","","",""
"G09B5/00","Electrically-operated educational appliances  (working with questions and answers G09B7/00; simulators G09B9/00; advertising or displaying in general G09F)","G09B7/00|G09B9/00|G09F","","","","","",""
"G09B5/04","with audible presentation of the material to be studied  (reading and recognising printed or written characters G06K9/00; sound recording or reproducing G11B)","G06K9/00|G11B","Methods or arrangements for reading or recognising printed or written characters or for recognising patterns INFORMATION STORAGE BASED ON RELATIVE MOVEMENT BETWEEN RECORD CARRIER AND TRANSDUCER ","G06K9/00|G11B","","","",""
"G09B5/062","{Combinations of audio and printed presentations, e.g. magnetically striped cards, talking books, magnetic tapes with printed texts thereon}","","","","","","",""
"G09B5/08","providing for individual presentation of information to a plurality of student stations","","","","","","",""
"G09B5/10","all student stations being capable of presenting the same information simultaneously  (G09B5/14 takes precedence)","G09B5/14","","","","","",""
"G09B5/14","with provision for individual teacher-student communication","","","","","","",""
"G09B7/00","Electrically-operated teaching apparatus or devices working with questions and answers  (mechanically operated G09B3/00; computing arrangements G06F)","G09B3/00|G06F","ELECTRICAL DIGITAL DATA PROCESSING (computers in which a part of the computation is effected hydraulically or pneumatically ","G06F","","","",""
"G09B7/06","of the multiple-choice answer-type, i.e. where a given question is provided with a series of answers and a choice has to be made from the answers","","","","","","",""
"G09B7/07","providing for individual presentation of questions to a plurality of student stations","","","","","","",""
"G09B9/00","Simulators for teaching or training purposes  (for the use of weapons F41; computing aspects G06; {protocols for networked simulations H04L29/06034})","F41|G06|H04L29/06034","Protocols for networked simulations, virtual reality or games ","H04L29/06034","","","",""
"G09B9/006","{for locating or ranging of objects}","","","","","","",""
"G09B9/02","for teaching control of vehicles or other craft","","","","","","",""
"G09B9/04","for teaching control of land vehicles","","Abstract tuition, procedural aspects, ","G09B19/14|G09B19/16","","","",""
"G09B9/042","providing simulation in a real vehicle  (G09B9/052, G09B9/058 take precedence)","G09B9/052|G09B9/058","","","","","",""
"G09B9/058","for teaching control of cycles or motorcycles","","","","","","",""
"G09B11/00","Teaching hand-writing, shorthand, drawing, or painting","","Music instruments in generalRepresentaion of music","G10|G10G1/00","","","",""
"G09B11/04","Guide sheets or plates; Tracing charts  (templets for drawing purposes B43L13/20)","B43L13/20","Writing or drawing templates","B43L13/20","","","",""
"G09B11/10","Teaching painting","","","","","","",""
"G09B15/00","Teaching music  (metronomes G04F5/02)","G04F5/02"," Metronomes","G04F5/02","","","",""
"G09B15/002","{Electrically operated systems}","","","","","","",""
"G09B15/04","with sound emitters","","","","","","",""
"G09B15/06","Devices for exercising or strengthening fingers or arms; Devices for holding fingers or arms in a proper position for playing  (for teaching typing G09B13/00; exercising apparatus for developing or strengthening the muscles for physical training A63B21/00, A63B23/00)","G09B13/00|A63B21/00|A63B23/00","Exercising apparatus for developing or strengthening the muscles or joints of the body by working against a counterforce, with or without measuring devices Exercising apparatus specially adapted for particular parts of the body","A63B21/00|A63B23/00","","","",""
"G09B17/00","Teaching reading  (teaching lip-reading G09B21/00)","G09B21/00","","","","","",""
"G09B19/00","Teaching not covered by other main groups of this subclass  (teaching or practice apparatus for gun-aiming or gun-laying F41G3/26)","F41G3/26"," Teaching or practice apparatus for gun-aiming or gun-laying","F41G3/26","Instruments or devices which are adequate for teaching purposes but have no particular features aimed at facilitating tuition should be classified in the corresponding fields rather than in ; for example a black board and chalk don't have intrinsic properties that make them fit for teaching, their respective functions are to serve as a writing support and a writing tool.","G09B19/00","",""
"G09B19/0023","{Colour matching, recognition, analysis, mixture or the like}","","","","","","",""
"G09B19/003","{Repetitive work cycles; Sequence of movements}","","","","","","",""
"G09B19/0046","{History}","","","","","","",""
"G09B19/0053","{Computers, e.g. programming}","","","","Learning methods for atificial intelligence models are not to be classified in  or anywhere in . For such methods, see .","G09B19/0053|G09B|G06N3/08","",""
"G09B19/0061","{Geography}","","Maps ","G09B29/00","","","",""
"G09B19/0076","{Body hygiene; Dressing; Knot tying}","","Tooth brushes , ","A46B15/0002|A47K1/09","","","",""
"G09B19/02","Counting; Calculating  (abacus G06C1/00)","G06C1/00","","","","","",""
"G09B19/06","Foreign languages  (with audible presentation of material to be studied G09B5/04)","G09B5/04","Processing or translation of natural Speech recognition","G06F40/40|G10L","","","",""
"G09B19/10","Modelling","","","","","","",""
"G09B19/16","Control of vehicles or other craft  (simulators G09B9/02)","G09B9/02","","","","","",""
"G09B21/00","Teaching, or communicating with, the blind, deaf or mute  (audible presentation of material to be studied G09B5/04; devices or methods for replacing direct visual or auditory perception by another kind of perception A61F9/08, A61F11/04; audible indication of meter readings or of colour G01D7/12; watches for blind persons G04B25/02; methods or arrangements for reading or recognising printed or written characters G06K9/00; speech analysis, speech recognition G10L; sound-recording or reproducing, per se G11B)","G09B5/04|A61F9/08|A61F11/04|G01D7/12|G04B25/02|G06K9/00|G10L|G11B","Devices or methods enabling eye-patients to replace direct visual perception by another kind of perceptionDevices or methods enabling ear patients to replace direct auditory perception by another kind of perceptionAudible indication of meter readings, e.g. for the blindby feeling; Clocks or watches for blind personsInput means with feedback to humand bodyMethods or arrangements for reading or recognising printed or written characters or for recognising patterns, e.g. fingerprints SPEECH ANALYSIS OR SYNTHESIS; SPEECH RECOGNITION; SPEECH OR VOICE PROCESSING; SPEECH OR AUDIO CODING OR DECODING INFORMATION STORAGE BASED ON RELATIVE MOVEMENT BETWEEN RECORD CARRIER AND TRANSDUCER","A61F9/08|A61F11/04|G01D7/12|G04B25/02|G06F3/00|G06K9/00|G10L|G11B","","","",""
"G09B21/001","{Teaching or communicating with blind persons  (G09B21/02 - G09B21/06 take precedence)}","G09B21/02|G09B21/06","Walking canes for the blindSonars - locating systems for the blind","A61H3/06|G01S15/00","","","",""
"G09B21/003","{using tactile presentation of the information, e.g. Braille displays}","","Tactile clocks or watches for use by the blindTactile signalling systems","G04B25/02|G08B6/00","","","",""
"G09B21/006","{using audible presentation of the information}","","Audible indications of meter or colour readings","G01D7/12","","","",""
"G09B21/009","{Teaching or communicating with deaf persons  (G09B21/04 takes precedence; deaf and dumb persons G09B21/00)}","G09B21/04|G09B21/00","","","","","",""
"G09B23/00","Models for scientific, medical, or mathematical purposes, e.g. full-sized devices for demonstration purposes  (in the nature of toys A63H)","A63H","MERRY-GO-ROUNDS; SWINGS; ROCKING-HORSES; CHUTES; SWITCHBACKS; SIMILAR DEVICES FOR PUBLIC AMUSEMENT ","A63G","","","",""
"G09B23/186","{for digital electronics; for computers, e.g. microprocessors}","","","","","","",""
"G09B23/28","for medicine","","Healthcare informatics ","G16H","","","Phantomhuman model used in medical simulations",""
"G09B23/283","{for dentistry or oral hygiene  (G09B23/286 takes precedence)}","G09B23/286","","","","","",""
"G09B23/285","{for injections, endoscopy, bronchoscopy, sigmoidscopy, insertion of contraceptive devices or enemas}","","","","","","",""
"G09B23/288","{for artificial respiration or heart massage}","","","","","","CPRcardiopulmonary ressuscitation",""
"G09B23/30","Anatomical models {(G09B23/281 - G09B23/288 take precedence)}","G09B23/281|G09B23/288","Talking dolls ","A63H3/28","","","",""
"G09B25/00","Models for purposes not provided for in G09B23/00, e.g. full-sized devices for demonstration purposes  (model vehicles, tracks therefor, models in the nature of toys A63H)","G09B23/00|A63H","Toys, e.g. TOPS, DOLLS, HOOPS, BUILDING BLOCKS","A63H","","","",""
"G09B25/02","of industrial processes; of machinery","","","","","","",""
"G09B25/04","of buildings","","","","","","",""
"G09B29/00","Maps; Plans; Charts; Diagrams, e.g. route diagram  (star maps G09B27/04; devices for holding or supporting maps A47B97/02; for computing purposes G06G1/14, G09B1/16; display boards G09F)","G09B27/04|A47B97/02|G06G1/14|G09B1/16|G09F","Devices for holding or supporting maps, drawings, or the like, including means for preventing rolling-upin which a straight or curved line has to be drawn from given points on one or more input scales to one or more points on a result scale","A47B97/02|G06G1/14","","","",""
"G09B29/001","{Planning boards}","","Map printing process","B41M3/02","","","",""
"G09B29/10","Map spot or coordinate position indicators; Map reading aids  (optical projection apparatus per se G03B)","G03B","Navigation; Navigational instruments not provided for in preceding groups","G01C21/00","","","Map spot indicatorsdevice or system which highlights the position(s) of points of interest",""
