"cpc_code","title","title_cpc_codes","informative_references","informative_references_cpc_codes","special_rules","special_rules_cpc_codes","glossary_of_terms","definition_statement"
"G09G3/32","semiconductive, e.g. using light-emitting diodes [LED]","","Control of displays using electroluminescent display elements, which are semiconductor devices, e.g. diodes or transistors, for displaying a character composed by a fixed number of display elements as segments or dots","G09G3/14","","","","This place covers: Control of displays using electroluminescent display elements, which are semiconductor devices, e.g. diodes or transistors, arranged in a matrix without details of the semiconductive material. Control of displays using electroluminescent display elements, which are semiconductor devices, e.g. diodes or transistors, arranged in a matrix, wherein the semiconductive material is inorganic."
"G09G3/3208","organic, e.g. using organic light-emitting diodes [OLED]","","Control of displays using electroluminescent display elements, which are semiconductor devices, e.g. diodes or transistors, for displaying a character composed by a fixed number of display elements as segments or dotsDetails of the drive circuits for applying the scan signals to the scan electrodes of an organic electroluminescent matrix displayDetails of the drive circuits for applying the data signals to the data electrodes of an organic electroluminescent matrix display","G09G3/14|G09G3/3266|G09G3/3275","This code is to be given only if no details of the control of the display elements are specified, otherwise the codes of  for a passive matrix, or within  for an active matrix apply.","G09G3/3216|G09G3/3225","","This place covers: Control of displays using organic electroluminescent display elements, which are semiconductor devices, e.g. diodes or transistors, arranged in a matrix, wherein the semiconductive material is organic."
"G09G3/3216","using a passive matrix","","Details of the drive circuits for applying the scan signals to the scan electrodes of an organic electroluminescent matrix displayDetails of the drive circuits for applying the data signals to the data electrodes of an organic electroluminescent matrix display","G09G3/3266|G09G3/3275","","","","This place covers: Control of displays using organic electroluminescent display elements arranged in a matrix, wherein each display element is located at the intersection of a scan and a data electrode, and directly controlled by the scan and data signal supplied to the scan and data electrode, respectively, i.e. without an active element such as a diode (other than the light-emitting one), or a transistor at the intersection being involved. The figure below is an example of a passive matrix. In the figure, passive matrix is characterized as having a line driving method which lights all light-emitting devices of the line at once, and a matrix is a 2-dimensional arrangement, comprising cathode and anode strips. The figure below is an example of selective application of a current to the anodes of OLED display elements as data signal via data electrodes Ak while a voltage is supplied to the cathodes of the display elements as scan signal via scan electrodes."
"G09G3/3225","using an active matrix","","Details of the drive circuits for applying the scan signals to the scan electrodes of an organic electroluminescent matrix displayDetails of the drive circuits for applying the data signals to the data electrodes of an organic electroluminescent matrix display","G09G3/3266|G09G3/3275","","","","This place covers: Control of displays using organic electroluminescent display elements arranged in a matrix, wherein each display element is located together with an active element such as a transistor or a diode, other than the light-emitting one, at the intersection of a scan electrode and a data electrode. The active element has to be enabled by the application of a scan signal to the scan electrode so that the display element receives the data signal. The figure below is an example of an active-matrix. In the figure, active-matrix is an individual driving method where light-emitting devices are turned on by each film transistor (TFT), and a matrix is an arrangement of light-emitting devices or TFTs or their combinations."
"G09G3/3233","with pixel circuitry controlling the current through the light-emitting element","","Details of the drive circuits for applying the scan signals to the scan electrodes of an organic electroluminescent matrix displayDetails of the drive circuits for applying the data signals to the data electrodes of an organic electroluminescent matrix display","G09G3/3266|G09G3/3275","","","","This place covers: Control of displays using organic electroluminescent display elements arranged in a matrix together with active elements, wherein each active element enables a driving current flowing through a display element corresponding to a data signal supplied to a data electrode. The corresponding active element must concurrently be selected by a scan signal supplied to its scan electrode. The figure below is an example of data voltage signal supplied to the data line (14), which controls the driving current flowing through the organic electroluminescent display element."
"G09G3/3241","the current through the light-emitting element being set using a data current provided by the data driver, e.g. by using a two-transistor current mirror","","","","","","","This place covers: Control of displays using organic electroluminescent display elements arranged in a matrix together with active elements, wherein each active element enables a driving current flowing through a display element corresponding to a data current supplied to a data electrode, which is supplied when the active element is activated by a scan signal supplied to a scan electrode, e.g. by a current mirror having the data current flowing through the data electrode as an input current, and the driving current flowing through the display element as an output current. The figure below is an example of data current signal supplied to the data line DL and flowing through the input part PM2 of a current mirror circuit, which controls the driving current flowing through the output part PM1 of the current mirror circuit and the organic electroluminescent display element)"
"G09G3/325","the data current flowing through the driving transistor during a setting phase, e.g. by using a switch for connecting the driving transistor to the data driver","","","","","","","This place covers: Control of displays using organic electroluminescent display elements arranged in a matrix together with active elements, wherein each active element enables a driving current flowing through a display element corresponding to a data current flowing through a data electrode and through a driving transistor, but not through the display element connected in series with the driving transistor, during a first period when the active element is activated by a scan signal supplied to a scan electrode, and with the driving current flowing through the driving transistor and the display element during a second period when the scan signal is not supplied to the scan electrode, e.g. by a first switch connecting the driving transistor to the data electrode during the first period, and a second switch connecting the driving transistor to the display element during the second period. The figure below is an example where the data current signal Idat is applied to the data line and flows only through the driving transistor T2 during the scan period (T1 and T3 ON, T4 OFF), and through the driving transistor and the organic electroluminescent display element after the scan period (T1 and T3 OFF, T4 ON)."
"G09G3/3258","with pixel circuitry controlling the voltage across the light-emitting element","","","","","","","This place covers: Control of displays using organic electroluminescent display elements arranged in a matrix together with active elements, wherein each active element enables the application of a voltage across a display element corresponding to a data signal supplied to a data electrode. The corresponding active element must concurrently be selected by a scan signal supplied to a scan electrode. The figure below is an example where the application of a scan signal on a line, 7-j (1<=j<=m), enables the transistors of pixels belonging to that line. The light-emitting diodes of the line can then receive data by supplying a data signal on column 6-k (1<=k<=n)."
"G09G3/3266","Details of drivers for scan electrodes","","","","","","","This place covers: Details of a drive circuit for supplying scan signals to scan electrodes of an organic electroluminescent matrix display."
"G09G3/3275","Details of drivers for data electrodes","","","","","","","This place covers: Details of a drive circuit for supplying data signals to data electrodes of an organic electroluminescent matrix display."
"G09G3/3283","in which the data driver supplies a variable data current for setting the current through, or the voltage across, the light-emitting elements","","","","","","","This place covers: Details of a drive circuit for supplying data signals to data electrodes of an organic electroluminescent matrix display, the data signals being in the form of a variable data current value according to the data to be displayed."
"G09G3/3291","in which the data driver supplies a variable data voltage for setting the current through, or the voltage across, the light-emitting elements","","","","","","","This place covers: Details of a drive circuit for supplying data signals to data electrodes of an organic electroluminescent matrix display, the data signals being in the form of variable data voltage value according to the data to be displayed."
"G09G3/34","by control of light from an independent source","","Indicating arrangements for variable information in which the information is built-up on a support by selection or combination of individual elementsCharacterised by the form or geometrical disposition of the individual elements, i.e. of the multi- segment-display Being the ends of optical fibresBeing LCDsBeing movable elements","G09F9/30|G09F9/302|G09F9/305|G09F9/35|G09F9/37","","","","This place covers: Passive displays reflecting or modulating the incident light. Displays comprising a passive and an active panel."
"G09G3/3406","{Control of illumination source  (illumination devices structurally associated with liquid crystal cells G02F1/1336)}","G02F1/1336","Light sources using semiconductor devices as light-generating elements, e.g. using light-emitting diodes [LED] or lasersLight guides specially adapted for lighting devices or systems.Constructional details of illuminating devices.Inverters for backlight units: conversion of DC power input into DC power output.Inverters for backlight units: conversion of AC power input into DC power output.Constructional details of illumination within telephone sets.Projection devices for colour picture display in colour television systems using light modulating optical valves.Control of light sources in general (i.e., not specifically related to a display device)., ","F21K9/00|G02B6/0001|G02F1/13357|H02M3/00|H02M7/00|H04M1/22|H04N9/31|H05B44/00|H05B47/00","Further detail is covered by the Indexing Code symbols listed below. Classification is obligatory.Field sequential colour displays: Scrolling of the light from the illumination source while scanning the screen: Adjustment of display parameters: The adjustment depending on the type of the information to be displayed: Adjustment of illumination source parameters: For control of overall brightness: By amplitude modulation of the brightness of the illumination source: By time modulation of the brightness of the illumination source: Modulation of brightness of the illumination source and modulation of image signal correlated to each other: Detecting light within display devices, e.g. using a single or a plurality of photosensors: The light being ambient light: The light originating from the display screen: Calculation or use of calculated indices related to luminance levels in display data: Illustrative examples:EP0319293 (Standard field sequential display without specific details)US4907862US2001008394 (Two illumination sources without corresponding display areas)","G09G2310/0235|G09G2310/024|G09G2320/06|G09G2320/0613|G09G2320/062|G09G2320/0626|G09G2320/0633|G09G2320/064|G09G2320/0646|G09G2360/14|G09G2360/144|G09G2360/145|G09G2360/16","","This place covers: Control of the independent light source illumination the matrix display (front and backlight). Standard field sequential colour displays without specific details. One or more separately controlled illumination source, without correspondence to different display areas."
"G09G3/3413","{Details of control of colour illumination sources}","","","","Further detail is covered by the Indexing Code symbols listed below. Classification is obligatory.To indicate details of the colour setup of elements in an array of light emitting elements forming the illumination source: Example:US2004246275 (Filed sequential display with specific details)US6608614 (Automatic adjustment of colour parameters)","G09G2300/0452","","This place covers: Control of backlight arrangements with more than one colour. Specific details of control of sequential colour displays."
"G09G3/342","{using several illumination sources separately controlled corresponding to different display panel areas, e.g. along one dimension such as lines}","","","","","","","This place covers: Documents disclosing horizontal stripes or rows of pixel, each lit by a separate illumination source, each illumination source being independently controlled from the other illumination sources. Illustrative examples: US2002000960 (Backlight with scanning of illumination source) WO2005093703 (Backlight without scanning of illumination source) US6563271 (Backlight having separate light sources for different panel regions)"
"G09G3/3426","{the different display panel areas being distributed in two dimensions, e.g. matrix}","","","","","","","This place covers: Documents disclosing a backlight unit usually comprising a matrix of pixel blocks or single pixels which are each lit by an separate illumination source, each illumination source being independently controlled from the other illumination sources. Illustrative examples: EP1380876 (Backlight unit with scanning of illumination sources) US2001028335 (Backlight unit without scanning of illumination source, with S09206/02 Indexing Code) EP1496497 (Display comprising stacked panels, with S09206/02 Indexing Code)"
"G09G3/3433","{using light modulating elements actuated by an electric field and being other than liquid crystal devices and electrochromic devices  (using liquid crystal devices G09G3/36; using electrochromic devices G09G3/38)}","G09G3/36|G09G3/38","Control arrangements for presentation of an assembly of a number of characters, e.g. a page, by composing the assembly by combination of individual elements arranged in a matrix, by control of light from an independent source, using liquid crystals Control arrangements for presentation of an assembly of a number of characters, e.g. a page, by composing the assembly by combination of individual elements arranged in a matrix, by control of light from an independent source, using electrochromic devices ","G09G3/36|G09G3/38","","","",""
"G09G3/344","{based on particles moving in a fluid or in a gas, e.g. electrophoretic devices  (electrophoretic devices per se G02F1/167)}","G02F1/167","","","","","","This place covers: Control of display devices wherein the visual effect is obtained by controlling the displacement of microparticles in fluid or gas."
"G09G3/3446","{with more than two electrodes controlling the modulating element}","","","","","","","This place covers: Documents in which the displacement of the microparticles is obtained with a cell electrode structure comprising more than two electrodes. Illustrative example: US5223115 (Item 26: cathode, item 18: anode, item 28: grid)"
"G09G3/3453","{based on rotating particles or microelements}","","Optical devices or arrangements using movable or deformable optical elements for controlling the intensity, colour, phase, polarisation or direction of light (e.g. switching, gating, modulating) For controlling the intensity of light based on the rotation of particles under the influence of an external field.Macro displays","G02B26/00|G02B26/026|G09F9/37","Illustrative example of subject matter classified in this group:US2006214880","","E-PaperElectric(al) or electronic (reusable) paper ","This place covers: Control of display devices with rotating elements (""particles"") that are encapsulated and suspended in a fluid and controlled by electrostatic operation. Also control of displays wherein each pixel contains a plurality of ""particles"" (e.g. ""Gyricon®"" from Xerox)."
"G09G3/346","{based on modulation of the reflection angle, e.g. micromirrors  (micromirrors devices per se G02B26/0833)}","G02B26/0833","Micromechanical (e.g. MEMS) devices comprising elements which are flexible, deformable or movable (e.g. slidable or rotatable) in relation to each other Piezo-electric, electrostrictive or magnetostrictive elements per se ","B81B3/00|H01L41/00","Illustrative examples of subject matter classified in this group:US5214419","","MEMSMicroelectromechanical systemNEMSNanoelectromechanical systemDMDDeformable Mirror device - Digital mirror deviceDMMDigital micromirrorsDLPDigital light processing","This place covers: Electrostatically controlled micromirrors. Rocking DMD. Bending reflective ""tongues"")."
"G09G3/3466","{based on interferometric effect}","","Devices or arrangements using multiple reflections in spectrometry or monochromators (Fabry-Perot interferometers)Interference filtersOptical modulators based on interference in an adjustable optical cavity ","G01J3/26|G02B5/28|G02B26/001","Illustrative examples of subject matter classified in this group:EP1473581US2002054424","","","This place covers: Control of electrically switched displays composed of miniature interferometers (etalons) that are switched on and off with microelectromechanical systems. An etalon reflects light at a specific wavelength and gives pure, bright colours while consuming no power."
"G09G3/3473","{based on light coupled out of a light guide, e.g. due to scattering, by contracting the light guide with external means}","","","","","","","This place covers: Illustrative example of subject matter classified in this group: WO9731288"
"G09G3/3486","{using light modulating elements actuated by a magnetic field}","","","","","","","This place covers: Movable elements controlled electromagnetically (also: magnetostrictive effect used in ""foil"" display). Illustrative example: DE2133121"
"G09G3/3493","{using light modulating elements actuated by a piezoelectric effect}","","","","","","","This place covers: Illustrative example of subject matter classified in this group: EP1369844 (Piezoelectric actuator in combination with scattering of light from a waveguide. In this case the document was allocated both   and   symbols)"
"G09G3/36","using liquid crystals","","Chemical composition of LCD Constructional arrangements; Operation of LCD; (arrangements or circuits for control of liquid crystal elements in a segment display or a matrix )","C09K19/00|G02F1/13","","","","This place covers: Control of discrete pixel electrodes on one substrate without row and column selection. Control of a plurality of display modules combined to result in a bigger matrix. Address matrix for selecting a row or column. Specific circuits for crosstalk compensation (e.g. with extra electrode carrying an additional signal). Circuit for temperature compensation in LC displays. Control of stacked LC panels."
"G09G3/3603","{with thermally addressed liquid crystals}","","Multi colour thermographyLiquid crystal cells exhibiting a thermo-optical effect","B41M5/34|G02F1/132","","","",""
"G09G3/3607","{for displaying colours or for displaying grey scales with a specific pixel layout, e.g. using sub-pixels  (display of colours in flat matrix panels other than liquid crystal displays G09G3/2003; grey scales specific for television H04N3/127)}","G09G3/2003|H04N3/127","","","","","","This place covers: Control of subpixels in liquid crystal displays."
"G09G3/3611","{Control of matrices with row and column drivers}","","","","","","","This place covers: Control of liquid crystal displays wherein the type of matrix (active, passive) is not defined. Addressing of liquid crystal matrices in general (e.g. without specifying waveforms, information transfer computer ==> memory ==> panel, driver circuits). Control of a liquid crystal panel by computer signals or composite signals. Overview articles. Timing circuits. Black on white of white on black displays. Illustrative examples: US2005174456 (Interface from external camera or host to a LCD, wherein the display data are stored in the display driver. The display controller communicates with the display unit sending RGB-data and the LCD-clock. Because no hsync / vsync are transmitted, this interface does not form a monitor_architecture) FR2808113 (Details of wiring between drivers and rows and columns)"
"G09G3/3614","{Control of polarity reversal in general}","","Control of polarity inversion for display devices other than LCD devices","S09213/07","","","","This place covers: Specific control circuits for polarity inversion in LCD display devices. Inversion sequences (row-, column-, field-, dot-inversion)."
"G09G3/3622","{using a passive matrix  (G09G3/3674 - G09G3/3696 take precedence)}","G09G3/3674|G09G3/3696","","","","","","This place covers: Control of passive matrix devices. Passive matrix means that there are no active elements (transistor, diode, MIM, ...) in the display cell at the crosspoint of a row and column."
"G09G3/3625","{using active addressing}","","","","Documents classified in  shall not receive an Indexing Code for active addressing ( ).Illustrative example:Order 32 Walsh functions. These kinds of functions serve as the voltage settings for the row lines in active addressing.","G09G3/3625|G09G2310/0208","","This place covers: In traditional multiplexing, the rows are addressed in sequence and only one at a time. The voltages set on the columns correspond to the pixel values in the row being addressed. This scheme leads to very low voltage selection ratios and, consequently, low contrast. In the Active Adressing scheme, several rows are addressed simultaneously in different patterns corresponding to orthogonal functions. A set of functions is orthogonal over a certain interval if the integral of the product of any two of the functions is 0 if the functions are different, and a constant if they are the same function. From signal processing theory, we can represent a given signal as a sum of differing amounts of these orthogonal functions. If we suppose the signal we wish to represent is the sequence of pixel values in a particular column of a display, then we can create that signal by applying the correct orthogonal functions to the row lines and certain voltages on the column line that correspond to the amounts of those functions we want. If we use the same functions to represent the signals in the other columns, then we can create a whole display by applying the correct voltages to all of the column lines in parallel."
"G09G3/3629","{using liquid crystals having memory effects, e.g. ferroelectric liquid crystals}","","Details of waveforms for flat panelsPartial updatingChemical composition of ferroelectric liquid crystals Physics and structure of LCDs","G09G2230/00|G09G2310/04|C09K19/42|G02F","","","","This place covers: Control of: ferroelectric LCDs, i.e. LCs having a polarization vector, that causes an inherent memory effect, shown in a single memory loop in the transmission/voltage characteristic has, such as chiral smectic LCs. Nematic LCDs (chiral nematic) where two metastable states are obtained by others means. LCDs using a ""type"" transition to obtain memory effects (nematic - cholesteric)."
"G09G3/3633","{with transmission/voltage characteristic comprising multiple loops, e.g. antiferroelectric liquid crystals}","","","","","","","This place covers: Control of: Antiferroelectric LCDs having two antiferroelectric states for positive and negative pixel voltages and a ferroelectric state without pixel voltage, both with symmetric or asymmetric loops, where memory effects are desired and used. Short pitch ferroelectric LCDs [SBF LCDs] where the helix pitch is shorter than the pixel cell thickness."
"G09G3/3637","{with intermediate tones displayed by domain size control  (domain size control in flat matrix panels other than liquid crystal displays having memory effects G09G3/207)}","G09G3/207","Domain size control in flat matrix panels other than liquid crystal displays having memory effects","G09G3/207","","","","This place covers: Control of LCDs having memory effect (e.g. ferroelectric) where gradation is obtained by varying the extension of the pixel area where switching from one memory state (e.g. ferroelectric state) to the other takes place, e.g. by. Arranging the electrodes such to vary the applied voltage across the pixel, so that a gradient in the LC electric field is obtained. Varying the thickness of the LC cell across the pixel. Simply using unevenness in the LC cell structure."
