"cpc_code","title","title_cpc_codes","informative_references","informative_references_cpc_codes","special_rules","special_rules_cpc_codes","glossary_of_terms","definition_statement"
"G09G3/001","{using specific devices not provided for in groups G09G3/02 - G09G3/36, e.g. using an intermediate record carrier such as a film slide; Projection systems; Display of non-alphanumerical information, solely or in combination with alphanumerical information, e.g. digital display on projected diapositive as background  (slide projectors per se G03B23/00 = 42 HP)}","G09G3/02|G09G3/36|G03B23/00","Circuits for displaying split screens (including CRTs with divided screens)Projection display for cars (e.g. HUDs), Light guides specially adapted for lighting devices or systemsMountings, adjusting means, or light-tight connections, for optical elements adapted for automatic focusing or varying magnificationSystems for automatic generation of focusing signals including a sight line detecting deviceHead mounted displaysHead mounted displays characterised by optical featuresHead mounted displays characterised by mechanical featuresOther optical systems for producing stereoscopic or other 3D effectsStereoscopic and volumetric TV display, Other optical systems for producing stereoscopic or other 3D effects, the image being built up from image elements distributed over a 3D volumeOther optical systems for producing stereoscopic or other 3D effects, the volume being constructed from a stack or sequence of 2D planesSlide projectors per seDisplaying, advertising, signs, labels or name-plates, sealsMobile visual advertisingScanning details of television systems by switched stationary formation of lamps, photocells or light relays (e.g. optical fibers)Projectors for colour picture display","G09G1/007|B60K37/00|G02B27/00|G02B6/0001|G02B7/09|G02B7/287|G02B27/017|G02B27/0172|G02B27/0176|G02B30/00|G02B30/00|H04N13/00|G02B30/00|G02B30/52|G03B23/00|G09F|G09F9/21|H04N3/12|H04N9/31","Illustrative examples of subject matter:WO9914730 (display device with rotating display elements)US4573048 (High speed link for rotating display)US6877864 (projector with image modified to compensate distortions from projecting onto a screen from a side, so called ""Keystone correction"")EP1528528 (projector with plurality of LCD panels).By orienting the pixel arrays of the light modulators at different non-orthogonal angles, gaps between adjacent pixels of the panels are not aligned. As such, the ""screen door"" effect caused, for example, by gaps between adjacent pixels of the pixel arrays is reduced. In addition, misalignment between the pixel arrays is less noticeable.Therefore, the driving circuit calculates modified images for at least one not aligned LCD.EP1816638 (Coloured display which displays two different images depending onto the viewing direction)US6175354 (Image display apparatus)EP0546844 (Baton using light emitting cell array to form a display)EP0887783 (Rotating drum or blade with linear array of light sources)","","","This place covers: Using an intermediate record carrier such as a film slide. Control of projection systems or displays. Display of non-alphanumerical information, solely or in combination with alphanumerical information, e.g. digital display on projected diapositive as background. Control of rotating or moving display (Roled): one or more (usually linear) arrays of light emitting elements are rotated or moved to display an image on a virtual screen created on the surface of revolution or movement. Control of stereoscopic computer displays. Control of multiple view displays, i.e. displays producing e.g. two images which are visible under different viewing angles."
"G09G3/004","{to give the appearance of moving signs}","","","","","","","This place covers: Display devices wherein, different from a standard panel: the displayed image has a higher resolution than the display device itself; and at any time, only part of the complete image is displayed. Illustrative example: EP0709818"
"G09G3/006","{Electronic inspection or testing of displays and display drivers, e.g. of LED or LCD displays  (testing individual LED's G01R31/2635; testing lamps G01R31/44; testing of optical features of LCD displays G02F1/1309)}","G01R31/2635|G01R31/44|G02F1/1309","Investigating or analysing materials by the use of optical means, i.e. using infra-red, visible, or ultra-violet light; etc. Inspecting patterns on the surface of objects.Testing of electronic circuitsDiagnosis, testing or measuring for television systems or their details","G01N21/956|G01R31/282|H04N17/00","Does not apply to testing during manufacturing of non-finished flat panel displays, when the result of the testing are used to determine parameters of the subsequent manufacturing steps (such testing is regarded as a step of manufacturing).Also, does not apply if the testing/inspecting is carried out by optical means (e.g. optical measurements), which is classified in . In some ""mixed"" or doubtful cases classifications in both  and  may be given.Does not apply to mere calibration of display devices, i.e. to the setting of control parameters for properly functioning displays based on detection of operation parameters (e.g. detection of colour, luminance etc), for which Indexing Code  applies.","G01R|G09G3/006|G01R|G09G2320/0693","","This place covers: Testing or inspecting flat panel displays by electrical means, i.e. by checking electrical signals and parameters while driving the panel, possibly under special driving conditions specific for the test."
"G09G3/02","by tracing or scanning a light beam on a screen","","","","","","","This place covers: Control of displays using a deflected and modulated light beam for directly producing the displayed image on the screen. Control of displays using deflected and modulated light beams, which are generated by a linear array, for directly producing the displayed image on the screen. Control of displays using a deflected and modulated light beam to control an array of photosensitive elements that receive it and consequently command each a pixel display element. Control of displays using a deflected and modulated light beam for optically writing image data on a photosensitive surface that commands a display such as a light modulator. Control of stereoscopic displays. Control of multiple view displays, i.e. displays producing e.g. two images which are visible under different viewing angles. Illustrative examples: US3739370 (deflected light beam producing the displayed image on the screen) US4097115 (Control of optical scanning device for producing a multiple line scan using a linear array of sources and a textured scanned surface) US2006132452 (control of a display using a deflected and modulated light beam to control an array of photosensitive elements that receive it and consequently command each a pixel display element) US5463468 (control of a display usinga deflected and modulated light beam for optically writing image data on a photosensitive surface that commands a display such as a light modulator)"
"G09G3/04","for presentation of a single character by selection from a plurality of characters, or by composing the character by combination of individual elements, e.g. segments {using a combination of such display devices for composing words, rows or the like, in a frame with fixed character positions}","","Control of displays having display elements arranged in a matrix","G09G3/20","","","","This place covers: Control of displays for displaying a character composed by a fixed number of display elements as segments or dots, i.e. the character position within the display device is fixed, and the specific character composition by combination of individual display elements to be displayed is selected from a plurality of predefined character compositions without specifying a display technology or with details of two or more display technology, but aspects of general character for various, if not all display technologies. Control of displays for displaying a character by selection from a plurality of complete characters."
"G09G3/045","{Selecting complete characters}","","","","","","","This place covers: Control of displays for displaying a character by selection from a plurality of complete characters. Illustrative examples: US3218625 (control of a display wheel for converting binary code to display position) US3200396 (control of a display using fused characters"
"G09G3/06","using controlled light sources","","Control of displays using controlled light sources as display elements arranged in a matrix","G09G3/22","In this group, documents concerning the control of character displays using controlled light sources not covered by any of the groups  -  are classified, e.g. the control of vacuum fluorescent character displays.","G09G3/08|G09G3/14","","This place covers: Control of displays using controlled light sources for displaying a character composed by a fixed number of display elements as segments or dots."
"G09G3/08","using incandescent filaments","","Control of displays using incandescent filaments, i.e. incandescent light bulbs, as display elements arranged in a matrix","G09G3/24","","","","This place covers: Control of displays using incandescent filaments, i.e. incandescent light bulbs, for displaying a character composed by a fixed number of display elements as segments or dots."
"G09G3/10","using gas tubes","","Control of displays using luminous gas-discharge cells, e.g. luminous plasma discharge cells, as display elements arranged in a matrix","G09G3/28","","","","This place covers: Control of displays using gas tubes, e.g. luminous plasma discharge cells, for displaying a character composed by a fixed number of display elements as segments or dots."
"G09G3/12","using electroluminescent elements","","Control of displays using cathode-ray tubes with phosphor screensControl of displays using electroluminescent display elements arranged in a matrix","G09G1/00|G09G3/30","","","","This place covers: Control of displays using electroluminescent display elements for displaying a character composed by a fixed number of display elements as segments or dots."
"G09G3/14","Semiconductor devices, e.g. diodes","","Control of displays using electroluminescent display elements, which are semiconductor devices, e.g. diodes or transistors, arranged in a matrixControl of displays using organic electroluminescent display elements, which are semiconductor devices, e.g. diodes or transistors, arranged in a matrix","G09G3/32|G09G3/3208","","","","This place covers: Control of displays using electroluminescent display elements, which are semiconductor devices, e.g. diodes or transistors, for displaying a character composed by a fixed number of display elements as segments or dots."
"G09G3/16","by control of light from an independent source","","Control of displays using display elements arranged in a matrix, which do not emit light, but selectively control the transmission, reflection, or absorption of light from an independent light sourceControl of an independent light source used in displays using display elements arranged in a matrix, which selectively control the light from the independent source","G09G3/34|G09G3/3406","In this group, documents concerning the control of character displays not covered by the groups  or  are classified, e.g. the control of electrophoretic character displays.","G09G3/18|G09G3/19","","This place covers: Control of displays using display elements, which do not emit light, but selectively control the light from an independent light source by transmission, reflection, or absorption of, for displaying a character composed by a fixed number of display elements as segments or dots Control of an independent light source used in displays using display elements, which selectively control the light from the independent source, for displaying a character composed by a fixed number of display elements as segments or dots"
"G09G3/18","using liquid crystals","","Control of displays using liquid crystal display elements arranged in a matrix","G09G3/36","","","","This place covers: Control of displays using liquid crystal display elements for displaying a character composed by a fixed number of display elements as segments or dots."
"G09G3/19","using electrochromic devices","","Control of displays using electrochromic display elements arranged in a matrix","G09G3/38","","","","This place covers: Control of displays using electrochromic display elements for displaying a character composed by a fixed number of display elements as segments or dots."
"G09G3/20","for presentation of an assembly of a number of characters, e.g. a page, by composing the assembly by combination of individual elements arranged in a matrix {no fixed position being assigned to or needed to be assigned to the individual characters or partial characters}","","Electronic inspection or testing of displays and display driversControl arrangements or circuits for presentation of a single character by selection from a plurality of characters, or by composing the character by combination of individual elements, e.g. segments","G09G3/006|G09G3/04","For control arrangements or circuits with details concerning the control of intermediate tones of elements arranged in a matrix, a code within  is to be given, and with details concerning the colour,  is to be given. For control arrangements or circuits for elements arranged in a matrix with details of one specific display technology, a code corresponding to the specific display technology is to be given, e.g.  for using electrochromic elements.","G09G3/2007|G09G3/2003|G09G3/38","","This place covers: Control of displays having display elements arranged in a matrix with details of two or more display technology, but aspects of general character for various, if not all display technologies. Control of displays having display elements arranged in a matrix without specifying a display technology."
"G09G3/2003","{Display of colours  (specific for liquid crystal displays G09G3/3607)}","G09G3/3607","Control of a display for displaying a coloured image in general","G09G5/02","","","","This place covers: Control of a display to display a coloured image with aspects specific for flat panel displays."
"G09G3/2007","{Display of intermediate tones}","","","","Does not apply to a control of the brightness of a display as a whole, for which the Indexing Code  should be given.","G09G2320/0626","","This place covers: Control of a display to display an image having intermediate tones with aspects specific for flat panel displays."
"G09G3/2011","{by amplitude modulation}","","","","This code is only given if specific details of the amplitude modulation are present or the amplitude modulation plays a significant role, but not for indicating the presence of a usual amplitude modulation in a document.","","","This place covers: Control of a display to display an image having intermediate tones by modulating the amplitude of the analog signals applied to the display elements."
"G09G3/2014","{by modulation of the duration of a single pulse during which the logic level remains constant}","","","","","","","This place covers: Control of a display to display an image having intermediate tones by modulating the duration of a single pulse applied to the display element or by modulating the duration of several pulses applied to the display element in the same manner. Illustrative examples: US2003/0117420 (modulation of the intermediate tone displayed by a pixel by varying the width applied to a data electrode during a scan period determined by the scan signal applied to the scan electrode)"
"G09G3/2018","{by time modulation using two or more time intervals}","","","","","","","This place covers: Control of a display to display an image having intermediate tones by frame rate control or temporal dithering, i.e. the intermediate tone is generated by selectively activating a display element in a number of frames. Control of a display to display an image having intermediate tones by modulating the duration of several pulses applied to the display element in a different manner for each pulse."
"G09G3/2022","{using sub-frames}","","","","For plasma display panels, this code is only to be given if specific details of the generation of intermediate tones using sub-frames are present or the generation of intermediate tones using sub-frames plays a significant role, but not for indicating the presence of a usual generation of intermediate tones using sub-frames in a document.","","","This place covers: Control of a display to display an image having intermediate tones by using sub-frames, i.e. selectively activating a display element in a number of non-overlapping time periods, in which a frame is subdivided. Control of a display to display an image having intermediate tones by using sub-frames, i.e. selectively activating a display element in a number of non-overlapping time periods, in which a frame is subdivided, wherein no details of the ratios of the duration of one sub-frame to the duration of another sub-frame are given. Control of a display to display an image having intermediate tones by using sub-frames, i.e. selectively activating a display element in a number of non-overlapping time periods, in which a frame is subdivided, wherein the durations of the sub-frames are binary numbers, i.e. the duration of the second shortest sub-frame is twice the duration of the shortest sub-frame, the third shortest sub-frame is four times the duration of the shortest sub-frame, ...,and the duration of the nth shortest sub-frame is (n-1) times the duration of the shortest sub-frame."
"G09G3/2025","{the sub-frames having all the same time duration}","","","","","","","This place covers: Control of a display to display an image having intermediate tones by using sub-frames having all the same duration, i.e. a frame rate control with the intermediate tone being generated by selectively activating a display element in a number of sub-frames."
"G09G3/2029","{the sub-frames having non-binary weights}","","","","This code is not given if for all the sub-frames the ratio of the duration of one sub-frame to the duration of another sub-frame is a binary number, but one or more of the sub-frames are split in two or more time periods, wherein the time periods are still addressed by the same binary bit.Illustrative examples:GB2327798 (ratio of the durations of the display period of the fourth shortest sub-frame and the shortest sub-frame is seven, not eight)","","","This place covers: Control of a display for displaying an image having intermediate tones by using sub-frames, wherein the durations of the sub-frames are not all binary numbers, i.e. at least for one sub-frame it does not hold that the duration of the nth shortest sub-frame is (n-1) times the duration of the shortest sub-frame."
"G09G3/2033","{with splitting one or more sub-frames corresponding to the most significant bits into two or more sub-frames}","","","","This code is not given if the sub-frame corresponding to the most significant bit is not split, but only other sub-frames corresponding to lower bits are split. This code is also not given if the time periods, into which the sub-frames corresponding to the most significant bits are split, are individually addressed by separate bits, but the code  might apply.Illustrative examples:EP0774745 (sub-frame with the longest duration and corresponding to the most significant bit is split in two periods controlled by the same most significant bit)","G09G3/2029","","This place covers: Control of a display for displaying an image having intermediate tones by using sub-frames, wherein one or more sub-frames corresponding to the most significant bits are split into two or more time periods, which are still addressed by the same bit."
"G09G3/2037","{with specific control of sub-frames corresponding to the least significant bits}","","","","This code is not given if the sub-frame corresponding to the least significant bit is not specifically controlled, but only other sub-frames corresponding to higher bits.Illustrative examples:US5751379 (sub-frame with the shortest duration and corresponding to the least significant bit is displayed only every second frame)","","","This place covers: Control of a display for displaying an image having intermediate tones by using sub-frames, wherein one or more sub-frames corresponding to the least significant bits are specifically controlled to increase the number of intermediate tones without applying to narrow pulses."
"G09G3/204","{the sub-frames being organized in consecutive sub-frame groups}","","","","","","","This place covers: Control of a display for displaying an image having intermediate tones by using sub-frames, wherein the sub-frames are organized in consecutive sub-frame groups, e.g. the groups being separated by a pause period, or the sub-frames within one group having a common addressing scheme, or a specific order with respect to the size of the corresponding bits. Illustrative examples: EP1710777 (sub-frames of one frame are arranged in two groups divided by an idle period and with increasing durations within each group)"
"G09G3/2044","{using dithering}","","","","","","","This place covers: Control of a display for displaying an image having intermediate tones by using dithering, i.e. by adding a noise signal to the image signal or the gradation threshold."
"G09G3/2048","{with addition of random noise to an image signal or to a gradation threshold}","","","","","","","This place covers: Control of a display for displaying an image having intermediate tones by using dithering, wherein the noise signal added to the image signal or the gradation threshold is random noise."
"G09G3/2051","{with use of a spatial dither pattern}","","","","","","","This place covers: Control of a display for displaying an image having intermediate tones by using dithering, wherein the noise signal added to the image signal or the gradation threshold is a spatial dither pattern applied to the display element and its neighbouring display elements."
"G09G3/2055","{the pattern being varied in time}","","","","","","","This place covers: Control of a display for displaying an image having intermediate tones by using dithering, wherein the noise signal added to the image signal or the gradation threshold is a spatial dither pattern applied to the display element and its neighbouring display elements, and the spatial dither pattern is varied in time, e.g. from one frame to the next frame, and cyclically, i.e. the same pattern is reused after a certain time period."
"G09G3/2059","{using error diffusion}","","","","","","","This place covers: Control of a display for displaying an image having intermediate tones by using error diffusion in space, i.e. distributing the quantization error to neighbouring display elements. Illustrative examples: EP1587053 (error diffusion in space; sections 0027, 0028)."
"G09G3/2062","{using error diffusion in time}","","","","","","","This place covers: Control of a display for displaying an image having intermediate tones by using error diffusion in time, i.e. distributing the quantization error to the next frame. Illustrative examples: EP1583063 (error diffusion in time; section 0143)."
"G09G3/2066","{with error diffusion in both space and time}","","","","","","","This place covers: Control of a display for displaying an image having intermediate tones by using error diffusion in space and time, i.e. distributing the quantization error to the neighbouring display elements and the next frame. Illustrative examples: US2009/0128693 (quantization error is distributed within the same frame to neighbouring display elements and to the same display element in the next frame)"
"G09G3/207","{by domain size control  (G09G3/3637 takes precedence)}","G09G3/3637","Portions of a pixel that are physically separated or separately controlled are not a case of generating intermediate tones by domain-size control but by using sub-pixels","G09G3/2074","","","","This place covers: Control of a display to display an image having intermediate tones by varying the area of a display element, which is in one display state, relative to the remaining area of the display element, which is in another display state."
"G09G3/2074","{using sub-pixels}","","Portions of a pixel that are not physically separated and not separately controlled, but exploit instead a stepped variation across the pixel of a physical variable that affects the state of the pixel itself, are not a case of sub-pixels but of domain size control","G09G3/207","","","","This place covers: Control of a display to display an image having intermediate tones by display elements (pixel) having two or more physically separated or separately controllable portions (sub-pixels)."
"G09G3/2077","{by a combination of two or more gradation control methods}","","","","Additional codes within  should also be given, to indicate which methods of generating the intermediate tones are combined. Code  is only given if specific details of the amplitude modulation are present.As using sub-fields for the control of a plasma display panel to display an image having intermediate tones is a standard method, this code is not given for the combination of using sub-fields with a single other method of generating the intermediate tones in a plasma display panel.Illustrative examples:US2009/0128473 (combination of amplitude modulation with using sub-pixels for generating intermediate tones in an LCD)","G09G3/2007|G09G3/2011","","This place covers: Control of a display to display an image having intermediate tones by using two or more methods of generating the intermediate tones together, e.g. by using both sub-pixels and error diffusion."
