"cpc_code","title","title_cpc_codes","informative_references","informative_references_cpc_codes","special_rules","special_rules_cpc_codes","glossary_of_terms","definition_statement"
"H01F13/00","Apparatus or processes for magnetising or demagnetising  ({devices for holding workpieces using magnetic or electric force acting directly on the workpieces B23Q3/15} ; for degaussing ships B63G9/06; for clocks or watches G04D9/00; {recording or erasing of information on magnetic record carriers G11B5/00} ; demagnetising arrangements for colour television H04N9/29)","B23Q3/15|B63G9/06|G04D9/00|G11B5/00|H04N9/29","","","","","","This place covers: Apparatus or processes for magnetising permanent magnets or for demagnetising magnetic bodies."
"H01F17/00","Fixed inductances of the signal type  (coils in general H01F5/00 {inductors without a potential-jump or surface barrier specially adapted for integrated circuits, details thereof and multistep manufacturing processes therefor H01L28/10})","H01F5/00|H01L28/10","Inductive arrangements or effects between of or between wiring layers of semiconductor devices (related to )Integrated circuits comprising only passive thin-film elements (related to )Thin- or thick-film solid state devices (related to )","H01F17/0006|H01L23/5227|H01F17/0006|H01L27/01|H01F17/0006|H01L49/02","","","","This place covers: Inductances of fixed value not used /useable for high power. Further information: ""Signal type"" means that these inductances are not used/useable for high power."
"H01F19/00","Fixed transformers or mutual inductances of the signal type  (H01F36/00 takes precedence)","H01F36/00","","","","","","This place covers: Transformers or coupled inductances. Further information: ""Signal type"" means that these transformers or inductances are not used/useable for high power. The subgroups basically define different frequency ranges."
"H01F21/00","Variable inductances or transformers of the signal type  (H01F36/00 takes precedence)","H01F36/00","Variable inductances including MEMS (related to  or ) ","H01F21/04|H01F21/06|B81B3/00","","","","This place covers: Transformers or inductances which are variable and not used/useable for high power. Further information: ""Signal type"" means that these transformers or inductances are not used/useable for high power."
"H01F27/00","Details of transformers or inductances, in general","","Buchholz relays (for protecting oil-cooled transformers, related to  and ) Buchholz relays (for protecting oil-cooled transformers, related to  and ) Emergency protective circuits for transformers (related to )Arrangements for controlling transformers, reactors or choke coils for the purpose of obtaining a desired output (field not active anymore)Cooling of electrical devices in general (related to )","H01F27/14|H01F27/402|H01H33/555|H01F27/14|H01F27/402|H02H5/08|H01F27/402|H02H7/04|H02P13/00|H01F27/08|H05K7/20","","","","This place covers: Constructional features of transformers or inductances in general. Further information: In this group no distinction is made between ""signal type"" and ""power type"" applications except for the cases mentioned below. ""Power type"" means that these transformers or inductances are used/useable for high power.  covers constructional features of transformers and inductances falling under the titles of   -   and   -  . If a subgroup for a specific detail exists under   -   and   -  , this subgroup takes precedence over  .  also covers details of cores, coils and magnetising arrangements in   -   and   if there is no appropriate subgroup for the respective constructional features in the   -   and  . Example: cooling of coils: For superconducting coils ( ), there is a subgroup for cooling covered by  . For normal-conducting coils, however, which are classified generally in   and in   when used as electromagnet, no subgroups for cooling exist. Therefore, applications related to the cooling of normal-conducting coils or electromagnets, in addition to   or  , have to be classified in an appropriate subgroup of  . Although in general, no difference is made between ""signal type"" and "" power type"" applications in  , this is not true for the mounting of transformers/inductances;   covers the mounting of ""signal type"" applications;   covers the mounting of ""power type"" applications. Details related to cooling: Cooling arrangements only for coils are covered by  ; Cooling channels in the insulation of coils are covered by  ; Cooling of transformers/inductances, in general, is covered by   and subgroups;   covers a wide variety of accessories used for oil-cooled transformers/inductances like oil expansion chambers, gas cushions, oil filters. Details related to encapsulation: Devices encapsulated as a whole are covered by  ; Encapsulation only of a winding is covered by  . Details related to electric/magnetic shields: Shields in general are covered by  ; Shields of the winding arrangement are covered by  ; Shields of pancake coils are covered by  ."
"H01F29/00","Variable transformers or inductances not covered by group H01F21/00 {(tap change devices H01H9/0005)}","H01F21/00|H01H9/0005","","","","","","This place covers: Variable transformers or inductances of the ""power type"", i.e. used/useable for high power."
"H01F30/00","Fixed transformers not covered by group H01F19/00","H01F19/00","","","","","","This place covers: Fixed transformers of the ""power type"", i.e. used/useable for high power. Further information: The subgroups define different general transformer structures."
"H01F36/00","Transformers with superconductive windings or with windings operating at cryogenic temperature  (superconducting magnets or superconducting coils H01F6/00)","H01F6/00","Cooling of transformers in general ","H01F27/08","","","","This place covers: Transformers with superconducting windings. Transformers with windings operating at cryogenic temperature."
"H01F37/00","Fixed inductances not covered by group H01F17/00","H01F17/00","","","","","","This place covers: Fixed inductances of ""power type"", i.e. used/useable for high power."
"H01F38/00","Adaptations of transformers or inductances for specific applications or functions","","Rotary transformer for transmission of signals and/or power between stationary and moving part of an X-ray computed tomography (CT) apparatus (related to )Current collectors for power supply lines of electronically propelled vehicles without mechanical contact between collector and power supply line (related to )Charging electric vehicles by inductive power transfer (related to )For wireless supply or distribution of electric power using inductive couplingNear field transmission systems using inductive coupling (related to )Ignition circuits for discharge lamps (related to  and ) ","H01F38/18|A61B6/56|H01F38/14|B60L5/005|H01F38/14|B60L53/12|H02J50/10|H01F38/14|H04B5/0075|H01F38/10|H01F38/12|H05B41/00","","","","This place covers: Transformers or inductances for specific applications or functions. Welding transformers and discharge lamp ballasts are covered by  even if they do not explicitly have a high leakage (i.e. gap in magnetic flux path)."
"H01F41/00","Apparatus or processes specially adapted for manufacturing or assembling magnets, inductances or transformers; Apparatus or processes specially adapted for manufacturing materials characterised by their magnetic properties","","Manufacturing articles from powder; (related to ), ","H01F41/0246|B22F3/00|B22F7/00","","","","This place covers: Apparatus or processes for manufacturing or assembling transformers, inductances, reactors or choke coils. Apparatus or processes for manufacturing or assembling magnetic circuits, permanent magnets or coils. Apparatus or processes for applying magnetic films to substrates and forming magnetic nanostructures."
"H01F41/005","{Impregnating or encapsulating  (insulating of windings H01F41/12)}","H01F41/12","Injection moulding incorporating preformed parts","B29C45/14","Encapsulation only of a winding is to be classified in .","H01F41/127","","This place covers: Methods for encapsulating/impregnating. Refers to cases where a whole device (e.g. coil and core of a transformer or a choke) is encapsulated."
"H01F41/02","for manufacturing cores, coils, or magnets  (H01F41/14 takes precedence; for dynamo-electric machines H02K15/00)","H01F41/14|H02K15/00","","","","","","This place covers: Manufacturing of hard or soft magnetic articles. Manufacturing of coils."
"H01F41/0206","{Manufacturing of magnetic cores by mechanical means  (magnetic cores per se H01F27/24)}","H01F27/24","","","","","","This place covers: Methods and apparatus for manufacturing soft magnetic articles characterised by the shape of the magnetic material composing those articles.   takes precedence."
"H01F41/0253","{for manufacturing permanent magnets}","","","","","","","This place covers: Methods and apparatus for manufacturing permanent magnets characterised by process steps performed on the magnetic material or on the magnets."
"H01F41/04","for manufacturing coils {(coils for transformer or inductances H01F27/28)}","H01F27/28","","","","","","This place covers: Methods and apparatus for manufacturing coils. Further information: The most important subgroups are related to: printed circuit coils ( ), superconducting coils ( ), winding ( ) insulating of windings ( )."
"H01F41/06","Coil winding","","Winding or coil filamentary material","B65H54/00","","","FormerFrame, e.g. composed of electrically insulating material, around which a coil is wound. Examples of former are bobbins, spools or winding supports","This place covers: Processes or apparatus for manufacturing coils by winding."
"H01F41/063","with insulation","","Insulation of windingsInsulating of coils, windings, or parts thereofWinding non-flat conductive wires with insulationInsulation of windings","H01F5/06|H01F27/32|H01F41/066|H01F41/12","","","","This place covers: Processes or apparatus for winding flat conductive wires or sheets with insulation. To be classified here, the conductive wires or sheets and the insulation must initially be separate, and must be wound simultaneously. The figure below is an example of material classified in this subgroup. In the figure, the conductive sheet 40 and the insulating sheet 52 are wound simultaneously to form an insulated coil."
"H01F41/066","with insulation","","Insulation of windingsInsulating of coils, windings, or parts thereofWinding flat conductive wires or sheets with insulationInsulation of windings","H01F5/06|H01F27/32|H01F41/063|H01F41/12","","","","This place covers: Processes or apparatus for winding non-flat conductive wires with insulation. To be classified here, the conductive wires or sheets and the insulation must initially be separate and must be wound simultaneously. The figure below is an example of material classified in this subgroup. In the figure, for example, the conductive wire 24 and the insulation tapes 21 and 22 are wound simultaneously to form an insulated coil."
"H01F41/076","Forming taps or terminals while winding, e.g. by wrapping or soldering the wire onto pins, or by directly forming terminals from the wire","","","","","","","This place covers: Processes or apparatus for forming taps or terminals while, or in conjunction with winding. The figure below is an example of material classified in this subgroup. In the figure, the first terminal 3 is wrapped, then the first section 9 of the bobbin 1 is wound. The wire is then wrapped around the second terminal 5. The terminal connections are thus formed in conjunction with the winding of the bobbin."
"H01F41/077","Deforming the cross section or shape of the winding material while winding","","","","","","","This place covers: Processes or apparatus for deforming the cross section or shape of the winding material in conjunction with winding. The figure below is an example of material classified in this subgroup. In the figure, the circular material wire 50 is transformed into the deformed rectangular wire 52 just before winding."
"H01F41/079","Measuring electrical characteristics while winding","","","","","","","This place covers: Processes or apparatus for winding coils while measuring electrical characteristics, e.g. resistance, inductance or capacitance. The figure below is an example of material classified in this subgroup. In the figure, the existence of an electrical short circuit is detected by measuring voltage during winding."
"H01F41/14","for applying magnetic films to substrates","","Covering metals, or materials with metals ","C23C","","","","This place covers: Thin films deposition methods not provided in subgroups below."
"H01F41/16","the magnetic material being applied in the form of particles, e.g. by serigraphy {, to form thick magnetic films or precursors therefor}  (H01F41/18  {-H01F41/24} take precedence)","H01F41/18|H01F41/24","Thick films and precursors thereof","H01F1/0027","","","","This place covers: Deposition methods and apparatus for forming thick magnetic films, usually performed by macroscopic methods. The obtained material is a thick magnetic film or any precursor of thick magnetic film, generally in the form of magnetisable pastes, inks or glass frits. "
"H01F41/18","by cathode sputtering","","","","","","","This place covers: Deposition methods and apparatus for forming thin magnetic films characterised by deposition methods."
"H01F41/22","Heat treatment; Thermal decomposition; Chemical vapour deposition","","Coating by evaporation or sputtering ","C23C14/00","","","",""
"H01F41/24","from liquids","","Electrodeposition, ","C25D3/00|C25D5/00","","","","This place covers: Deposition from liquids.  covers deposition from liquids using electric currents.  covers deposition from liquids by liquid phase epitaxy."
"H01F41/30","for applying nanostructures, e.g. by molecular beam epitaxy [MBE]","","Ion implantation","C23C14/48","","","","This place covers: Deposition methods and apparatus for forming multilayered nanostructures, especially spin-exchange-coupled multilayers corresponding to product subgroups  - , characterised by specific process steps leading to a specific change of properties of the grown superlattice ( - ) or to a given structure ( - )."
"H01F41/32","for applying conductive, insulating or magnetic material on a magnetic film {, specially adapted for a thin magnetic film}","","Ion implantation","C23C14/48","Spin filters capping layers for TMR/GMR structures (products) are also classified within method subgroup .","H01F41/325","","This place covers: Deposition methods and apparatus for applying a single layer on a magnetic thin film characterised by specific process steps.  covers deposition in patterns (i.e. using lithography)."
