"cpc_code","title","title_cpc_codes","informative_references","informative_references_cpc_codes","special_rules","special_rules_cpc_codes","glossary_of_terms","definition_statement"
"H01F","MAGNETS; INDUCTANCES; TRANSFORMERS; SELECTION OF MATERIALS FOR THEIR MAGNETIC PROPERTIES  (ceramics based on ferrites C04B35/26; alloys C22C; {construction of loading coils H01B} ; thermomagnetic devices H01L37/00; loudspeakers, microphones, gramophone pick-ups or like acoustic electromechanical transducers H04R)","C04B35/26|C22C|H01B|H01L37/00|H04R","Powder metallurgyIron oxides (not sintered)Ferrite based ceramicsFerrous alloysCoating by evaporation or sputteringRefrigeration machines using magnetic effectsMagneto-optical devicesSensing record carriers using inductive or magnetic sensorsSemiconductor devices with potential-jump barrier or surface barrier controllable by variation of the magnetic field applied to the devicesThermomagnetic devicesMagnetostrictive devicesDevices using galvano-magnetic or similar magnetic effectsScreening of electric apparatus against magnetic fields","B22F|C01G49/02|C04B35/26|C22C|C23C14/00|F25B21/00|G02F1/09|G06K7/08|H01L29/82|H01L37/00|H01L41/12|H01L43/00|H05K9/00","Documents are classified with a CPC symbol according to the invention information mainly found in the claims with due regard given to the description and the figures. Additional information found in the claims and in the description and figures, which might be relevant for future searches is given an Indexing Code symbol.Main groups ,  and subgroups -:Classification proceeds by assigning the most restricted possible CPC symbol to the document, followed by additional knowledge tagging using Indexing Code symbols. This implies that CPC head subgroups (corresponding to IPC subgroups) should only be used if no other possibility could be found for classifying the document in a more restricted subgroup.If the set of claims comprises product or article and method claims an CPC symbol should be assigned to each of these categories. However if the most suitable subgroup for a claim of a given category, e.g. product, does not exist in the main group of the same category, e.g. product group, and can only be found in groups of another corresponding category, e.g. a group for a method to manufacture the product, this latter subgroup should be assigned to the claim e.g. method subgroup assigned to a product claim. For example a document with no method claims dealing with a magnetic tunnel junction in which the spacer has been processed in such a way that its material structure becomes inventive, would still be given the method CPC symbol  as product CPC symbol  is silent over any material inventive features.Another use of Indexing Codes can be made for particular cases where the invention is a specific property of a given type of material or article and this property is classified only in subgroups of another specific material type. In this case the corresponding CPC symbol cannot be given. Consequently the Indexing Code should be given together with an CPC symbol corresponding to the material described in the document. For example: a sintered nanocomposite exchange spring magnet of SmCo/Fe cannot be given  as CPC symbol since the latter symbol belongs to NdFeB magnets classification subtree. Therefore the combination  and  should be used.","H01F1/00|H01F10/00|H01F41/14|H01F41/34|H01F41/307|H01F10/3254|H01F1/0579|H01F1/0557|H01F1/0579","Compoundhomogenous substance comprising at least two elements, having a non-metallic character and a specific (fixed) composition ratio, including also intermetallic compounds.","This place covers: Magnets or magnetic bodies characterised by the magnetic materials therefor. Selection of materials for their magnetic properties ( ). Thin magnetic films ( ). Permanent magnets ( ). Electromagnets ( ) including, for example, superconductive magnets ( ); details thereof such as coils ( ), cores, yokes, and armatures ( ). Fixed and variable transformers including, for example, superconductive or cryogenic transformers; adaptations thereof for specific applications or functions; details thereof ( ,  ,  ,  ,  ,  ,  ). Fixed and variable inductances; adaptations thereof for specific applications or functions; details thereof ( ,  ,  ,  ,  ,  ). Apparatus or processes for magnetizing or demagnetizing ( ). Apparatus or processes specially adapted for manufacturing or assembling devices covered by this subclass ( ). Further information: Groups  -  (with the exception of groups   and  ) cover only structural or constructional aspects of transformers, inductive reactors, chokes or the like.These groups do not cover circuit arrangement of such devices, which are covered by the appropriate functional places."
"H01F1/00","Magnets or magnetic bodies characterised by the magnetic materials therefor; Selection of materials for their magnetic properties","","Working metallic powder; manufacturing powder (related to ; ; - ) , , Iron oxides carriers (related to , ) Making alloys by powder metallurgy (related to ; ; - ; ; ) Non-ferrous alloys containing 5-50% by weight of oxides, carbides, borides, nitrides, silicides etc. (related to , , , ) Making ferrous alloys (related to , ) Cast iron alloys (related to , ) Ferrous alloys (related to , ) Amorphous alloys and related processes (related to )Single crystal growth, unidirectional solidification (related to )Electromagnetic interference suppressing, shielding (related to , ) ","H01F1/0045|H01F1/06|H01F1/20|H01F1/28|B22F1/00|B22F1/16|B22F9/00|H01F1/342|H01F1/36|C01G49/02|H01F1/0045|H01F1/06|H01F1/20|H01F1/28|H01F1/14766|H01F1/14708|C22C1/04|H01F1/09|H01F1/33|H01F1/14708|H01F1/14766|C22C32/00|H01F1/14708|H01F1/14766|C22C33/00|H01F1/14708|H01F1/14766|C22C37/00|H01F1/14708|H01F1/14766|C22C38/00|H01F1/153|C22C45/00|H01F1/0072|C30B|H01F1/26|H01F1/28|H05K9/0073","Treatment of the materials, e.g. compacting, sintering, bonding are also classified into this group.","","","This place covers: Bulk magnetic materials: antiferromagnetic, diamagnetic, paramagnetic, hard and soft ferromagnetic materials. 0D, 1D and 2D magnetic (nano)structures. Materials cover metallic materials, compounds (i.e. mainly non-metallic materials) or organic materials. Selected types of magnetic materials are highlighted within specific subgroups.  is mainly concerned with bulk materials except for some specific subgroups.  covers antiferromagnetic bulk material.  covers diamagnetic or paramagnetic bulk material.  covers thick magnetic films formed with methods classified under  ."
"H01F1/0027","{Thick magnetic films  (forming thick magnetic films H01F41/16)}","H01F41/16","","","Hard magnetic thick films applied in magnetic record carriers are classified under .Hard magnetic thick films forming permanent magnets are classified according to the composition of the magnetic particles; i.e. under  and its subgroups, primarily under ,  or . When the composition of the magnetic particles is nominal, i.e. not a restriction, classification will usually fall under  and its subgroups, i.e. .","G11B5/70|H01F1/047|H01F1/0533|H01F1/0558|H01F1/0578|H01F1/08|H01F1/083","","This place covers: Thick magnetic films characterized by being manufactured with methods associated under  . This subgroup encompasses single layers and multiple layers of thick films. This subgroup primarily includes soft magnetic thick films but also includes hard magnetic thick films meeting the above requirements.  Thick magnetic films can be distinguished from thin magnetic films by assessing their respective manufacturing methods: Thick magnetic films are typically obtained from magnetic particles and bonding agent, according to manufacturing methods of groups   thereby forming a composite film. Thin magnetic films are typically obtained by deposition or plating of magnetic material, according to manufacturing methods of groups  - ."
"H01F1/0036","{showing low dimensional magnetism, i.e. spin rearrangements due to a restriction of dimensions, e.g. showing giant magnetoresistivity,  (H01F1/153, H01F1/42 and H01F10/00 take precedence; magnetoresistive sensors G01D5/16, G01R33/06; magnetoresistive recording G11B5/39; magnetic-field-controlled resistors H01L43/08)}","H01F1/153|H01F1/42|H01F10/00|G01D5/16|G01R33/06|G11B5/39|H01L43/08","","","1. Nanoparticles used in bioscreening (diagnostic, separation) are classified in these subgroups irrelevant of their composition and size effect.2. If a strong effect of the size of the nanoparticles belonging to the groups cited in the above table is shown on the magnetic properties, then it is also classified in -","H01F1/0036|H01F1/0063","","This place covers: These subgroups cover: 0D, 1D and 2D magnetic (nano)structures wherein the size and carriers confinement alters the magnetic properties. Embedded magnetic nanostructures."
"H01F1/01","of inorganic materials  (H01F1/44 takes precedence)","H01F1/44","Cryogenic machines using magnetic effects based on a magnetocaloric material","F25B21/00","","","","This place covers: Magnetocaloric materials. Subdivided in metallic or compounds materials."
"H01F1/03","characterised by their coercivity {(H01F1/40 takes precedence)}","H01F1/40","","","","","","This place covers: Materials with specific coercivity; Laves phases or magnetic shape memory materials. Mainly those latter examples are classified in these subgroups."
"H01F1/032","of hard-magnetic materials","","","","Magnets obtained from the corresponding materials are classified in the same subgroups according to method criteria (process or treatments undergone by the material forming the magnet) on which part of the classification refinement is based.","","","This place covers: Hard magnetic metals or alloys characterised by composition, by shape and by the process or treatments to obtain articles including these materials. Subgroup   is concerned with nanocomposite exchange spring magnets.  covers so-called R-T-B magnets (Nd Fe B phase).  covers magnets with a Sm Fe N  phase."
"H01F1/06","in the form of particles, e.g. powder  (H01F1/047 takes precedence {; record carriers G11B5/70605})","H01F1/047|G11B5/70605","","","","","","This place covers: Hard magnetic metallic particles characterised by shape and by treatments to obtain articles including these materials. The subgroups are generally concerned with particles used in magnetic recording or under subgroup   metallic particles for permanent magnets when composition is not specifically mentioned in the claims."
"H01F1/09","mixtures of metallic and non-metallic particles; metallic particles having oxide skin","","","","For rare earth containing particles covered with an oxide layer, subgroups  and  would take precedence except if the oxide layer is the core of the invention.","H01F1/0552|H01F1/0572","","This place covers: Hard magnetic non-metallic particles characterised by shape and by treatments to obtain articles including these materials.  can cover hard metallic particles covered with an oxide layer"
"H01F1/10","non-metallic substances, e.g. ferrites {, e.g. [(Ba,Sr)O(Fe2O3)6] ferrites with hexagonal structure}","","","","","","","This place covers: Hard non-metallic magnets such as Ba-ferrite type of magnets"
"H01F1/12","of soft-magnetic materials","","","","Fe-Ni and Fe-Si alloys and their shape are classified in the subgroups -.Other compositions than Fe-Ni, Fe-Si must be classified according to a shape criterion: subgroups  and onwards for sheets,  and onwards for particles and  for wires or for no specific shape given: subgroup . If no specific shape or composition criterion is given, the  symbol should be given.","H01F1/14708|H01F1/14791|H01F1/16|H01F1/20|H01F1/143|H01F1/147|H01F1/14","","This place covers: Soft magnetic metals or alloys characterised by composition, by shape and treatments to obtain articles including these materials."
"H01F1/153","Amorphous metallic alloys, e.g. glassy metals {(making ferrous amorphous alloys C22C33/003)}","C22C33/003"," Security codingAlarms using amorphous ferromagnetic tags","G07D7/00|G08B13/2408","The method section of these subgroups has to be used in combination with the method subgroups -.","H01F41/0206|H01F41/0246","","This place covers: Soft magnetic amorphous metals, also including nanocrystallites, characterised by composition and by methods to obtain articles including these materials."
"H01F1/16","in the form of sheets  (H01F1/147 takes precedence)","H01F1/147","","","","","","This place covers: Soft magnetic sheet of metals or alloys.  covers insulated sheets"
"H01F1/20","in the form of particles, e.g. powder  (H01F1/147 takes precedence)","H01F1/147","","","Soft magnetic particles compacted in a bonded body (magnetic core or noise suppressing sheet) are classified in  in combination with  for magnetic cores only.","H01F1/26|H01F41/0246","","This place covers: Soft magnetic particles of metals or alloys characterised by shape and by treatments or methods to obtain articles including these materials.  covers particles  covers compacted particles.  covers insulated compacted particles.  covers compacted particles wherein insulator are organic macromolecules. Subgroup   concerns non compacted bodies."
"H01F1/33","mixtures of metallic and non-metallic particles; metallic particles having oxide skin","","","","","","","This place covers: Soft metallic particles covered with an oxide layer."
"H01F1/34","non-metallic substances, e.g. ferrites","","Ferrite based ceramics described only by chemical composition","C04B35/26","Subgroup  would take precedence in the case of oxide insulated particles being part of a compacted body.","H01F1/24","","This place covers: Soft non-metallic materials characterised by composition, by shape and treatments to obtain articles including these materials.  covers bulk non metallic material such as ferrite.  covers non-metallic particles."
"H01F1/40","of magnetic semiconductor materials, e.g. CdCr2S4  (devices using galvano-magnetic or similar effects H01L43/00)","H01L43/00","","","Perovskites () and half-metals () are classified under the arborescence of magnetic semiconductors even if they might not be necessarily a semiconducting material.","H01F1/407|H01F1/408","","This place covers: Magnetic semiconductors and half-metals (Heusler)."
"H01F1/42","of organic or organo-metallic materials {, e.g. graphene} (H01F1/44 takes precedence)","H01F1/44","","","","","","This place covers: Organic or organo-metallic materials."
"H01F1/44","of magnetic liquids, e.g. ferrofluids  (particles in a bonding agent H01F1/28, H01F1/36, {H01F1/37})","H01F1/28|H01F1/36|H01F1/37","Nuclear magnetic resonance imaging: preparations for testing in vivo including magnetic particlesMagnetorheological fluid dampers including a ferrofluid","A61K49/06|F16F9/535","","","","This place covers: Magnetic and magnetorheologic fluids."
"H01F3/00","Cores, Yokes, or armatures  (magnetic materials H01F1/00; permanent magnets H01F7/02)","H01F1/00|H01F7/02","","","","","","This place covers: Cores, yokes and armatures which are single parts or arrangements of several parts of ferromagnetic material used to guide magnetic flux. Further information: Cores, yokes and armatures are covered by   if:- no specific application is mentioned,- a special application is mentioned for which no specific subgroup exists elsewhere,- they comprise specific features for which no subgroups exist in the specific subgroup for the application (e.g. transformer cores which are normally classified in   have to be classified in   if they are made from a combination of materials and in   if they comprise air gaps).  and  :A core made from a stack of strips is covered by   although this subgroup refers to sheets.The subgroup   for strips and ribbons predominantly covers cores which are fabricated by winding the strips on a mandrel."
"H01F5/00","Coils  (superconducting coils H01F6/06; fixed inductances of the signal type H01F17/00)","H01F6/06|H01F17/00","Apparatus or processes for manufacturing coils","H01F41/04","","","","This place covers: Printed coils. Wound electric conductors. Further information: Coils are covered by  , if:- no specific application is mentioned,- a special application is mentioned for which no specific subgroups exist elsewhere,- they comprise specific features for which no subgroups exist in the specific subgroup for the application (e.g. a bobbin for an electromagnet is classified in   although electromagnets are normally classified in  ). :This subgroup predominantly refers to terminals attached to bobbins.Bobbins characterised by details for attaching terminals are classified here and not in the subgroup   for bobbins."
"H01F6/00","Superconducting magnets; Superconducting coils {(magnetic resonance assemblies using superconducting coil systems G01R33/3815)}","G01R33/3815","Apparatus or processes for manufacturing superconductive coilsEmergency protective circuits for limiting excessive current using superconducting elements (related to )","H01F41/048|H01F6/00|H02H9/023","","","","This place covers: Superconducting magnets and coils and accessories necessary to operate them. Further information: Superconducting magnets can be superconducting bulk pieces cooled below the critical temperature in a magnetic field or superconducting coils. For use as magnets, the coils are often shorted (""persistent mode"" or ""persistent current mode""). Constructive details of inductive superconducting current limiters are covered by  ."
"H01F7/00","Magnets  (superconducting magnets H01F6/00; for separation of solid materials or fluids B03C1/00; for bench or like work-holders B23B31/28, B23Q3/00; work-holding devices B25B11/00; lifting magnets B66C1/00; {operating or controlling locks using permanent magnets E05B47/0038; devices for holding a wing, e.g. door or window, by magnetic or electromagnetic attraction E05C19/16; relieving load or bearings using magnetic means F16C39/06} ; for electric meters G01R; for relays H01H; {for electric discharge tubes H01J, e.g. H01J3/24, H01J23/10, H01J29/68} ; for dynamo-electric machines H02K)","H01F6/00|B03C1/00|B23B31/28|B23Q3/00|B25B11/00|B66C1/00|E05B47/0038|E05C19/16|F16C39/06|G01R|H01H|H01J|H01J3/24|H01J23/10|H01J29/68|H02K","Demagnetization of permanent magnets by coilsFastening by use of magnets (jewellery, haberdashery)Devices for hanging or supporting pictures, mirrors, or the like using magnetismMagnetic cleaning implementsMagnetic dental implant retention systemsMagnetic fastening of teeth prostheses in mouthToys: building blocks comprising magnetic interaction meansMagnetic mixers/stirrersSecuring wings by magnetic or electromagnetic attractionDevices for securing together, or preventing relative movement between, constructional elements or machine parts by the use of a magnetic materialElectromagnetic valve actuated using a permanent magnetFastening of component parts of lighting devices using magnetsSupporting, suspending, or attaching arrangements for lighting: magnetic devicesFaraday rotators (magnetic field generation)Educational appliances having elements to be mounted on a support by means of magnetsEducational appliances comprising elements to be used without a special support, the elements being connectible magneticallyPlanning boards using magnetic elementsMEMS with flexible or deformable elements (related to )Valve-gear or valve arrangements actuated by electric meansElectrical control of supply of combustible mixture or its constituents: output circuits, e.g. for controlling currents in command coils (related to )Fuel injectors using electromagnetic operating meansFuel injectors with movable windings (related to )Control or regulating systems: automatic controllers (related to )Magnetic circuit arrangements for electromagnetic relays (related to )Electromagnetic relays in generalActuators based on magnetostrictionMotors with reciprocating/oscillating/vibrating magnet/armature/coilPropulsion systems (e.g. linear motors)Acoustic electromechanical transducers having coils or permanent magnets","H01F13/006|A44D2203/00|A47G1/17|A47L13/41|A61C8/0081|A61C13/235|A63H33/046|B01F33/45|E05C19/16|F16B2001/0035|F16K31/08|F21V17/105|F21V21/096|G02F1/09|G09B1/08|G09B1/38|G09B29/002|H01F7/08|B81B3/00|F01L9/20|H01F7/18|F02D41/20|F02M51/061|H01F7/066|F02M51/0696|H01F7/18|G05B11/00|H01F7/081|H01H50/16|H01H51/00|H01L41/12|H02K33/00|H02K41/00|H04R","Although magnets are normally classified in the respective subgroups of an application when provided for, the presence of features for which an appropriate subgroup does not exist in the application main group but in , requires the respective subgroup in  to be allocated.For example, an electromagnetically actuated valve which is normally classified in , should also be classified in  for details concerning the use of alternating current for powering the actuator.","H01F7/00|H01F7/00|F16K31/06|H01F7/10","","This place covers: Magnets in general. Further information: The two principal subgroups are   for permanent magnets and   for electromagnets. Electromagnets comprising permanent magnets in any part of the magnetic circuit are covered as follows:- by   or   if they comprise a rectilinearly movable armature,- by   if the armature is not or not only rectilinearly movable,- by   if they do not comprise a movable armature."
"H01F10/00","Thin magnetic films, e.g. of one-domain structure  (magnetic record carriers G11B5/00; thin-film magnetic stores G11C)","G11B5/00|G11C","Alloys based on Ni; alloys based on Co (related to ; ) Ferrous alloys (related to )Amorphous alloys and related processes (related to )Single crystal growth of garnets (related to )Magneto-optic materials (related to )Semiconductor devices with potential-jump barrier or surface barrier controllable by variation of the magnetic field applied to the devices, e.g. spin (valve) transistor, spin injection device (related to , )  Devices using magnetic effects; Selection of materials for(related to  ), ","H01F10/14|H01F10/16|C22C19/00|H01F10/14|C22C38/00|H01F10/13|C22C45/00|H01F10/24|C30B29/28|H01F10/24|G02F1/0036|H01F10/324|H01F10/1936|H01L29/82|H01F10/324|H01L43/00|H01L43/10","","","","This place covers: Hard and soft ferromagnetic thin films. Antiferromagnetic thin films. Single layers and (spin-exchanged coupled) multilayers are both considered as thin films. Thin film materials cover metallic materials, compounds or organic materials.  is concerned with ferromagnetic or antiferromagnetic materials in the form of thin films. A thin film is generally less than a couple of microns thick and can be defined as being manufactured by the methods classified in subgroups  - .  covers antiferromagnetic, single layer, thin films.  covers organic or organo-metallic thin films. Graphene thin films are also given this symbol in case magnetic properties are claimed.  covers granular thin films."
"H01F10/06","characterised by the coupling or physical contact with connecting or interacting conductors","","","","","","","This place covers: Thin films characterised by contact with conductors."
"H01F10/08","characterised by magnetic layers  ({H01F10/32 takes precedence } ; applying thin magnetic films to substrates H01F41/14)","H01F10/32|H01F41/14","","","","","","This place covers: Single layer thin films characterised by properties or composition."
"H01F10/10","characterised by the composition","","","","","","","This place covers: Metallic single layer thin films characterised by their composition, e.g. amorphous, crystalline."
"H01F10/18","being compounds","","Photonic crystalsMagneto-optic devices (Faraday-rotator)","G02B6/1225|G02F1/09","","","","This place covers: Compounds single layer thin films characterised by their composition. Further divided in amorphous, magnetic semiconductors, half-metals (Heusler), perovskites and ferrites."
"H01F10/26","characterised by the substrate or intermediate layers {(H01F10/06 and H01F10/32 take precedence)}","H01F10/06|H01F10/32","","","","","","This place covers: Multilayers characterised by intermediate layers.  covers specific seed, template and cap layers."
"H01F10/32","Spin-exchange-coupled multilayers, e.g. nanostructured superlattices {(applying spin-exchange-coupled multilayers to substrates H01F41/302)}","H01F41/302","","","Multilayers with perpendicular magnetic anisotropy of the type of (Co/Pt)n are also classified in  but  takes precedence.","H01F10/3236|H01F10/3286","","This place covers: Spin-exchanged-coupled multilayers characterised by the interaction between the different layers and refined by composition of the single interacting layers."
"H01F10/324","{Exchange coupling of magnetic film pairs via a very thin non-magnetic spacer, e.g. by exchange with conduction electrons of the spacer}","","Magnetostrictive devices;Selection of materials therefor","H01L41/12|H01L41/20","Tunnel magnetic junctions (a tunnel barrier sandwiched between two magnetic layers) are classified in .However TMR junctions with additional pinning of one of the magnetic layers (by an AF layer or a SAF/AAF multilayer) do not have a subgroup of  where they can be classified. Therefore an Indexing Code of - is generally additionally given.Spin valves (GMR structures) with no specificity of the magnetic layers are generally classified under .If no subgroup in  can reflect the invention of a product claim for a spin-exchanged-coupled multilayer, subgroup from the corresponding method subgroups - is assigned when appropriate.","H01F10/3254|H01F10/3254|H01F10/3268|H01F10/3281|H01F10/325|H01F10/00|H01F41/302|H01F41/309","","This place covers: Spin-exchanged-coupled multilayers characterised by having a thin non-magnetic spacer between magnetic layers. Typical TMR and GMR structures."
