"cpc_code","title","title_cpc_codes","informative_references","informative_references_cpc_codes","special_rules","special_rules_cpc_codes","glossary_of_terms","definition_statement"
"H04W","WIRELESS COMMUNICATION NETWORKS  (broadcast communication H04H; communication systems using wireless links for non-selective communication, e.g. wireless extensions H04M1/72)","H04H|H04M1/72","Arrangements for programme control, e.g. control unitWireless sensing of record carriersSignalling or calling systemsTraffic control systemsTransceivers, i.e. devices in which transmitter and receiver form a structural unit and in which at least one part is used for functions of transmitting and receivingSpread spectrum techniques in generalNear-field transmission systems, e.g. inductive loop typeControl of transmission; EqualisingDiversity systemsSpace-based or airborne stationsFor communication between two or more posts at least one of which is mobileTransmission systems employing electromagnetic waves other than radio wavesTransmission systems employing sonic, ultrasonic or infrasonic wavesTransmission systems characterised by the medium used for transmissionMultiplex communicationArrangements for detection or preventing errors in the information receivedArrangements affording multiple use of the transmission pathArrangements for synchronising receiver with transmitterData switching networksModulated-carrier systemsCommunication control or processing characterised by a protocolTelephonic communicationTelephonic substation equipmentTelephonic automatic or semi-automatic exchangesMetering arrangements; Time controlling arrangements; Time- indicating arrangementsPrepayment telephone systemsArrangements using wireless links for the sole purpose of telecontrol or telemetry systems","G06F9/00|G06K7/10|G08B|G08G|H04B1/38|H04B1/69|H04B5/00|H04B7/005|H04B7/02|H04B7/185|H04B7/26|H04B10/00|H04B11/00|H04B13/00|H04J|H04L1/00|H04L5/00|H04L7/00|H04L12/00|H04L27/00|H04L29/06|H04M|H04M1/00|H04M3/00|H04M15/00|H04M17/00|H04Q9/00","","","Access pointmeans an equipment providing wireless user access to a backbone network by terminating a radio link.BSCBase Station ControllerBTSBase Transceiver StationBackbone networkdesignates equipment(s) for connecting one or several wireless access points to a wired or wireless infrastructure in order to allow communication(s) between users' inside or outside the wireless network.Care-of-addressdesignates the termination point of a tunnel toward a mobile node, for datagrams forwarded to the mobile node while it is away from home. Cellularan infrastructure deployment involving partitioning geographical areas in a plurality of sub-areas (cells) for the purpose of reusing wireless resources. Communication linkmeans a physical or logical connection selectively established for the purpose of conveying messages or information between users or networks.Connectionmeans network resource(s) allocated or reserved for an affiliated user.Connected statedesignates the state of a user/terminal having active i.e. allocated logical traffic/control channel, dormant or suspended, i.e. without allocated logical channels but with maintained service instances. It also incorporates context (PDP context), User Plane, Control Plane operations.Control channeltransports control information used to control the function of the network element. (""signalling channel"", e.g. paging channel, broadcast channel, pilot channel).Core network, CN 3GPP standard terminology. PLMN architecture is divided into Core Network (CN) and Access Network (AN). Whereas Access Network comprises GERAN (BSS for GSM), UTRAN (RNS) and E-UTRAN, Core Network is logically subdivided into a Circuit Switched (CS) domain, a Packet Switched (PS) domain and an IP Multimedia (IM) subsystem. Correspondent nodea peer with which a mobile node is communicating. A correspondent node may be either mobile or stationary.Data network PoA [Point of Attachment]entity within wireless network or mobility management infrastructure providing access to a data network for a wireless user.Direct modeestablishing a direct communication link between user/terminal; the link can be established using an intermediate node.Domain;CS domain, PS domain3GPP standard terminology. Circuit Switched domain (CS domain) refers to the set of all core network entities offering ""circuit switched type of connection"" for user traffic and for the related signalling. Dedicated network resources are allocated at connection establishment and released at connection release. Entities specific to the CS domain are: MSC, GMSC, VLR. The Packet Switched domain (PS domain, Packet domain) refers to the set of all core network entities offering ""packet switched type of connection"" for user traffic and for supporting the related signalling. Transports user information using autonomous concatenation of bits called packets: each packet can be routed independently from the previous one. PS domain includes General Packet Radio Service (GPRS) and Evolved Packet Core (EPC). Entities specific to the PS domain are: SGSN, GGSN, PDN GW, S-GW, MME, SGSN. CS and PS domains also have common network entities: e.g, HSS, HLRDownlinkmeans the wireless link from a wireless access point or network towards the user or terminal equipment (see also ""uplink"").Fixed allocation (of a dedicated resource)allocation of a resource that is not changed with each frame or time slot. It is also named ""persistent or semi-persistent scheduling"".Hand-off, handovera change of radio link or data network point of attachment, while a connection is ongoing. Home networkdesignates the network performing functions at a permanent location regardless of the location of the user's access point. The home network is responsible for subscription information management and for specific services not provided by the serving network; dedicated equipment used therefore is designed by HLR (Home Location Register); also Home Agent, Home Subscriber Server.Idle statedesignates the state of a user/terminal having no active traffic/control channel and no active service instances but being affiliated to the network. (See also ""null state"") Mobility bindingdesignates the association of a home address with a care-of address, along with the remaining lifetime of that association.Mobility datainformation obtained by the network or exchanged by network components, in particular user affiliation or location data, to be used in providing a network serviceMobility managementdesignates techniques or arrangements allowing operation of, or services to be provided to, a user capable of selecting or changing his point of attachment to the network. Mobility serverA network functional entity acting as an established reference point in location registration operations by (or on behalf of) a mobile user/terminal.Mobile nodedesignates a host or router that changes its point of attachment from one network or subnetwork to another, without changing its constant home IP address. Multi-callmeans a plurality of communication links established over one or a plurality of networks for transferring information to one user/terminal.Multiplexingsorting packets of flows onto one or several channels in time, frequency, code and space division. better or space division. Networkmeans the physical or logical entities involved in providing communication services to users.Network security(see Tanenbaum) roughly means the four intertwined areas: secrecy, authentication, nonrepudiation and integrity control for a interconnected collection of autonomous nodes, e.g, computers Null statedesignates the state of a user/terminal having no active traffic/control channel and no active service instances.Originatingmeans a user/terminal acting as a requester for communication towards a wireless access point.Packet domain PLMN backbone networkThe 3GPP standard terminology defines two kinds of packet domain PLMN backbone networks: The intra-PLMN backbone network is the IP network comprising routers interconnecting ps domain(s) within the same PLMN. The inter-PLMN backbone network is the IP network comprising routers interconnecting ps domain(s) of different PLMNs. PagingNotifying a terminating user of a communication event.Paging serviceone-way selective calling service.Partitioningmeans distributing/committing specific resources to a particular/specific network component.Pollingquestioning for needed transmission resources and according instant allocation for immediate transmission. Private networksdesignates networks owned and operated by non-public authorities.QoSQuality of ServiceResource allocationmeans allocation of a resource to a communication.Resource distributionmeans committing a resource to an entity for future allocation thereof for communication.RNCRadio Network ControllerScheduling means establishing an order of transmission of communication information based on precedence or priority policies.Scheduled accessaccess to a wireless resource follows a schedule or os performed in a defined order.Scheduled allocationresource allocation is continuously changed or adapted during a connection according to a transmission schedule. This requires the usage of a shared channel.(semi-) persistent schedulingallocation of resources that is persistent for a number of (consecutive) time slots or frames according to a transmission schedule. This requires the usage of a shared channel. Serving networkdesignate the part of the network to which the access point providing user's access is connected. The serving network is responsible for path finding and transport of users data; dedicated equipment used therefore is designed by VLR (Visitor Location Register; also Foreign Agent, Visiting Subscriber Server.SLAService Level AgreementSubscribermeans an entity recognized and authorized as user.Terminalmeans the equipment acting as/or on behalf of a user.Terminatingmeans a user/terminal specified as a recipient for communication from within or via a wireless network.Trackingmonitoring a user or terminal activity in the network for purposes of gathering, e.g. location, activity or status information.Traffic channeltransports communication information (user data) to and from one or several users.Trigger, triggeringthe act of initiating an action. This could be caused by certain criteria or events or involve the exchange of information. (transmission) schedulingdefines an order of transmission of one or several data flows in time, frequency, code and space dimension.Uplinkmeans the wireless link from the user or terminal equipment towards a wireless network or access point (see also ""Downlink"").Usermeans an entity acting as an information source (sender, transmitter, server) or information sink (recipient, receiver, client).Wireless extensionmeans equipment using a pre-defined dedicated wireless link.Wireless linkmeans a communication link established via radio, infra-red, inductive or other electromagnetic radiation.Wireless resourcemeans a communication link using a specific frequency, time, code or space (or combination thereof).Zoneddesignates an infrastructure deployment involving partitioning geographical areas in a plurality of sub-areas (zones, cells) for the purpose of reusing wireless resources.","This place covers: Communication networks deploying an infrastructure for mobility management of wireless users connected thereto, e.g. cellular networks, wireless LANs. Self organizing wireless communication networks, e.g. ad-hoc networks. Wireless access networks e.g. Wireless Local Loop. Said networks being used for selectively establishing one or a plurality of communication links between a desired number of users or between users and network equipments for the purpose of transferring information via these communication links. Arrangements or techniques for planning, deploying wireless networks. Arrangements or techniques specially adapted for wireless service provisioning. Arrangements or techniques specially adapted for wireless network operation."
"H04W4/00","Services specially adapted for wireless communication networks; Facilities therefor","","Wireless network securityCharging, metering arrangements, , Broadcast or conference in data switching networksMessage switching systemsNetwork arrangements or protocolsNetwork architectures or network communicationsNetwork arrangements or protocols in real timeNetwork arrangements or communication protocols for networked applicationsApplication independent communication protocol aspectsTelephonic communication, substation extension arrangements, cordless telephones, portable communication terminals with improved user interface to control a main telephone operation mode or to indicate the communication statusTelephonic communication systems providing special services or facilities to subscriber","H04W12/00|H04L12/14|H04M15/00|H04M17/00|H04L12/18|H04L51/00|H04L61/00|H04L63/00|H04L65/00|H04L67/00|H04L69/00|H04M1/72403|H04M3/42","","","Affiliatedmeans a user or terminal being recognized by a network and/or authorized to use network resources","This place covers: Providing wireless communication services by or via one or a plurality of network equipment to one or a plurality of affiliated user or terminal equipment."
"H04W4/06","Selective distribution of broadcast services, e.g. multimedia broadcast multicast service [MBMS]; Services to user groups; One-way selective calling services","","Resource management for broadcast servicesConnection management for selective distribution or broadcast","H04W72/005|H04W76/40","","","",""
"H04W4/10","Push-to-Talk [PTT] or Push-On-Call services","","Connection management for Push-to-Talk [PTT] or Push-to-Talk over cellular [PoC] servicesArrangements for real-time multimedia Push-to-X-Services ","H04W76/45|H04L65/4061","","","",""
"H04W8/00","Network data management","","","","","","","This place covers: Managing network data, e.g. storing, updating, transferring, obtaining or exchanging operation data, mobility data, user service data or terminal service data."
"H04W8/005","{Discovery of network devices, e.g. terminals}","","Connectivity information management, e.g. connectivity discovery or updateDiscovering, processing access restriction or access informationArrangements for service discovery, e.g. Service Location ProtocolProtocols for network applications involving the display to the application user of network conditions affecting the network applicationNetwork service discovery by a Service Manager","H04W40/24|H04W48/16|H04L29/08648|H04L29/0899|H04L41/5058","","","","This place covers: (RE-)scanning for and (re-)discovery of terminals or devices; inquiry methods"
"H04W8/02","Processing of mobility data, e.g. registration information at HLR [Home Location Register] or VLR [Visitor Location Register]; Transfer of mobility data, e.g. between HLR, VLR or external networks","","Network layer protocols, e.g. mobile IP [Internet Protocol]","H04W80/04","","","","This place covers: Processing, e.g. storing, updating of mobility data; Transfer of mobility data."
"H04W8/04","Registration at HLR or HSS [Home Subscriber Server]","","","","","","","This place covers: Registration of user or terminal affiliation or location information."
"H04W8/06","Registration at serving network Location Register, VLR or user mobility server","","","","","","","This place covers: Temporary or semi-permanent registration of user or terminal mobility data at a user mobility server not being the permanent reference point for mobile data queries."
"H04W8/065","{involving selection of the user mobility server}","","","","","","","This place covers: Selecting a user mobility server for registration."
"H04W8/08","Mobility data transfer","","","","","","","This place covers: Transfer of mobility data, e.g. to network components or external parties."
"H04W8/082","{for traffic bypassing of mobility servers, e.g. location registers, home PLMNs or home agents}","","","","","","","This place covers: Transfer of mobility data to forward traffic data directly to the mobile node without having to detour traffic data through the home network e.g. route optimization, local breakout"
"H04W8/085","{involving hierarchical organized mobility servers, e.g. hierarchical mobile IP [HMIP]}","","","","","","","This place covers: Transfer of mobility data in a network, wherein mobility servers are hierarchical components of a mobility management scheme."
"H04W8/087","{for preserving data network PoA address despite hand-offs}","","Modification of an existing route due to handover","H04W40/36","","","","This place covers: Transfer of mobility data on the basis of a localised network-based mobility management scheme, where the user terminal preserves its data network address, e.g. HAWAII and NETLMM."
"H04W8/10","between location register and external networks","","Interfaces specially adapted for wireless communication networks, inter-networking arrangements","H04W92/02","","","","This place covers: Transfer of mobility data between external networks and a location register or mobility server, e.g. HSS."
"H04W8/12","between location registers or mobility servers","","Interfaces specially adapted for wireless communication networks, interfaces between backbone network devices","H04W92/24","","","","This place covers: Transfer of mobility data between location registers or mobility servers e.g. for the purpose of sharing the load between mobility servers, or for supporting roaming."
"H04W8/14","between corresponding nodes","","Interfaces specially adapted for wireless communication networks, interfaces between hierarchical similar devices","H04W92/16","","","","This place covers: Transfer of mobility data between corresponding nodes,e.g. among communicating users or terminals."
"H04W8/16","selectively restricting mobility {data} tracking","","","","","","","This place covers: Selectively restricting the tracking of mobility data by the network or user, e.g. restricting the transmission of affiliation or location information,or restricting the transfer of tracking information."
"H04W8/18","Processing of user or subscriber data, e.g. subscribed services, user preferences or user profiles; Transfer of user or subscriber data","","Registration, e.g. affiliation to network; De-registration, e.g. terminating affiliationProtocols for network applications involving profiles","H04W60/00|H04L29/08918","","","","This place covers: Processing or transferring of user data, e.g. storing, updating, deleting, and transferring user profiles, service data, and preferences; Processing or transferring of subscriber data, e.g. data concerning subscribed services, subscriber profiles. Storage arrangements therefore including dedicated record carriers."
"H04W8/183","{Processing at user equipment or user record carrier}","","Fraud detection as security arrangement","H04W12/12","","","","This place covers: Processing, e.g. storing, updating, deleting, at user equipment or record carrier; logical bundling of record carrier and subscriber equipment, e.g. SIM-lock."
"H04W8/186","{Processing of subscriber group data}","","","","","","","This place covers: Affiliation of subscribers to a group De-affiliation of subscribers from a group Creation and administration of subscriber groups Transfer, processing, and update of subscriber group information This subgroup covers all kinds of subscriber groups. Network addressing or numbering for mobility support Self-organizing networks, e.g. ad-hoc networks or sensor networks"
"H04W8/20","Transfer of user or subscriber data","","","","","","","This place covers: Arrangements for transfer of user data or subscriber data, e.g. between network databases, subscriber equipment or between network databases and authorized 3d parties."
"H04W8/205","{Transfer to or from user equipment or user record carrier}","","","","","","","This place covers: Transfer is performed to or from user equipment or between user equipment and user record carrier."
"H04W8/22","Processing or transfer of terminal data, e.g. status or physical capabilities","","Allocation plan definition, set-up or creation based on terminal or device propertiesProtocols for network applications adapted for proprietary or special purpose networking environments, involving the management of devices over a network","H04W72/048|H04L29/08567","","","","This place covers: Processing terminal data, e.g. storing, updating, deleting. Transferring terminal data, e.g. data related to condition, physical capabilities. Transferring terminal status, e.g. lost, stolen."
"H04W8/24","Transfer of terminal data","","Programme loading or initiating ; Power saving arrangements ; De-registration or Detaching Portable communication terminals with means for supporting locally a plurality of applications to increase the functionality provided by software upgrading or downloading","G06F9/445|H04W52/02|H04W60/06|H04M1/72406","","","","This place covers: Transfer of terminal data, e.g. between network and terminal equipment."
"H04W8/245","{from a network towards a terminal}","","Protocols for network applications involving the movement of software and/or configuration parametersCordless phones with means for supporting locally a plurality of applications to increase the functionality provided by software upgrading or downloading","H04L29/08981|H04M1/72406","","","","This place covers: Transfer of terminal data from a network towards a terminal, e.g. downloading terminal equipment software, remotely activating or deactivating terminals."
"H04W8/26","Network addressing or numbering for mobility support","","Assignment or use of connection identifiers when establishing a connectionAddress allocation involving portability aspects in data networksAdditional connecting arrangements for providing access to frequently-wanted subscribers, e.g. abbreviated dialling","H04W76/11|H04L29/12311|H04M3/44","","","","This place covers: Allocating address(es) to network components, services or other logical entities,for the purpose of handling mobility or establishing communication(s) using said address(es); De-allocating, reclaiming of address(es); Action(s) making use of addresses."
"H04W8/265","{for initial activation of new user}","","Access control characterised by a protocol","H04L29/06823","","","","This place covers: Allocation of network address or number at initial activation of a user"
"H04W8/28","Number portability {; Network address portability}","","Personal communications services for intelligent networking, e.g. provisions for portability of subscriber numbers ","H04Q3/005","","","","This place covers: Network addressing is carried out independently of a user's subscription data."
"H04W8/30","Network data restoration; {Network data reliability; Network data fault tolerance}","","Arrangements for maintaining operational conditionError controlCounter-measures to a fault","H04W24/04|H04W28/04|H04L29/14","","","","This place covers: Providing for reliability and fault tolerance of network data; Restoring network data after accidental loss or network malfunction."
"H04W12/00","Security arrangements; Authentication; Protecting privacy or anonymity","","Security arrangements for protecting computers against unauthorised activityArrangements for secret or secure communication","G06F21/00|H04L9/00","When allocating subgroups  -  to patent documents, attention should be made to check whether other subgroups from  -  need to be allocated too for a complete classification.","H04W12/30|H04W12/80|H04W12/02|H04W12/12","","This place covers: Security arrangements for wireless communications networks, e.g. wireless sensor networks, self-organizing wireless networks, wireless local loop, and for near field communication [NFC] networks. It covers: protecting privacy or anonymity protecting confidentiality key management authentication access security integrity fraud detection and prevention mobile application security using identity modules secure pairing of devices context-dependent security lawful interception"
"H04W12/009","{specially adapted for networks, e.g. wireless sensor networks, ad-hoc networks, RFID networks or cloud networks}","","Self-organising networks","H04W84/18","","","","This place covers: Security arrangements specially adapted for wireless communications networks specially adapted for networks such as wireless sensor networks, ad-hoc networks, RFID networks or cloud networks."
"H04W12/02","Protecting privacy or anonymity, e.g. protecting personally identifiable information [PII]","","Selectively restricting mobility data trackingSecurity arrangements for protecting computers, components thereof, programs or data against unauthorised activity; Protecting DataCall monitoring; Call tracing; Detection or prevention of malicious calls","H04W8/16|G06F21/60|H04M3/2281","","","","This place covers: Security arrangements specifically adapted for wireless communication networks for protecting privacy and anonymity comprising, for example: identity privacy, e.g. aliases, pseudonyms or temporary identities, data privacy, e.g. by defining which of the owner's data are visible to other parties, or protecting personally identifiable information [PII], e.g. by using privacy policies or levels, by anonymising or obfuscating or blurring user data like location, by hiding browsing or movement history."
