"cpc_code","title","title_cpc_codes","informative_references","informative_references_cpc_codes","special_rules","special_rules_cpc_codes","glossary_of_terms","definition_statement"
"H04W12/03","Protecting confidentiality, e.g. by encryption","","Security arrangements for protecting computers, components thereof, programs or data against unauthorised activity; Protecting DataArrangements for secret or secure communication, the encryption apparatus using shift registers or memories for blockwise codingArrangements for secret or secure communication; Public key","G06F21/60|H04L9/06|H04L9/30","","","","This place covers: Security arrangements specifically adapted for wireless communication networks for protecting confidentiality of information, e.g. by encryption or ciphering. "
"H04W12/033","of the user plane, e.g. user's traffic","","","","","","","This place covers: Security arrangements specifically adapted for wireless communication networks for protecting confidentiality of user plane, e.g. encrypting user traffic such as SMS, voice, web or application traffic."
"H04W12/037","of the control plane, e.g. signalling traffic","","","","","","","This place covers: Security arrangements specifically adapted for wireless communication networks for confidentiality of control plane, i.e. signalling traffic such as NAS, RRC, Over-The-Air Rekey [OTAR] traffic or M2M trigger traffic."
"H04W12/04","Key management, e.g. using generic bootstrapping architecture [GBA]","","Secure pairing between wireless devicesHand-off or reselection arrangementsArrangements for secret or secure communication; Key distribution","H04W12/50|H04W36/00|H04L9/08","","","","This place covers: Security arrangements specifically adapted for wireless communication networks for key management comprising negotiating, distributing, exchanging, transmitting and validating security keys or credentials.  Typical examples are: Key management by Generic Bootstrapping Architecture (GBA),  EAP-AKA for cellular network, EAP-SIM or EAP-TLS for 3GPP-WLAN interworking, OpenID or Liberty Alliance and GBA interworking, Key agreement via IEEE 802.11x WEP or WPA or WPS push button, e.g. for secure pairing between wireless devices, or Key agreement using reduced power transmission like NFC, graphical codes, infra-red or audio channels, e.g. for the secure pairing between wireless devices."
"H04W12/041","Key generation or derivation","","Handoff or reselection arrangements","H04W36/00","","","","This place covers: Security arrangements specially adapted for wireless communication networks for key generation or derivation, for example: Key derivation for forward and/or backward security for example for securing vertical or horizontal handovers,  Horizontal key derivation, or Vertical key derivations."
"H04W12/043","using a trusted network node as an anchor","","","","","","","This place covers: Key management using a trusted network node as anchor, for example:  Key agreement for handover via EAP-SIM or EAP-AKA or EAP-TLS for 3GPP-WLAN interworking,  OpenID and generic bootstrapping architecture [GBA interworking],  Liberty alliance and GBA interworking."
"H04W12/0431","Key distribution or pre-distribution; Key agreement","","Arrangements for secret or secure communication, Key distribution","H04L9/08","","","","This place covers: Security arrangements specially adapted for wireless communication networks for key distribution using a trusted network node as anchor, e.g. key pre-distribution or key agreement."
"H04W12/047","without using a trusted network node as an anchor","","","","","","","This place covers: Security arrangements specially adapted for wireless communication networks for key management without using a trusted network node as anchor, for example: Key exchange or agreement via Wi-Fi protected setup [WPS],  Key exchange using short range communication, e.g. near field communication [NFC],  Key exchange out-of-band [OOB] methods such as graphical codes, barcodes or Quick Response [QR] codes, infrared, audio waves, light wave, USB dongle, etc. or Peer-to-peer [P2P] key exchange or agreement."
"H04W12/06","Authentication","","Security arrangements for protecting computers, components thereof, programs or data against unauthorised activity, AuthenticationPayment architectures, schemes or protocols, AuthorisationArrangements for secret or secure communicationincluding means for verifying the identity or authority of a user of the system","G06F21/30|G06Q20/40|H04L9/32","","","","This place covers: Security arrangements specially adapted for wireless communication networks for authentication, including authenticating entities such as, e.g. human user(s), device(s), service(s), after consulting network stored entity data or checking theirs credentials (e.g. GSM-AKA, UMTS-AKA, pre-authentication, continuous authentication, authentication using credential vaults or password managers)."
"H04W12/062","Pre-authentication","","","","","","","This place covers: Security arrangements specially adapted for wireless communication networks for performing pre-authentication, e.g. pre-caching and verification of credentials for faster login or IEEE 802.1x pre-authentication in advance to connection setup."
"H04W12/065","Continuous authentication","","Context-dependent security, gesture-dependent or behaviour-dependent","H04W12/68","","","","This place covers: Security arrangements specially adapted for wireless communication networks for performing continuous authentication or implicit authentication, i.e. continuous identity recognition and authentication using, e.g. behavioural biometrics and without explicitly asking the user to provide credentials."
"H04W12/068","{using credential vaults, e.g. password manager applications or one time password [OTP] applications}","","Network security architectures or protocols for supporting authentication in a packet data network","H04L63/08","","","","This place covers: Security arrangements specially adapted for wireless communication networks for performing authentication, using credential vaults, or password management applications or OTP applications. Examples are: generating credentials via device movements or gestures, behaviormetrics for authentication using a learned user behaviour, such as typing or touching or gripping characteristics."
"H04W12/08","Access security","","","","","","","This place covers: Security arrangements specifically adapted for wireless communications network for access security comprising access authorisation to wireless network resources for example using: Authorisation based on an entity's identity, e.g. Access Control Lists ACL, whitelists, blacklists, Authorisation based on profile or attributes assigned to an entity, e.g. verifying current profile against expected one, age attribute verification, Authorisation based on a group or role, e.g. Role Based Access Control [RBAC], Authorisation based security level, Authorisation based on the trust score or the reputation of an entity, Authorisation based on location, e.g. proximity to other entities, allowed locations, Authorisation based on time, e.g. limited time window, within a time range, Revocation of authorisation, e.g. secure disconnect, remote kill or suspend or lock or wipe command, Delegation of authorisation, e.g. OAuth, user centric management of access rights, user consent or approval, Authorisation based on security domains, e.g. controlling access to enterprise security domain or private data security domains, authorisation based on application security domains, e.g. Global Platform domains or authorisation using packet filters or packet firewalls, e.g. SMS Firewalls, NFC or SIM packet filtering."
"H04W12/082","using revocation of authorisation","","","","","","","This place covers: Security arrangements specially adapted for wireless communications network comprising access authorisation to wireless network resources using revocation of authorisation, for example: Secure disconnect, Remote kill command, or Remote lock or remote wipe command."
"H04W12/084","using delegated authorisation, e.g. open authorisation [OAuth] protocol","","","","","","","This place covers: Security arrangements specially adapted for wireless communications network for access authorisation delegation comprising giving authorisation to wireless network resources without sharing credentials, for example: Delegating access or authorisation token, e.g. using OAuth protocol, or  Distributing authorisation tokens after user's consent or approval."
"H04W12/086","using security domains","","","","","","","This place covers: Security arrangements specially adapted for wireless communications network comprising access authorisation to wireless network resources based on security domains, for example: Controlling access to enterprise security domain or private security domain,  Access control based on machine to machine [M2M] security domains, or Authorisation based on application security domains (e.g. Global Platform domains)."
"H04W12/088","using filters or firewalls","","Arrangements for monitoring and testing packet switching networksNetwork architectures or network communication protocols for separating internal from external traffic, e.g. firewalls","H04L43/00|H04L63/02","","","","This place covers: Security arrangements specially adapted for wireless communications network comprising access authorisation to wireless network resources using filters or firewalls, for example: Wireless packet firewalls, SMS firewall, NFC packets filters, or SIM packets filters."
"H04W12/10","Integrity","","Protecting data integrity, e.g. using checksums, certificates or signaturesNetwork security architectures or protocols for verifying the received information","G06F21/64|H04L63/12","","","","This place covers: Verifying information received."
"H04W12/102","Route integrity, e.g. using trusted paths","","","","","","","This place covers: Security arrangements specially adapted for wireless communication networks for verifying or ensuring wireless paths or wireless routes' integrity, e.g. using signatures such as Message Authentication Codes or hash chains."
"H04W12/104","Location integrity, e.g. secure geotagging","","","","","","","This place covers: Security arrangements specially adapted for wireless communication networks for verifying or ensuring location integrity, e.g. using secure geotagging, trusted wireless cell tagging, or wireless location signatures."
"H04W12/106","Packet or message integrity","","Coding, decoding or code conversion, for error detection or error correction; Coding theory basic assumptions; Coding bounds; Error probability evaluation methods; Channel models; Simulation or testing of codes","H03M13/00","","","","This place covers: Security arrangements specially adapted for wireless communication networks for verifying or ensuring packet integrity, e.g. using packet signatures such as Message Authentication Codes."
"H04W12/108","Source integrity","","","","","","","This place covers: Security arrangements specially adapted for wireless communication networks for verifying or ensuring source (i.e. sender) integrity, e.g. using signatures such as Message Authentication Codes to verify the source (i.e. sender)."
"H04W12/12","Detection or prevention of fraud","","Detecting local intrusion or implementing counter-measuresMonitoring arrangements; testing arrangements","G06F21/55|H04L43/00","","","","This place covers: Security arrangements specifically adapted for wireless communication networks for fraud detection or prevention, comprising protecting against rogue devices, e.g. bidding down or downgrading attacks, rogue device or rogue AP or NFC device, selfish nodes, wireless intrusion detection and prevention,  protecting against power exhaustion attacks, e.g. power depletion, starvation attack or sleep deprivation attack, anti-theft arrangements, e.g. protection against identity or service or device theft like SIM cloning or machine to machine M2M displacement, anti-malware arrangements, e.g. protection against SMS fraud or mobile malware,  detecting or preventing attacks on wireless networks or entities (e.g. Denial of Service DoS, DDoS, botnet) or vulnerability assessment of wireless networks or entities."
"H04W12/121","Wireless intrusion detection systems [WIDS]; Wireless intrusion prevention systems [WIPS]","","Context-dependent security, identity-dependent Context-dependent security, radio fingerprint","H04W12/69|H04W12/79","","","","This place covers: Security arrangements specially adapted for wireless communication networks for wireless intrusion detection and protection, comprising: Detecting or preventing intrusions using identifiers in general for example a MAC address, or a Bluetooth address, or Detecting or preventing intrusions using radio fingerprints identifiers."
"H04W12/122","Counter-measures against attacks; Protection against rogue devices","","","","","","","This place covers: Security arrangements specially adapted for wireless communication networks for countermeasures against attacks, e.g. to protect against rogue devices, comprising: Protecting against bidding down or downgrading attacks,  Protecting against rogue WLAN AP or cellular Base Station spoofing legitimate APs or base stations, Protecting against wireless short range (e.g. RFID, NFC, Bluetooth) man-in-the-middle [MITM] or wireless relay attacks, Protecting against selfish nodes dropping legitimate packets or impersonating other nodes, Isolating malicious wireless devices or malicious wireless traffic or Quarantining malicious wireless devices or dropping malicious wireless traffic."
"H04W12/126","Anti-theft arrangements, e.g. protection against subscriber identity module [SIM] cloning","","","","","","","This place covers: Security arrangements specially adapted for wireless communication networks comprising: Anti-theft arrangements, e.g. protection against identity or service or device theft like SIM cloning or machine to machine [M2M] displacement, Anti-malware arrangements, e.g. protection against SMS fraud or mobile malware, Detecting or preventing of attacks on wireless networks or entities, e.g. denial of service [DoS], distributed denial of service [DDoS] or botnet, or Vulnerability assessment of wireless networks or entities."
"H04W12/128","Anti-malware arrangements, e.g. protection against SMS fraud or mobile malware","","Computer malware detection or handling, e.g. Anti-Virus arrangements","G06F21/56","","","","This place covers: Security arrangements specially adapted for wireless communication networks comprising anti-malware arrangements, for example: Protection against SMS fraud, such as premium SMS malware or Protection against mobile malware, e.g. viruses or worms propagating via wireless networks or attacking wireless networks or wireless services."
"H04W12/30","Security of mobile devices; Security of mobile applications","","","","","","","This place covers: Security arrangements specifically adapted for wireless communications networks for mobile device security or mobile application security, for example:  Securing mobile application or mobile service provisioning, securing SIM application provisioning, Securing mobile application download, protecting update thereof, or Managing security policies for mobile applications or mobile devices."
"H04W12/33","using wearable devices, e.g. using a smartwatch or smart-glasses","","Identity modules using near field communicationWireless network protocols or protocol adaptations to wireless operations","H04W12/47|H04W80/00","","","","This place covers: Security arrangements specially adapted for wireless communications networks for protecting application or service provisioning using wearables, for example:  Automatic access to entities such as mobile devices, e.g. unlocking mobile devices using wirelessly enabled wearable devices or Securing mobile applications or services executable or connectable to using wirelessly enabled wearable devices, such as wireless smartwatches, headphones, bracelets, rings, necklaces, smart-glasses, wristbands."
"H04W12/35","{Protecting application or service provisioning, e.g. securing SIM application provisioning}","","Power saving arrangementsNetwork security architectures or protocols for detecting or protecting against malicious traffic","H04W52/02|H04L63/14","","","","This place covers: Security arrangements specially adapted for wireless communications networks for protecting application or service provisioning, for example: Securing SIM application provisioning. Securing mobile application download, protecting update thereof."
"H04W12/37","Managing security policies for mobile devices or for controlling mobile applications","","","","","","","This place covers: Security arrangements specially adapted for wireless communications networks for managing security policies for mobile applications or mobile devices, for example: Managing security policies for mobile applications or devices, using remote mobile device management tools, Parents managing child security policies for wireless devices or mobile applications, or Employers managing employees' security policies for wireless devices or for mobile applications."
"H04W12/40","Security arrangements using identity modules","","Network data management, processing of user or subscriber data Context-dependent security, identity-dependentPayment schemes or models using cards","H04W8/18|H04W12/69|G06Q20/34","When allocating subgroup , attention should be made to check whether other subgroups, e.g.  (using SIM for authentication) or  (using SIM for access security) need to be allocated too for a complete classification.","H04W12/40|H04W12/06|H04W12/08","","This place covers: Security arrangements specifically adapted for wireless communication networks using identity modules for protecting wireless traffic, comprising Using subscriber identity modules SIM, USIM, RUIM, MCIM, ISIM, Secure Element [SE], NFC module, Mobile Trusted Module [MTM], Virtual identity modules, e.g. virtual SIMs or downloadable SIMs for running on an embedded Secure Element [eSE] or embedded Universal Integrated Circuit [eUICC] or embedded SIM [eSIM], Shared identity modules, e.g. shared SIMs, Multiple identity modules, e.g. multi-sim, dual-sim, Near field communication [NFC] enabled identity modules for protecting wireless traffic, e.g. NFC tags, smart tag or radio frequency identification [RFID] module, or Secure binding of identity modules, e.g. securely binding identity modules to a device or a service or an application like Simlock or subsidy lock, binding an SIM to a Relay Node, binding an App to UICC."
"H04W12/42","using virtual identity modules","","Network data management, processing of user or subscriber data Payment schemes or models using cards","H04W8/18|G06Q20/34","","","","This place covers: Security arrangements specially adapted for wireless communication networks using virtual identity modules for protecting wireless traffic, comprising Vrtual SIMs or downloadable SIMs for running on an embedded Secure Element [eSE] or embedded Universal Integrated Circuit [eUICC] or embedded SIM [eSIM]."
"H04W12/43","using shared identity modules, e.g. SIM sharing","","","","","","","This place covers: Security arrangements specially adapted for wireless communication networks using shared identity modules, e.g. SIM sharing between tethered devices and between a SIMless devices and device equipment with a SIM or UICC."
"H04W12/45","using multiple identity modules","","","","","","","This place covers: Security arrangements specially adapted for wireless communication networks using multiple identity modules for protecting wireless traffic, e.g. multi-sim, dual-sim. "
"H04W12/47","using near field communication [NFC] or radio frequency identification [RFID] modules","","","","","","","This place covers: Security arrangements specially adapted for wireless communication networks using near field communication [NFC] enabled identity modules for protecting wireless traffic, e.g. NFC tags, smart tag or radio frequency identification [RFID] module, or NFC enabled SIM or UICC cards."
"H04W12/48","using secure binding, e.g. securely binding identity modules to devices, services or applications","","Network data management for processing of user or subscriber data ","H04W8/18","","","","This place covers: Security arrangements specially adapted for wireless communication networks for the secure binding of identity modules, e.g. securely binding identity modules to a device or a service or an application like Simlock or subsidy lock, binding an SIM to a Relay Node, and binding an App to UICC."
"H04W12/50","Secure pairing of devices","","Affiliation to network using triggered events","H04W60/04","","","","This place covers: Security arrangements specifically adapted for wireless communication networks for securing pairing of wireless devices, for example:  Bootstrapping a secure communication link between pairing terminals or Secure socializing by establishing a secure wireless link between terminals and their respective mobile social network applications, for examples between mobile terminals of friends, family members, guests."
"H04W12/55","involving three or more devices, e.g. group pairing","","","","","","","This place covers: Security arrangements specially adapted for wireless communications networks for securing pairing of wireless devices involving three or more devices, e.g. group pairing, securely joining wireless ad-hoc networks."
"H04W12/61","Time-dependent","","","","","","","This place covers: Time-dependent security arrangements specially adapted for wireless communication networks, e.g. using timestamps, time delays like Round Trip Time RTT or time windows."
"H04W12/63","Location-dependent; Proximity-dependent","","Services making use of location information","H04W4/02","","","","This place covers: Location-dependent or proximity-dependent security arrangements specially adapted for wireless communication networks, e.g. using absolute location or proximity to other devices measured using received signal strength RSS."
"H04W12/64","using geofenced areas","","Services making use of location information, services related to particular areas","H04W4/02","","","","This place covers: Geofenced location aware security arrangements specially adapted for wireless communication networks, e.g. using fenced areas."
"H04W12/65","Environment-dependent, e.g. using captured environmental data","","","","","","","This place covers: Environment-dependent security arrangements specially adapted for wireless communication networks, e.g. using captured environmental data like audio, image, media or temperature."
"H04W12/67","Risk-dependent, e.g. selecting a security level depending on risk profiles","","","","","","","This place covers: Risk-dependent security arrangements specially adapted for wireless communication networks, e.g. arrangements based on risk profiles, risk scores or trust scores derived from social networks (e.g. from mobile friends or buddy lists), or arrangements based on trust scores determined by trusted third party servers. "
"H04W12/68","Gesture-dependent or behaviour-dependent","","","","","","","This place covers: Gesture-dependent or behaviour-dependent security arrangements specially adapted for wireless communication networks, e.g. using gestures or device movement.  Examples are: generating credentials via device movements or gestures, behaviormetrics for authentication using a learned user behaviour, such as typing or touching or gripping characteristics."
"H04W12/71","Hardware identity","","","","","","","This place covers: Security arrangements specially adapted for wireless communication networks using wireless hardware identities, e.g. IMEI, MEID, ICC-ID."
"H04W12/72","Subscriber identity","","","","","","","This place covers: Security arrangements specifically adapted for wireless communication networks using wireless subscriber identities, e.g. MSISDN, IMSI or MSIN."
"H04W12/73","Access point logical identity","","","","","","","This place covers: Security arrangements specially adapted for wireless communication networks using wireless access point logical identities, e.g. AP SSID, ESSID or Base station Cell ID."
"H04W12/75","Temporary identity","","","","","","","This place covers: Security arrangements specially adapted for wireless communication networks using temporary identities, e.g. TMSI, PCID, pseudonym or alias, random or one-time ID, rolling ID, session ID or anonymous ID."
"H04W12/76","Group identity","","Network data management, mobility data transfer","H04W8/08","","","","This place covers: Security arrangements specifically adapted for wireless communication networks using group identities, e.g. group ID, group IMSI, shared identity, pool of identities."
"H04W12/77","Graphical identity","","","","","","","This place covers: Security arrangements specially adapted for wireless communication networks using graphical identities, e.g. graphical codes, barcodes or QR codes."
"H04W12/79","Radio fingerprint","","","","","","","This place covers: Security arrangements specially adapted for wireless communication networks using radio fingerprints, e.g. electromagnetic signature or RF fingerprint."
"H04W12/80","Arrangements enabling lawful interception [LI]","","","","When allocating subgroup  to documents, attention should be made to check whether other subgroups from  -  need to be allocated too for a complete classification.","H04W12/80|H04W12/02|H04W12/128","","This place covers: Security arrangements specially adapted for wireless communications networks for lawful or legal interception.  Note: This group should only be allocated when the technical aspects relate to security arrangements for wireless networks for managing ""lawful interception"" "
