"cpc_code","title","title_cpc_codes","informative_references","informative_references_cpc_codes","special_rules","special_rules_cpc_codes","glossary_of_terms","definition_statement"
"H05K9/00","Screening of apparatus or components against electric or magnetic fields  (devices for absorbing radiation from an antenna H01Q17/00)","H01Q17/00","Screening of human body against electromagnetic influencesAnechoic chambersShielding of Nuclear magnetic Resonance devicesScreening against nuclear radiationConductive materials in general Magnetic materials in generalRFI Filter constructionPrevention of electrostatic charge in general","A61N1/16|G01R29/0821|G01R33/42|G21F|H01B1/00|H01F1/00|H03H1/0007|H05F1/00","","","","This place covers: Screening of electronic equipment against magnetic or electromagnetic fields, or electrostatic discharges; Shielding features applied to rooms or buildings for protecting against external electromagnetic interference; Shielded electronic casings achieving electromagnetic compatibility; Shielding features of electronic equipment having standardized dimensions, such as 19-inch racks; Shielding materials therefor."
"H05K9/0001","{Rooms or chambers  (anechoic chambers G01R29/0821)}","G01R29/0821","Building construction in generalNuclear magnetic resonance","E04B|G01R33/42","","","",""
"H05K9/0005","{Shielded windows}","","Windows for building construction in general","E06B5/00","","","",""
"H05K9/0066","{Constructional details of transient suppressor}","","Protective circuits","H02H","","","",""
"H05K9/0067","{Devices for protecting against damage from electrostatic discharge}","","Materials for electrostatic discharge protection","H05K9/0079","","","",""
"H05K9/0075","{Magnetic shielding materials}","","Magnetic material in generalFor transformerFor electrical motor","H01F1/00|H01F27/28|H02K11/00","","","",""
"H05K9/0077","{comprising superconductors}","","Superconductors in general","H01L39/00","","","",""
"H05K9/009","{comprising electro-conductive fibres, e.g. metal fibres, carbon fibres, metallised textile fibres, electro-conductive mesh, woven, non-woven mat, fleece, cross-linked}","","Screening during electrotherapy","A61N1/16","","","",""
"H05K10/00","Arrangements for improving the operating reliability of electronic equipment, e.g. by providing a similar standby unit","","","","","","",""
"H05K11/00","Combinations of a radio or television receiver with apparatus having a different main function {(combined with clocks G04B47/00; controlled by a clock G04C21/28)}","G04B47/00|G04C21/28","","","","","",""
"H05K13/00","Apparatus or processes specially adapted for manufacturing or adjusting assemblages of electric components","","Manufacture of printed circuit boardsAssembling printed circuits with electric componentsApparatus and methods for solderingManipulatorsPackaging, Packing or unpackingManufacture or treatments of solid state devices","H05K1/00|H05K3/30|B23K|B25J|B65B|H01L21/00","","","","This place covers: Apparatus and methods for placing components, e.g. onto the printed circuit boards.This group only relates to bare printed circuit boards and not circuit boards already fitted in an apparatus (thus no displays or hard disks, etc.)."
"H05K13/0007","{using handtools  (for mounting on a circuit board H05K13/0447)}","H05K13/0447","","","","","","This place covers: Hand-tools specially adapted for adjusting assemblages of electric components"
"H05K13/0015","{Orientation; Alignment; Positioning}","","Orientation, alignment and positioning of the printed circuit boards for testing","G01R31/00","","","","This place covers: orientation, alignment and positioning only of the printed circuit boards"
"H05K13/003","{Placing of components on belts holding the terminals}","","Attaching a series of articles, e.g. small electrical components, to a continuous web ","B65B15/04","Only concerns filling of belts as a separate operation","","","This place covers: preparing the components before delivering to mounting machines by grouping the components for batch mounting"
"H05K13/0038","{placing the components in a predetermined order}","","Attaching a series of articles, e.g. small electrical components, to a continuous web","B65B15/04","Must concern different type of components","","Beltcontinuous web holding the components in order to be delivered in rolls to the mounting machines","This place covers: Filling of belts according to the mounting order of different types of components."
"H05K13/0053","{Arrangements for assisting the manual mounting of components, e.g. special tables or light spots indicating the place for mounting}","","Hand-tools for mounting electric components on a circuit board","H05K13/0447","","","","This place covers: Manual mounting posts for components on PCB"
"H05K13/0061","{Tools for holding the circuit boards during processing; handling transport of printed circuit boards}","","Transport of articles, e.g. conveyors Apparatus specially adapted for handling semiconductor or electric solid state devices during manufacture or treatment thereof","B65G|H01L21/67","Documents must include movement of printed circuit board","","","This place covers: Provision for displacing printed circuit boards [PCB] between machines or for displacing PCBs inside mounting machines Gripping PCBs for transport or conveyance"
"H05K13/0069","{Holders for printed circuit boards}","","Fixation of printed circuit boards in testing machines","G01R31/00","Printed circuit board must be static relative to holder.","","ChuckHolder, usually using vacuum","This place covers: Fixation of printed circuit boards inside mounting machines"
"H05K13/0076","{Straightening or aligning terminal leads of pins mounted on boards, during transport of the boards}","","Straightening or aligning terminal leads of pins mounted on boards, during the mounting operation, after fitting components on the board","H05K13/0473","Components are not definitively fixed.","","","This place covers: Transport of boards temporary fitted with components before definitive fixation, e.g. soldering."
"H05K13/0084","{Containers and magazines for components, e.g. tube-like magazines}","","Filling of containersUse of said containers in mounting machinesContainers for storage or transport ","H05K13/02|H05K13/04|B65D","","","Sticktube-like container","This place covers: Any type of container for delivering components to mounting machines and manufacture thereof Details of component tubes, trays or belts."
"H05K13/0092","{Treatment of the terminal leads as a separate operation  (during transport H05K13/0076, H05K13/023; during mounting H05K13/04)}","H05K13/0076|H05K13/023|H05K13/04","","","Must be a separate machine.","","Clinchingbending of leads","This place covers: Preparing leads of components before bringing to mounting machines Special separate machines for lead treatment."
"H05K13/02","Feeding of components","","Emptying of containers by the mounting machine itselfFeeding of components in general","H05K13/04|B65G","","","","This place covers: Feeding of components to containers before fitting said container to machines, e.g. filling or refilling of containers"
"H05K13/021","{Loading or unloading of containers  (H05K13/028 takes precedence)}","H05K13/028","","","Do not classify here documents concerning pick and place in the mounting machine","","","This place covers: Loading or unloading containers with components, the containers not being in use by the mounting machine."
"H05K13/022","{with orientation of the elements}","","Orientation in general","B23P19/00","","","","This place covers: Giving orientation to components before feeding into containers"
"H05K13/023","{with bending or straightening of the terminal leads}","","Treatment of the terminal leads as a separate operation (not during transport)Bending and cutting after the mounting on a pc board","H05K13/0092|H05K13/0473","Not during or after mounting of component.","","","This place covers: Feeding of components with bending or straightening of the terminal leads, e.g. in order to fit into containers"
"H05K13/024","{Straightening or aligning terminal leads}","","","","","","","This place covers: Straightening or aligning leads during the feeding"
"H05K13/025","{of components having oppositely extending terminal leads}","","","","","","","This place covers: Straightening or aligning leads of e.g. resistors"
"H05K13/026","{of components having terminal leads in side by side relationship, e.g. using combing elements}","","","","","","Dual in linechip with two rows of parallel leads","This place covers: Straightening or aligning lead of chips."
"H05K13/027","{Fluid transport of components}","","","","","","","This place covers: Transport of components using fluids, e.g. jets of air, water."
"H05K13/028","{Simultaneously loading a plurality of loose objects, e.g. by means of vibrations, pressure differences, magnetic fields}","","Orientation of the elements","H05K13/022","","","","This place covers: Feeding bulk components simultaneously to containers"
"H05K13/029","{Feeding axial lead components, e.g. using vibrating bowls, magnetic fields  (H05K13/022 takes precedence)}","H05K13/022","","","","","","This place covers: Feeding bulk axial components to containers."
"H05K13/04","Mounting of components {, e.g. of leadless components}","","Assembling printed circuits with electric componentsManipulators","H05K3/30|B25J","","","","This place covers: Mounting of components such as: mounting machines for components on printed circuit boards; attaching containers to mounting machines for components delivery."
"H05K13/0404","{Pick-and-place heads or apparatus, e.g. with jaws}","","Manipulators","B25J","Orientation while holding component is not classified here","","Jawsgripping device having means moving towards each other for pinching component","This place covers: Pick-and-place-heads for picking components out of a container and placing them on a printed circuit board using gripping devices."
"H05K13/0408","{Incorporating a pick-up tool}","","Manipulators","B25J","Orientation while holding component is not classified here","","Nozzlevacuum or air suction device","This place covers: Pick-and-place-heads for picking components out of a container and placing them on a printed circuit board by suction, e.g. using vacuum."
"H05K13/0413","{with orientation of the component while holding it; Drive mechanisms for gripping tools, e.g. lifting, lowering or turning of gripping tools}","","","","","","Vision systemcamera","This place covers: Orientation of component held by mounting head just before or during mounting. Mechanical and vacuum holders for components with orientation provisions. Vision devices for orientation or correct placing of components. Includes camera looking at the PC boards before mounting"
"H05K13/0417","{Feeding with belts or tapes}","","","","Interconnection/splicing of belts/tapes to be classified in .","H05K13/021","Blister, belt, tapeBelt or tape wound on a reel/roll and carrying electronic devices","This place covers: Delivery of components to a mounting machine via belts or tapes; tape feeders; attachment of tape feeders to the mounting machine; details related to the picking up of components by mounting head from tapes/belts."
"H05K13/0421","{with treatment of the terminal leads}","","Feeding one by one by other means than beltsBending and cutting after fitting on a circuit board","H05K13/043|H05K13/0473","","","","This place covers: Treatment of leads during or after picking up."
"H05K13/0426","{for components being oppositely extending terminal leads  (H05K13/0421 takes precedence)}","H05K13/0421","","","","","","This place covers: For resistor type components."
"H05K13/043","{Feeding one by one by other means than belts}","","","","","","","This place covers: Delivery of single components by other type of containers."
"H05K13/0434","{with containers}","","Components belts","H05K13/0417","","","","This place covers: Delivery with containers, e.g. trays."
"H05K13/0439","{incorporating means for treating the terminal leads only before insertion}","","","","","","","This place covers: Treatment of leads before insertion."
"H05K13/0443","{incorporating means for treating the terminal leads before and after insertion or only after insertion}","","","","","","","This place covers: Treatment of leads before and/or only after insertion."
"H05K13/0452","{Mounting machines or lines comprising a plurality of tools for guiding different components to the same mounting place  (H05K13/0406, H05K13/041 take precedence)}","H05K13/0406|H05K13/041","","","Multiple work tables and multiple heads, e.g. revolver heads, are classified here","","Revolver headturning multiple head with multiple nozzles or grippers","This place covers: Mounting machine for several types of components. Mounting of different type of components to the same mounting place. Multi nozzle machines Machines with several holders for pc boards"
"H05K13/0456","{simultaneously punching the circuit board}","","Hole shaping and details of holes ","H05K3/00","","","","This place covers: Mounting machines including hole puncher"
"H05K13/046","{Surface mounting  (surface mounted components H05K3/341)}","H05K3/341","","","","","SMDSurface mounted device","This place covers: Methods and apparatus for surface mounting electric components in general"
"H05K13/0465","{by soldering  (H05K13/0469 takes precedence)}","H05K13/0469","Surface mounting on PCBs by solderingReflow soldering apparatus and process; Soldering process per se","H05K3/341|B23K","","","","This place covers: Soldering machines of surface mounted components"
"H05K13/0469","{by applying a glue or viscous material}","","Details of glue fixation between component and PC board ","H05K3/00","","","","This place covers: Use of glue or viscous material with dispenser nozzles."
"H05K13/0473","{Cutting and clinching the terminal ends of the leads after they are fitted on a circuit board}","","Cutting and clinching the terminal ends of the leads after they are fitted on a circuit board during transport","H05K13/0076","","","","This place covers: Treatment of leads after insertion out of mounting process"
"H05K13/0478","{Simultaneously mounting of different components}","","","","","","","This place covers: simultaneous mounting of different components placed on PC board at the same moment."
"H05K13/0482","{using templates; using magazines, the configuration of which corresponds to the sites on the boards where the components have to be attached}","","","","","","","This place covers: Simultaneous mounting of different components being arranged beforehand in preset positions. Templates, trays and special multi heads."
"H05K13/0486","{Replacement and removal of components}","","","","No recycling.May include a de-soldering device","","","This place covers: Method and apparatus for taking off or replacing misplaced components"
"H05K13/0491","{Hand tools therefor}","","","","No recycling.","","","This place covers: Hand tools for repairing printed circuit boards or exchanging components."
"H05K13/0495","{having a plurality of work-stations}","","","","","","","This place covers: Arrangements of mounting machines in clusters or lines"
"H05K13/06","Wiring by machine","","Multiplex wire bundles for vehicles","B60R","","","","This place covers: Placing of wires on or in printed circuit boards by machines; machines therefor."
"H05K13/065","{Accessories therefor, e.g. light spots}","","","","","","","This place covers: Accessories for wiring, e.g. special tables or light spots."
"H05K13/08","Monitoring manufacture of assemblages","","Electrical testing of finished printed circuit boards","G01R31/00","","","","This place covers: Control or planning of manufacturing processes of assemblages, e.g. of processes for mounting components on printed circuit boards Control of apparatus therefor Planning of production facilities and apparatus layout Visual inspection after placing of components"
